,section,headline,summary,date
123,Capital Journal,"White House, Chamber Have Shot at Reconciling",Chamber CEO Thomas Donohue insists he has no desire to extend the arguing between the U.S.'s premier political institution and its most visible business institution.,20101015
124,Fund Track,These Bond Funds Are More Mature,"Two ETF providers have begun offering ""end-date"" or ""bullet"" bond ETFs in the past year, holding a portfolio of bonds all maturing in the same year and answering a key criticism of other bond ETFs—that they never mature.",20101015
125,Private Properties,"AIG's Sosin Buys, Ex-Bear Stearns CEO Schwartz Sells","Derivatives pioneer Howard Sosin buys in Palm Beach, Fla. Also, AC/DC bassist Cliff Williams lists a renovated 19th-century townhouse in Savannah, Ga., and his longtime home in Fort Myers, Fla.",20101015
126,Books,The Hard Work of an Effortless Pose,"In ""The Noël Coward Reader,"" Barry Day brings to life a playwright, director, actor and singer whose versatility and boulevardier image misled people into thinking him facile. Alexandra Mullen reviews.",20101015
127,Donor of the Day,Getting Kids to Eat Their Veggies,An executive at Focus Features is leading an effort to raise $2 million to launch New York's first Edible Schoolyard Academy.,20101015
128,Heard on the Street,Lacking Logic,"In fact, since the end of 2008, the dollar index has dropped 4.9% but the oil price has jumped 86.1%. America's lax monetary policy causes all sorts of distortions and reeks of economic manipulation. But it is a bit rich for an oil cartel to be complaining about that sort of thing.",20101015
129,Opinion,The Education of Barney Frank,The benefits of a competitive election.,20101015
130,Agenda,Weber's Tough Talk Could Hurt ECB bid,"Terence Roth:  The ECB has probably earned the right to throw a little more weight around. There will be more to come if the ECB's next president is Axel Weber, which must be an unnerving prospect for weaker euro-zone members.",20101015
131,Bruce Palling on Food,Is French Fare a Spent Force?,"The debate over whether the heart has gone out of French cuisine is a serious question that even the French are asking, perhaps with more concern for the consequences than foreigners.",20101015
132,Asia,Japan Scrambles for Rare Earth,Japan is scrambling to find alternative rare-earth supplies amid China's move to slash shipments of the critical metals used by high-tech companies and auto makers.,20101015
133,Opinion,Homage to Home,"Condoleezza Rice's ""Extraordinary, Ordinary People,"" is a very personal book, in which the author's aim is to give thanks to her fiercely protective parents.",20101015
134,Earnings,LVMH's Sales Jump 24%,French luxury-goods company LVMH Moët Hennessy Louis Vuitton expressed confidence for this year as it reported a 24% jump in third-quarter sales.,20101015
135,Opinion,Rozalind Dineen: The Scent of a Businesswoman,Justine Picardie's new biography of Coco Chanel plumbs some of the mysteries of her life.,20101015
136,Commercial Real Estate,Big Banks Face Foreclosure Review,"The Office of the Comptroller of the Currency is examining big mortgage servicers' foreclosure practices, a move that could lead to regulatory reprimands of banks for botched foreclosure documentation.",20101015
137,IPOs,NetSpend Delays IPO on Issuer's Troubles,"NetSpend, a prepaid-debit-card company, is postponing its IPO until next week after regulatory problems at its preferred issuing bank, MetaBank, cast a shadow over their partnership.",20101015
138,New York Sports,Spare Us Talk of the Rangers' Playoff History,It is a sharp contrast between the two teams. But the Yankees' rich postseason history and the Rangers' lack of one is the most overplayed angles of this ALCS.,20101015
139,Arts & Entertainment,From Zombies to Lawyers,"Coming attractions: The new slate of basic-cable shows tackle horror, sitcoms and gritty dramas. A ""Friends"" for vampires.",20101015
140,Fashion,Coolhunter: Blofield Sofa,"The idea of an inflatable, properly ""sittable"" sofa seems inspired. Easily portable, it would be the sort of thing you could put up or take down at a moment's notice.",20101015
141,Wine,In Search of Barolo,"If any wines improve with cellaring, it is red wines; they undoubtedly improve with at least 10 years on the label. One of wine columnist Will Lyons's favorite meatier reds is the Barolo.",20101015
142,Real Estate,Chinese Property Prices Rebound,"Property prices in China rebounded in September, underscoring the government's continuing struggle to stabilize a soaring real-estate market.",20101015
143,Food,Mastering the Art of French-Japanese Cuisine,"Taking over Tokyo's popular L'Osier wasn't easy for Bruno Menard, but the French chef promised to make sure that the three-Michelin-starred restaurant stayed full, and he has kept his word.",20101015
144,New York Politics,Quinn Sinks Sick-Leave Plan,"Council Speaker Quinn scuttled an effort to require all employers in New York City to provide workers with paid sick leave, siding with the business community against her usual liberal allies.",20101015
145,New York Culture,"Hard-Bop, Key Chops And Country Stomps","Bill Charlap's peerless piano playing leads an all-star, countryfied weekend of live jazz in the city.",20101015
146,Culture,Rhys Chatham Brings the Noise,"Avant-garde guitarist Rhys Chatham returns to the Kitchen, the performance space where, in 1971 at age 19, he served as music director. But this time he's playing the trumpet.",20101015
147,Europe Business,ECB Hawks Call for Bolder Steps,Top officials called on politicians to show more courage as they finalize new rules for the governance of the euro zone.,20101015
