,section,headline,summary,date
121,Credit Markets,A Telling Week for Treasurys,"The coming week will set the tone for trading in U.S. Treasury debt in early 2010, with a hefty slate of economic data culminating in the December jobs report.",20100104
122,Heard on the Street,German Bonds: Safe Haven or Not?,Bond investors should beware becoming too comfortable with the idea that Germany is somehow immune from trouble.,20100104
123,Europe News,Pledges Launch U.K. Race,The U.K.'s two main political parties will kick off a busy election year with pledges designed to show each as the party that will defend key public services.,20100104
124,Business,China Citic to Sell Bonds,China Citic Bank intends to sell up to US$3.7 billion worth of subordinated bonds and hybrid debt next year to replenish its capital.,20100104
125,US,Fed Chief: Rate Hikes Must Be an Option,"Bernanke said the Fed must be open to raising interest rates to pop asset bubbles, but he blamed lax regulation for the housing crisis.",20100104
126,World,Taliban Member Claims Retaliation,An Afghan Taliban commander involved in the suicide bombing against the CIA said the attack was retaliation for U.S. drone strikes in the region.,20100104
127,The Year Ahead,"In '10, Economy Crowds Domestic Stage","If the big domestic story of 2009 was an economic crisis and its ripple effects in the real world, 2010 will be about cleaning up after the crisis and the political toll it will take.",20100104
128,Markets,Rusal IPO to Raise Up to $2.59 Billion,The Russian aluminum giant's initial public offering documents also offer a glimpse into the company and at billionaire Oleg Deripaska.,20100104
129,Business,"Stock, Bond Sales Rebounded in '09",A burst of giant share sales by U.S. banks aiming to move out of government ownership capped a strong rebound in stock and bond sales during 2009.,20100104
130,Business,Total Buys Texas Gas-Field Stake,Total will pay $2.25 billion for a stake in a Chesapeake natural-gas field in Texas as international energy giants try to catch up after missing out on large U.S. gas discoveries.,20100104
131,Markets,Recession Takes Bite Out of Global M&A,"Global mergers-and-acquisition activity for 2009 was $2.3 trillion, down 22% from 2008, the lowest dollar value since 2004.",20100104
132,Opinion,The Biggest Losers,Behind the Christmas Eve taxpayer massacre at Fannie and Freddie.,20100104
133,Opinion,Immigration Agency Loosens Up,"Thanks for your coverage of the critical issues arts organizations face when bringing artists to the U.S. (""Send Us Your Tired, Your Poor, But Only if They're 'Culturally Unique,'"" page one, Dec. 10). After the article was published, and with no prompting from us, U.S. Citizenship and Immigration Services notified us that visas for Orquesta Kef were approved. There was no explanation as to why they had changed their minds or even that they had changed their minds. We contacted the supervisor who sent the email and were told that the agency decided ""to process an appeal themselves"" and that the review showed that the visa should have been granted. No one has ever heard of the USCIS spontaneously reviewing their own decision. This can only be attributed to the Journal article that shined the light of day into what has been an entirely closed process.",20100104
134,Tech,Samsung Reports Higher LED TV Sales,"Samsung said it sold 2.6 million LCD televisions with LED backlight technology in 2009, up from its initial target of around 2 million, and forecast sales of 10 million units this year.",20100104
135,Markets,China Still Has Appetite for M&A,"Analysts expect outbound deals to continue, especially in the resources sector. Deals involving foreigners investing in Chinese companies are far less likely.",20100104
136,Business,"Geely, Volvo to Operate Apart",Geely said it is looking at ways to cooperate with Volvo after its parent company completes the acquisition of the Ford unit.,20100104
137,Opinion,Did Democrats Dodge A Hillarycare Bullet?,"Gerald Seib concludes his Capital Journal column (""The Choice Facing Democrats,"" U.S. News, Dec. 15) by saying that the Democratic Party lost 54 House seats and 10 Senate seats in 1994 because it failed to pass ""Hillarycare"" and, thus, ""had nothing to show its troops for the effort."" Is it not equally feasible that the ""troops"" decided, ""Whew! We dodged that bullet! Let's get them out of there before they try it again!""",20100104
138,Middle East News,Questions Emerge Over Suspect's Path,Authorities tracing the whereabouts of Abdulmutallab are working to determine where the would-be bomber's extremism was ignited.,20100104
139,Options,Options Trading Grew Up in 2009,"The options market attracted many new investors in 2009, leading to a record amount of trading in a year when experts expected volume to decline.",20100104
140,Foreign Exchange,Wanted for Dollar Rally: A Strong Jobs Report,The recent dollar rally faces a test this week in the form of the U.S. employment report. Encouraging data could shift expectations about when the Fed will start to tighten monetary policy and underpin the dollar in the opening weeks of 2010.,20100104
141,Business,China Reports New Milk Scare,A milk recall in China evoked an earlier scare involving the chemical melamine that prompted authorities to revise food-safety laws and pledge more transparency.,20100104
142,Ahead of the Tape,U.S. Data Offer an Uncertain Compass,"It's not yet clear whether manufacturing's rebound will extend much beyond cars. And while employers have nearly exhausted their supply of workers to fire, they don't yet feel a need to add more.",20100104
143,Asia News,Fuel Spill Hits China River,Chinese workers threw floating dams across a major waterway to prevent a diesel spill from flowing into the Yellow River and poisoning the drinking water for millions of Chinese.,20100104
144,International,Chinese Evade U.S. Sanctions on Iran,Chinese companies banned from doing business in the U.S. for allegedly selling missile technology to Iran continue to do a brisk trade with Americans.,20100104
145,Tech,AT&T Severs Ties With Woods,"AT&T said it is ending its sponsorship agreement with Tiger Woods, joining consulting firm Accenture in dropping support for the golfer after allegations of affairs.",20100104
146,In the Lab,Latest Front in War on Arthritis,Scientists looking for ways to repair damaged cartilage—a leading cause of osteoarthritis—are employing horses to test a new method of tissue regeneration that uses concentrated stem cells.,20100104
147,The Count,When Did Buying Baseball Tickets Get So Complicated?,"Minnesota Twins fans are looking forward to their new domeless stadium next season, but they've got an issue to handle before passing the turnstiles: figuring out which tickets to buy.",20100104
148,Commodities,Higher Prices May Spur U.S. to Plant More Cotton,"After three years of lower acreage, cotton may make a comeback in 2010, especially in Texas.",20100104
149,Heard on the Street,Japan Risks a Third Lost Decade,Japan needs to take radical action if the government is to achieve its targets for the next 10 years.,20100104
