,section,headline,summary,date
116,New York Sports,Red Sox Sweep Stumbling Yanks,"Now that Jorge Posada and the Yankees are one big family again, there's nothing to distract from the fact that the Yankees just got blown out—in their house—by the rival Red Sox.",20110517
117,Opinion,Israel Will Never Have Peace,"This weekend's border-crossing demonstrators believe, like Hamas, that the Jewish State has no right to any territory from the river to the sea.",20110517
118,Opinion,A River Roars Through It,The debate over the future of the Mississippi is a talk worth having.,20110517
119,New York Politics,Cuomo Seeks New Pension Tier,Gov. Andrew Cuomo is proposing a new pension plan that would offer less-generous retirement packages to future state and local workers but would largely preserve the state's traditional system of guaranteed benefits.,20110517
120,Technology,Netflix to Stream Miramax Movies,Netflix reached a deal to stream hundreds of movies from the Miramax collection.,20110517
121,Politics,Bernanke Backs R&D Spending,"Fed Chairman Bernanke made the case for public research funding, saying government spending on research and development can help boost economic growth.",20110517
122,Deals & Deal Makers,Gold One Agrees to Takeover Offer,Gold One International said it has accepted a takeover offer from a Chinese consortium that values the Africa-focused gold producer at $634 million.,20110517
123,Credit Markets,Bank Lending Goes Long on High Quality,"Banks are lending more to high-quality U.S. companies, and for longer periods, enabling companies to set aside cheap rainy-day funds and build war chests for acquisitions.",20110517
124,Opinion,"Maybe Not a Heidegger, but It Doesn't Make Him Right","Bret Stephens's designation of Martin Heidegger as ""the most significant philosopher of the 20th century"" is something of an insult to philosophy and philosophers (""From Chomsky to Bin Laden,"" Global View, May 10). There have been many better, clearer minded, and more moral philosophers than Heidegger.",20110517
125,Business,Trade Pacts Tied to Worker Aid,The White House won't submit trade deals for congressional approval until Republicans renew aid to workers displaced by foreign competition.,20110517
126,Speakeasy,Maya Rudolph Is Ready,"Maya Rudolph talks about ""Bridesmaids,"" improv comedy, and her time in New York.",20110517
127,Art,A Wreck of Art That Was No Accident,Brooklyn Industries founder Vahap Avsar has returned to his first career with a new exhibit on the Bowery that features a burned-out NYPD police cruiser.,20110517
128,Europe Business,Europe Ministers Wrestle Over Aid,"European finance ministers heaped pressure on Greece to make fresh budget reforms and raise cash by selling state assets, even as they debated giving the country billions more in emergency loans.",20110517
129,The Galleon Case,Galleon Defense Worked—to a Point,"Two jury consultants hired by Raj Rajaratnam to help choose the panel that would decide his fate got everything they wanted, except the result.",20110517
130,Opinion,The Aggrandizing Madoff Trustee,"Regarding your editorial ""Madoff and the Mets"" (May 11): The Trustee's quest for Madoff assets has certainly led to abuses of power against not only the Wilpons, but many other Madoff victims.",20110517
131,Media & Marketing,Trump Won't Seek White House,"Donald Trump said he won't run for president and will continue to host ""The Celebrity Apprentice.""",20110517
132,IPOs,Chinese IPOs No Longer Sizzling,U.S. investors have swarmed to Chinese initial public offerings since last fall. But that love affair may be fading.,20110517
133,Business,Japan: Reactor Woes Won't Delay Cleanup,Japan reiterated a pledge to bring the Fukushima Daiichi nuclear plant under control within nine months.,20110517
134,Food & Drink,Padma Lakshmi: Inspiring America's Next Top Cocktails?,"Pity the poor lady who never gets a cocktail created in her honor. On Sunday at the Box, ""Top Chef"" host Padma Lakshmi actually got four.",20110517
135,Arts & Entertainment,"Oh, and It Helps to Have Talent, Too","Have bustier, will travel, seems to be the message of the Rock & Roll Hall of Fame's 'Women Who Rock' exhibition, Jim Fusilli finds.",20110517
136,Education,Tertiary Education Booms In Iraqi Kurdistan,"Northern Iraq's Kurdish region has now become an oasis for education. Over the past five years, about 15 new universities have opened in the area.",20110517
137,Business,Pollution Rule Delayed Amid Cost Complaints,"The Obama administration suspended a new regulation aimed at cutting pollution from boilers at oil refineries, chemical plants and other factories, amid complaints by a range of industries over the potential cost.",20110517
138,Health,Troops in Mideast Face Breathing Ills,U.S. veterans who served in Iraq and Afghanistan have a higher rate of debilitating respiratory illness than those deployed elsewhere.,20110517
139,Politics,Medicare Revamp Exposes GOP Divide,"Gingrich's dismissal of the House Republican plan to overhaul Medicare provoked a rebuttal from the proposal's author, Rep. Ryan, highlighting a split over how hard to push a priority for the House GOP majority.",20110517
140,Latin America,Mexico Drug Gang Blamed for Massacre,"Guatemalan officials said Monday that Mexico's most brutal drug cartel was responsible for the massacre of at least 27 people, who were decapitated, the country's worst mass killing in years.",20110517
141,Asia,New Thai Candidacy,Allies of ousted Thai leader Thaksin nominated his sister as candidate for premier.,20110517
142,U.S.,A Liftoff as Giffords Looks On,"Space shuttle Endeavour blasted off for the final time Monday as Rep. Gabrielle Giffords—whose husband, Mark Kelly, is commanding the mission—looked on from the roof of the launch-control center, her staff said.",20110517
143,Deals & Deal Makers,Canadian Firms Defend TMX Counterbid,A consortium of nine of Canada's largest banks and pension funds defended their $3.72 billion bid for the operator of the country's flagship stock exchange amid concerns their plan could meet objections from competition regulators.,20110517
144,Deals India,Profile: The New Breed of Green Techies,There's a new breed of technology entrepreneurs in India. Deals India takes a close look at three such green-technology ventures in various stages of their development cycle.,20110517
145,Business,Enforcer Tapped for New York Agency,"New York Gov. Andrew M. Cuomo nominated his chief of staff and longtime ally, Benjamin M. Lawsky, to lead the state's new financial-services agency.",20110517
146,Opinion,"At Cape Canaveral, the Rocket's Red Glare","Watching Endeavour's last launch with my two daughters, I realized that when it comes to exploring space I want America to be in the driver's seat.",20110517
147,Health,Calls for FDA to Regulate Hair Straighteners,Members of Congress are asking the Food and Drug Administration to issue a voluntary recall of two hair-straightening treatments sold in salons under the brand name Brazilian Blowout.,20110517
148,Health,Pills Offer Easier Way to Treat MS,A number of new multiple-sclerosis medications that are beginning to hit the market promise to make it easier for patients to control flare-ups of the disease and slow its progression.,20110517
149,Whats News Business Finance Asia,What's News,Here are the top business stories from today's Wall Street Journal Asia.,20110517
