,section,headline,summary,date
105,Deals India,Deals India: Morning News Roundup,"News roundup from Indian newspapers, news wires and Web sites on Thursday, July 7, 2011. Deals India has not verified the stories from other media organizations and does not vouch for their accuracy.",20110707
106,Asia House of the Day,On the Bay in Bintan,"Just an hour away by boat from Singapore, rustic Bintan seems a world away from its bustling neighbor—the Indonesian island is often used as a weekend respite for busy Singaporeans. At the northwest tip of the island, a cluster of villas developed by Banyan Tree have been on the market.",20110707
107,Photos,Pyeongchang: An Olympic City,"The International Olympic Committee chose Pyeongchang, South Korea, on Wednesday to host the 2018 Winter Olympics. It defeated Annecy, France, and Munich, Germany.",20110707
108,Technology,Apple Readies New iPhone,"According to some suppliers of components to Apple, the new version of the iPhone is expected to be thinner and lighter than the iPhone 4 and sport an 8-megapixel camera.",20110707
109,New York,Strauss-Kahn Defense Pushes to Drop Case,"Prosecutors face two critical questions before deciding how to proceed in the tottering case against former International Monetary Fund chief Dominique Strauss-Kahn: Are they convinced he sexually assaulted a hotel maid and, if so, can they prove it?",20110707
110,Politics,Higher Taxes Yield to Cuts in States,Forty-six states began a new fiscal year after lawmakers spent the spring hashing out budgets that largely avoid big tax increases in favor of budget cuts.,20110707
111,Decos and Corrections,Corrections & Amplifications,"Corrections & Amplifications for the edition of July 7, 2011",20110707
112,Business,Frisbee Caught in Patent Battle,"Wham-O, maker of Frisbees, will go to court to argue against a law that has prompted lawsuits against companies for labeling items with numbers for expired patents.",20110707
113,Family Finances,Read This Before You Die,More documents you need to prepare and make accessible for your survivors.,20110707
114,New York Real Estate,U.N. Building Plan Proceeds,"After getting a green light from Albany, the United Nations is expected to push ahead with a plan to build an office tower on a playground near its headquarters.",20110707
115,Whats News Business Finance Asia,What's News,Here are the top business stories from today's Wall Street Journal Asia.,20110707
116,S.F. Bay Area,The Kids Are All Right...Running the Company,"Young company founders are growing in number and prominence in Silicon Valley, another sign, tech-watchers say, of how the Internet is changing entrepreneurship.",20110707
117,Markets,German Move Roils Greek Talks,"European governments' plan for private-sector creditors to help with Greece's next bailout without triggering a default were thrown into doubt, as senior German officials resurrected a once-rejected proposal that would cost investors more.",20110707
118,The Count,The Women's Game Is Hardly the Same,"Dominating possession has become all the rage in soccer, but not at the Women's World Cup.",20110707
119,Happy Hour,Cocktails on the Terrace,"Enjoying a cocktail at Yotel, a recently opened West Side hotel, will remind some of the last time they were tipsy at an exclusive airport lounge.",20110707
120,Opinion,Paul C. Light: The Easy Way Washington Could Save $1 Trillion,How an independent agency could squeeze $1 trillion in savings from the bureaucracy.,20110707
121,N.Y. Mets,Bautista's Afternoon as a Met,"Toronto's Jose Bautista has done little on a baseball field over the past 16 months that has escaped attention. Yet there is one aspect of his career that remains forgotten: He was, for one afternoon seven years ago, a New York Met.",20110707
122,Earnings,HTC to Buy U.S. Graphics Firm,"Keen to expand overseas, Taiwan-based HTC announced the purchase of S3 Graphics of the U.S. for $300 million.",20110707
123,Ask Teri,Dressing Well After Retirement,"Teri Agins on dressing smart, post-retirement.",20110707
124,S.F. Bay Area,Stadium Plan Puts Hercules in Bind,"Officials in Hercules, Calif., are locked in a fight with a company that builds historic-replica baseball parks after dropping plans to build an estimated $20 million sports complex, which the city said it no longer can afford.",20110707
125,Autos,Colors Struggle in Silver-Car Nation,"South Korean culture is becoming more prominent around the world, but at home, style often boils down to fitting in. For many people, owning a colorful car is out of the question.",20110707
126,Opinion,Alan M. Dershowitz: Casey Anthony—The System Worked,"Even if it is ""likely"" or ""probable"" that she committed the murder, she must be acquitted. The standard is proof beyond a reasonable doubt.",20110707
127,Spaces,Castle in the Bronx,"Owners Alec Diacou and Suzi Arensberg have put their Norman revival-style home on the market for $2.995 million. The property, located in the landmarked Fieldston area inside the Riverdale neighborhood, is said to be modeled on a castle in Croatia.",20110707
128,Opinion,Proposed Defense Cuts Aren't All That Deep,"Donald Rumsfeld misses the mark in """" (op-ed, July 1). The $400 billion in cuts proposed by the president are far from deep.",20110707
129,New York,New Acquittals in Fatal Fire,"An asbestos abatement supervisor and his employer, John Galt Corp., were acquitted of manslaughter charges stemming from the deaths of two New York City firefighters at the former Deutsche Bank tower.",20110707
130,House of the Day,Traditional Ibiza Finca,"This six-bedroom 18th-century farmhouse is situated at the center of Ibiza, with views across the island to neighboring Formantera and the mountains of mainland Spain.",20110707
131,U.S.,'I Could Train Someone to Do It Within a Few Hours',Medical experts say surgically implanting explosive devices into the body is medically feasible and wouldn't require extensive training,20110707
132,Economy,"U.S., Mexico in Truck Deal",The U.S. and Mexico agreed to end a ban of nearly two decades on Mexican trucks entering the U.S.,20110707
133,Mossberg's Mailbox,Needing Flash in the Fall,Walt Mossberg answers a student's question on finding a laptop or tablet for school that runs Adobe Flash Player.,20110707
134,Asia,Pakistan Won't Let Bin Ladens Depart,"An independent Pakistani commission investigating the U.S. raid that killed Osama bin Laden has barred the family of the former al Qaeda leader from leaving the country, setting it up for a potential conflict with the country's military.",20110707
135,House of the Day,Rehoboth Beach Vacation Retreat,"To accommodate a growing family that includes six young grandchildren, the owners of this vacation home in Delaware moved the living areas and added more bedrooms.",20110707
136,Capital,"In Fiscal Skirmish, Code Words Provide Cover for Politicians","If their words are to be believed, the fiscal showdown between President Barack Obama and congressional Republicans depends on what the meaning of the phrase ""tax increase"" is.",20110707
137,New York Crime ,Murder Charges Filed in '86 Death,A man who was one week away from being released from prison after spending five years behind bars for weapons possession was suddenly charged with a murder that happened in a Manhattan park more than two decades ago.,20110707
138,Sports,Jeter Set to Join Exclusive Club,"Here's the entire 3,000 hit club—from all-time leader Pete Rose on down—ranked by their total number of career hits. We've included the date they hit No. 3,000.",20110707
139,Business,Transocean Clears Oil Rig Off Ghana,Transocean evacuated more than 100 workers from a deep-water drilling rig off the coast of West Africa after it began taking on water.,20110707
140,Law,U.S. Antitrust Chief to Step Down,"U.S. antitrust chief Christine Varney plans to join law firm Cravath, Swaine & Moore as a partner later this year.",20110707
141,Deals & Deal Makers,Temasek Reins In China Bet,Temasek raised a total of $3.62 billion by selling parts of its stakes in Bank of China and China Construction Bank in a deal that underscores concerns about Chinese banks's growing debt.,20110707
142,Opinion,Henninger: The Fast and the Spurious,The Supreme Court's videogame ruling is what the culture war is really all about.,20110707
143,Technology,Web Growth Sparks Data-Center Boom,"Many investors continue to pile into the data-center business, one of the few hot spots in real estate, but others fear the peak in the market for the giant computer warehouses may be past.",20110707
144,Baseball,"Over the Mountain, Over the Hill?","As Derek Jeter finally approaches 3,000 hits, is he too old to be the shortstop the New York Yankees need?",20110707
145,S.F. Bay Area,Where Data Depend on Catching a Wave,Start-up Liquid Robotics collects data and plans to let customers access the information over the Web. But the company's product stands apart: It makes remote-controlled robotic devices that gather information while cruising the open ocean.,20110707
146,Urban Gardner,Wading Into a Waste Case,"Ralph Gardner Jr. meets with opponents to a proposed Upper East Side marine transfer station—in other words, a temporary garbage dump.",20110707
147,Agenda,Signals to Expect From ECB's Trichet,European Central Bank chief Jean-Claude Trichet's monthly news conference on Thursday could be among the most significant in recent memory.,20110707
148,Opinion,We Should Learn From the Mistakes in the DSK Case,"Dominique Strauss-Kahn may be the embodiment of the intellectual rot and hypocrisy of the European left, but it is undeniable that the basic principle of ""innocent until proven guilty"" was not applied in his case.",20110707
149,Executive Education,Business-School Bulletin,"In January, the University of Pennsylvania's West Coast business campus will move to the top floor of the Hills Plaza building. Plus, Howard goes online with its executive M.B.A. degree, and more.",20110707
