,section,headline,summary,date
112,Economy,Vietnam Looks to Slash Public Spending,"Vietnam is expected to cut public investment by $2.4 billion or 7.4% this year, the central bank said, in its latest attempt to restore economic stability.",20110331
113,Deals India,Pledging Shares for Capital,"The trend of promoters of Indian companies pledging shares to raise money is back. Sometimes, parent companies are pledging shares of smaller group firms to raise debt to fund the former's growth, acquisition and even buyback of shares.",20110331
114,Deals India,Tulip's Data Center Unit Interests Buyers,"Tulip Telecom has received bids from 25 to30 companies, mostly foreign firms, to buy up to 30% stake in its wholly owned data center unit. The company wants to raise $60 million for further expansion.",20110331
115,Deals India,DoCoMo Ups Investment in Tata Venture,"Japanese telecom firm NTT DoCoMo will make an additional investment of 8 billion rupees, or $179 million, in India's Tata Teleservices via a rights issue, part of the Japanese firm's strategy to expand its presence in the country.",20110331
116,Autos,Honeywell to Build Turbocharger Plant in Slovakia,"Honeywell International confirmed it will build a new turbocharger manufacturing plant in Presov, Slovakia, amid growing demand by auto makers for the fuel-efficiency boosting technology.",20110331
117,Earnings,Foxconn Swings to Loss,"Contract handset maker Foxconn International said it swung to a full-year net loss on higher production costs and falling product prices, and the company said it must urgently step up efforts to cut costs and secure new customers.",20110331
118,Deals & Deal Makers,Taylor Wimpey Sells North American Operations,U.K. home builder Taylor Wimpey said it is selling its North American operations for $957 million as it refocuses on the U.K. property market.,20110331
119,Europe,EU Pins Down 9 Indicators to Gauge Imbalances,Senior European government officials have drawn up a list of nine key indicators that should be used to signal whether a country is developing potentially dangerous economic imbalances.,20110331
120,Economy,Sales Data Push Aussie to Another High,"Australian consumers in February shrugged off the effects of some of the nation's worst natural disasters and returned to the high street, boosting retail sales beyond economists expectations.",20110331
121,Asia Technology,SK Telecom Considers Blockbuster Bid,"South Korea's SK Telecom is considering a bid for U.S. movie-rental chain Blockbuster, which filed for bankruptcy court protection last year.",20110331
122,Deals India,Smartlink Board OKs Cable Unit Sale,India's Smartlink Network Systems' board has approved the sale of the company's structured cabling business to a unit of Schneider Electric for 5.03 billion rupees in cash.,20110331
123,Law,Suit Against SAC Capital's Cohen Dismissed,"The former wife of SAC Capital Advisors founder Steven A. Cohen can't pursue a lawsuit against the hedge-fund manager, a judge has ruled.",20110331
124,Opinion,"Jamie Whyte: Adults of the World, Unite!",The 'right' amount of alcohol is the amount we consume voluntarily.,20110331
125,Sports,Has Baseball's Moment Passed?,The national pastime is struggling with a phenomenon that could prove more destructive than steroids or dwindling World Series ratings. Too many kids are choosing to play other sports.,20110331
126,Asia,China Executes Three Filipinos,"China executed three convicted Filipino drug couriers, triggering grief and anger in the Philippines that threatened to undermine an already tense relationship between the two countries.",20110331
127,Heard on the Street,Search for High-Growth Media Leads to Google,"As media companies go, Google is a supercharged growth stock. It's about time investors started treating it as such.",20110331
128,None,Corrections & Amplifications,"Corrections & Amplifications for the edition of March 31, 2011",20110331
129,Heard on the Street,Heavyweight Currencies Slug It Out in Nanjing,"The meeting of G-20 ministers over the role of the dollar in the international financial system isn't likely to yield a decision on what should be the world's reserve currency. That means the dollar, yuan and euro will battle for the title.",20110331
130,New York Sports,"'Melo and a Late Win, Again","As two big acquisitions squared off in the cross-river rivalry, Carmelo Anthony showed why he was the top trade target for both teams.",20110331
131,The Middle Seat,Outsmart Airlines to Get Best Seat,"With seat layouts and ratings for 720 different airplanes flown by 100 different airlines, SeatGuru.com has become the authoritative source for cabin information.",20110331
132,Technology,Google Loses Ground in China,"A year after Google moved its search services out of China in a feud with Beijing, the Internet giant is struggling to maintain traction on a range of businesses in the country.",20110331
133,Markets,TARP Watchdog Spars Over 'Too Big to Fail',"In his final day on the job, a federal bailout watchdog squabbled publicly with a Treasury official over the legacy of the $700 billion Troubled Asset Relief Program as both individuals testified before lawmakers.",20110331
134,Middle East,Gadhafi Push Tests Allies,"Forces loyal to Gadhafi continued to push rebels out of positions along coastal oil towns, further delaying the rebel drive on Tripoli and testing the limits of the coalition air strikes at a time when the alliance is considering arming Gadhafi's opponents.",20110331
135,None,Paulson-Led Group Pushes Lehman Plan,A group of bondholders including Paulson & Co. wants a bankruptcy judge to consider its competing reorganization plan for Lehman Brothers on the same timetable as the plan Lehman filed.,20110331
136,Asia,Edano: Japan to Welcome Further Nuclear Help,"Japan has improved its ability to tap into the knowledge of nuclear experts from around the world and plans to use the foreign help more in addressing its nuclear crisis, the government's chief spokesman, Yukio Edano, said.",20110331
137,Music,It's Another Kind of 'Early Music',None,20110331
138,Asia,Radiation Traces Found in U.S. Milk,"The U.S. government said that traces of radiation have been found in milk in Washington state, but said the amounts are well below levels of public health concern.",20110331
139,Ahead of the Tape,Is That a Bear or a Bull in the Corn Field?,"Ahead of the Tape:  Crop prices have declined recently, but they may not remain under pressure for too long.",20110331
140,MLB,The Knicks Have a Hole in the Middle,"In the 20 games the Knicks have played since their February trade for Carmelo Anthony, four players have started at center, and none has been able to lay claim to the position.",20110331
141,Heard on the Field,Billingsley Shows Love for Los Angeles,"Chad Billingsley gives the Los Angeles Dodgers a discount. Plus, India beats Pakistan at the Cricket World Cup and the swag behind VCU's swagger.",20110331
142,Opinion,Marian L. Tupy: Foreign Aid Isn't the Answer,Africa exemplifies how aids spoils economic growth and discourages democratic reform.,20110331
143,Opinion,From Nixon to Obama,Bad energy speeches are a Presidential tradition.,20110331
144,Middle East,CIA Operatives Are Aiding Rebels,"The Central Intelligence Agency has placed covert operatives on the ground in parts of Libya, feeding intelligence on ground targets to the U.S. military and coalition forces for airstrikes and reaching out to rebels aligned against Col. Moammar Gadhafi.",20110331
145,S.F. Bay Area,Cities Seek to Turn Over Policing Role,Some Bay Area cities struggling with declining revenue are taking steps to merge police operations or outsource the agencies to county sheriff departments.,20110331
146,Business,Tip of the day,"When the PGA Tour's Houston Open was moved to the week before the Masters in 2006, tournament officials drew up a radical strategy to attract the world's best players. They moved Augusta National to the middle of Texas.",20110331
147,Markets,Minkow Pleads Guilty in Fraud Case,Former stock-fraud investigator Barry Minkow pleaded guilty to conspiracy to commit securities fraud.,20110331
148,MLB,Duda Ready to Replace Bay,Mets general manager Sandy Alderson said Lucas Duda would take Bay's roster spot if they put him on the disabled list.,20110331
149,Cultural Conversation,Building Jazz Its Own Home,"In May, SFJazz will break ground on the first freestanding structure designed and named for jazz. Larry Blumenfeld has a Cultural Conversation with the organization's visionary artistic director, Randall Kline.",20110331
