,section,headline,summary,date
111,Business,U.S. Says Iran Firm Bypassed Sanctions,New York prosecutors have accused Iran's largest shipping company of illicitly moving more than $60 million through New York bank accounts in violation of U.S. trade sanctions.,20110621
112,Heard on the Field,Rutgers Stadium Gets Naming-Rights Deal,Two guys who never went to college are now naming the biggest building on Rutgers University's campus.,20110621
113,Markets,Paulson Is Selling Sino-Forest Stake,Paulson & Co. is selling off what is left of its collapsed investment in China forestry company Sino-Forest Corp.,20110621
114,Opinion,The Chinese Awakening,Signs of protest against Communist Party control.,20110621
115,Ahead of the Tape,Housing Troubles Have Deep Foundations,Federal Reserve Chairman Ben Bernanke may be right that recent rises in food and energy prices are transitory. If only the same were true of weakness in the housing market.,20110621
116,Business,Coal Miners Union Sets Pension Deal,"The United Mine Workers of America reached a deal with a coal-industry association to preserve pensions for nearly 120,000 current retirees, their dependents and active miners, but it agreed to a shift toward 401(k) plans for miners hired in 2012 and beyond.",20110621
117,Opinion,"Greek Lessons, Modern and Ancient","We are now learning from the Greeks that democracy leads to socialism, which in turn leads to bankruptcy.",20110621
118,Opinion,Wal-Mart's Class Victory . . .,The Supreme Court says some lawsuits are too big to succeed.,20110621
119,House of the Day,Restored Medieval Tower,"This 14th-century fortified tower in Umbria, Italy, with views along the Upper Tiber Valley toward Assisi, has been modernized into a six-bedroom family home.",20110621
120,N.Y. Yankees,What About Nunez?,Derek Jeter's backup at shortstop may have a future in the Bronx.,20110621
121,Heard on the Street,No Appreciation for the Rising Yuan,It's been a year since the yuan's peg to the dollar ended. But what's been achieved is mixed.,20110621
122,Business,Fuel Savings Spur Orders at Air Show,Orders for more than 200 aircraft valued at a total above $20 billion were announced on the opening day of the Paris Air Show as airlines sought planes with improved fuel efficiency.,20110621
123,Middle East,Tunisia Convicts Former President,"A Tunis criminal court convicted Zine al-Abidine Ben Ali, Tunisia's deposed president, of embezzling state funds, and sentenced him to 35 years in prison, the first conviction of a North African ruler since the start of the Arab Spring revolution that has swept the Middle East.",20110621
124,Law,Green Card Applicants Sue Over Glitch,A lawsuit has been filed against the State Department in federal court seeking to reinstate thousands of potential green-card winners whose chance of obtaining U.S. residency was scuttled because of a government computer error.,20110621
125,Photos,Doing Business In...,"Track the top companies or individuals flying into airports in select cities between Jan 1, 2007 and Jan 1, 2011.",20110621
126,Opinion,Alan Blinder: The GOP Myth of 'Job-Killing' Spending,Drastic expenditure cuts would imperil a shaky economy that still isn't generating enough jobs.,20110621
127,Commodities,Greek Debt Fears Fail to Spur Flight to Gold,Gold settled slightly higher on concerns and uncertainty as European officials made little progress in resolving Greece's sovereign-debt troubles and further financial aid was delayed.,20110621
128,Health,High Court Will Hear Appeal by Mayo Clinic,The U.S. Supreme Court agreed to consider whether to set limits on when companies and inventors can patent medical diagnostic tests.,20110621
129,Management,Executive Learns From Hack,"Hyundai Capital CEO Ted Chung's experience has led to fundamental changes in the structure of the company, as well as his own thinking about how he leads it.",20110621
130,Heard on the Street,Market Calls the Shots on Greece,It took the biggest one-day point drop in Dow history to change Congress's mind about voting down a $700 billion bailout program in 2008. What will it take to get Europe to truly address the Greek problem?,20110621
131,House of the Day,Atlanta Mid-Century Modern,"Furnished with antiques, items from the owner's days in medical school and a tiger rug from India, this Atlanta home dates to the 1950s. It features walls of glass that overlook the more than six-acre property's two lakes.",20110621
132,Whats News Business Finance Asia,What's News,Here are the top business stories from today's Wall Street Journal Asia.,20110621
133,Middle East,Syria's Assad Nods to Critics,"Syrian President Bashar al-Assad wavered between concession and defiance in his first public address in over two months, saying for the first time that some protesters had legitimate demands, but repeating his justification for a military crackdown.",20110621
134,Music,Dancing in the Swirl of Skirl,"In Windsor Terrace, Chris Speed is making sure Brooklyn's best jazz sees the light of day.",20110621
135,Markets,FTC Launches Oil-Trading Probe,"The agency is examining whether oil companies, refiners or traders have manipulated crude-oil markets, the latest government action spurred by the rise in fuel prices.",20110621
136,Health,How Random-Matrix Theory Found Its Way Into a Promising AIDS Study,Random-matrix theory is a mathematical method for finding hidden correlations within masses of data.,20110621
137,Business,Merchants Shred Costs of Plastic,Merchants are racing to lower their costs when customers pay with plastic.,20110621
138,Middle East,Obama to Specify Afghan Troop Cuts,"President Barack Obama will announce on Wednesday how fast he plans to pull 33,000 surge troops out of Afghanistan, rolling back a troop build-up that was intended to halt the Taliban's momentum, administration officials said.",20110621
139,Capital Journal,"In Battle Over Medicare, New Prescription Needed","When it comes to Medicare, the bad news for all of us is that the temptation to resort to demagoguery rather than solutions to Medicare's problems remains alive and well.",20110621
140,New York Politics,Stalemates Lock Albany,"Gov. Andrew Cuomo and lawmakers on Monday headed into legislative overtime after failing to find their way out of stalemates on gay marriage, rent laws and other contentious issues.",20110621
141,Technology,Web Addresses Enter New.Era,The organization that regulates the world's Internet domain names approved changes that will allow companies and individuals to potentially register any name they like in almost any language.,20110621
142,Business,Lending Battle Is Risky Business,"Banks and other lenders are engaged in an increasingly pitched fight for some corporate borrowers, raising concerns that the banks are not charging enough to cover the risk they are taking on.",20110621
143,Jason Gay,Shiny Happy Superstars,"Where have all the sports jerks gone? Everywhere you look, nice guys are finishing first.",20110621
144,Asia,"Rebel Leader Visits China, Bolstering Ties","China said a top leader from Libya's rebel National Transitional Council will begin a two-day visit on Tuesday, the second publicly announced meeting between Chinese officials and Libya's main rebel group.",20110621
145,Heard on the Field,Albert Pujols May Not Be Too Missed,The Cardinals have enough depth that they should be able to survive without Albert Pujols. Venus Williams tries out a new look at Wimbledon. And James Shields of the Rays becomes an innings eater.,20110621
146,Technology,FCC Will Weigh Phone-Fee Rules,The FCC will begin considering new rules to prevent phone companies from adding unauthorized fees to consumers' monthly bills.,20110621
147,New York Culture,Turning Toward Blood and Law,"Bronx-born Actor Gabriel Macht chats about his new series ""Suits"" and his family's history in law.",20110621
148,Politics,State to Run Detroit's Worst Schools,The worst-performing public schools in Detroit will be removed from the city's school system and run by a new state authority charged with turning them around within five years.,20110621
149,What's Your Workout?,A Hitmaker Makes Waves,"Never a fan of working out, Chris Blackwell, founder of Island Records, had a fitness epiphany: He discovered riding a jet ski was both fun and good exercise.",20110621
