,section,headline,summary,date
113,Autos,Chrysler Plans At Least One New Upscale Jeep,Chrysler is expected to revive a high-performance—and higher price—version of its Jeep Grand Cherokee later this year. The 2012 Grand Cherokee SRT will compete in the market dominated by BMW and Mercedes.,20110112
114,None,Republicans Shift Themes in Shooting Debate,"Potential GOP presidential candidates, pressed to address the rampage in Arizona, are bringing up themes such as the need to strengthen the family and the broader threat of Islamic fundamentalist violence.",20110112
115,U.S.,Giffords's Outlook Improves,"U.S. Rep. Gabrielle Giffords remained in critical condition after brain surgery, but doctors said that she would survive Saturday's shooting.",20110112
116,ROI,"Can Apple Hit $1,000?","Apple reached an all-time high of $344 this week. Here's what would have to happen for the company to get to $1,000.",20110112
117,Sports,Soccer Clubs Warned Over Finances,"After years of splashing astronomical fees and sky-high wages on superstar players, European football's ruling body is poised to tackle reckless spending by the region's biggest teams.",20110112
118,Jason Gay,Musburger's Quip Said a Mouthful,Sportscaster's 'This is for all the Tostitos' line after the game-winning field goal  in the BCS title game marked a seminal moment in the marriage of sports and the corporate world.,20110112
119,None,Verizon Unveils iPhone Plan,"Verizon Wireless will start selling Apple's iPhone 4 early next month, ending AT&T's exclusive hold over the blockbuster smartphone and shaking up the industry.",20110112
120,New York Real Estate,Fendi Scion Finally Finds Condo Buyer,"A scion of the Fendi family, the 85-year-old luxury-goods company famous for its handbags, sold a Midtown apartment after cutting and then raising the price several times over nearly two years.",20110112
121,Work & Family,Teens Take Elders to Tech Boot Camp,"Teens can be motivational technology teachers for the elderly because of their enthusiasm and agility with gadgetry. But, oh, the eye-rolling.",20110112
122,Asia,U.S. Export Financing Challenges China,"The Export-Import Bank of the U.S. is taking on China's export machine, in a deal designed as a model for developed nations to challenge China in markets around the world.",20110112
123,Urban Gardner,Elaine's Ashes,"While the Urban Gardner studiously avoids controversy, there is one mildly upsetting recent news story he feels moved to comment upon: the disposition of restaurateur Elaine Kaufman's ashes.",20110112
124,None,Teenager Killed In Bronx Fight,"A fight between two groups of teenagers, organized over cellphone text messages, turned deadly when a 15-year-old participant in the Bronx street brawl was shot and killed.",20110112
125,Heard & Scene,"Actors, Directors Face Their Critics","Inferiority complexes were something of a theme Monday. The New York Critics Circle has been bestowing its honors since 1935. Of course, some of these awards go to people who've been given bad reviews in the past.",20110112
126,Technology,German Officials Break Off Google Talks,"German regulators have broken off talks with Google over its Google Analytics tool, warning that German companies that use it could face legal action and fines.",20110112
127,N.Y. House of the Day,Green Home in the Hamptons,"This boxy home in Sag Harbor, N.Y., was designed and built by a husband and wife design team with green features, including a geo-thermal system, an ethanol fireplace and furnishings made of sustainable fabrics.",20110112
128,Opinion,China's Military Rise No Real Threat,"Your recent news article (""A Chinese Stealth Challenge?,"" page one, Jan. 5) fosters the notion that China poses a military threat to the U.S. But you fail to cite one rational reason why China would wish to war with its best customers in an economy that depends upon international trade with the West, particularly the U.S.",20110112
129,New York Sports,"Like With Manning, Jets Shouldn't Blitz Brady",The numbers say any chance for a Jets upset of Tom Brady and the Patriots will require a conservative defensive approach without too many blitzes.,20110112
130,Opinion,Kelley Currie: An American Message for the Chinese President,Freedom of expression should be the leitmotif of the summit.,20110112
131,New York Crime ,Mayor Cites Gap In Gun Sale Database,New York City Mayor Michael Bloomberg outlined on Tuesday a series of steps to prevent another shooting tragedy following the assassination attempt of an Arizona congresswoman.,20110112
132,Eyes on the Road,Detroit's Dream Cars,Does America need a party wagon with clamshell doors? Joe White looks at the concept cars to be unveiled at the Detroit auto show.,20110112
133,New York Region,Storm Sweeps Into Northeast,"The Northeast hunkered down for a major snowstorm, while the South struggled to find its footing as lingering ice and snow snarled air traffic and kept the region largely at a standstill.",20110112
134,Sports,Tip of the Day,"If it seems like the 2010 tennis season was basically a series of big events that ended with Rafael Nadal jumping up and down with a trophy, that's because it's pretty much true.",20110112
135,Art,Works of Creative Destruction,"When the Menil Collection offered Vija Celmins the opportunity to select the subject for an exhibition of her work, she surprised by choosing a set of less-known early works that differ radically from her later ones.",20110112
136,The Pop Scene,"From Ska to Soul, a Flavor for Every Tastemaker","This week's pop-music calendar features appearances by Mavis Staples, Broken Social Scene and the Toasters.",20110112
137,Heard on the Street,Goldman Shows Some Ankle,Goldman Sachs is trying to give investors more insight into how it makes money. But don't wait for the firm's trading black box to become crystal clear.,20110112
138,Asia,Floods Slam Australian City,"Parts of the downtown district of Brisbane were emptying out as frightened residents and workers fled floods that have ravaged the state of Queensland, killing more than 10 people and displacing thousands.",20110112
