,section,headline,summary,date
112,India Business,India Number Portability Trend Favors GSM,"India's top mobile telephony companies, especially those using the popular GSM platform, are the initial beneficiaries of a facility that allows people to change their service providers while retaining phone numbers.",20110215
113,Asia,"For Big Bonuses, Bankers Go East","Bankers focused on China and Southeast Asia look to be big winners as global investment banks focus their diminished bonus pool on their biggest growth region, but those involved with the payouts say a rising tide won't lift all boats.",20110215
114,Photos,Heavy Snows Grip Asia,"Harsh spells of snowfall hit Asian cities, burying cities in eastern South Korea and blocking the only road link to Kashmir.",20110215
115,Economy,French Economy Fails to Accelerate,"French economic growth failed to accelerate in the fourth quarter of 2010, although gross domestic product growth for the whole year was in line with the government's forecast of a 1.5% expansion, data showed.",20110215
116,Earnings,Westpac's Cash Earnings Fall,"Westpac said its fiscal first-quarter cash earnings fell about 3%, falling short of its peers' performances, and the Australian lender warned that insurance claims from recent natural disasters could rise.",20110215
117,India Business,Sequoia Announces New Team for India Business,"Sequoia Capital India Advisors said a new five member management team will head its India business, replacing four top executives exiting the private equity firm to set up another fund.",20110215
118,World News,"Iraqis Protest Power Cuts, Corruption","Inspired by the protests in Egypt and Tunisia, hundreds of demonstrators gathered Monday in central Baghdad, but their demands centered on day-to-day issues such as power cuts and poor housing, rather than any attempt to topple the Iraqi government.",20110215
119,Real Estate,Luxury Housing Boom Takes a Breather,"Sales of $1 million apartments in India have slowed just as Donald Trump wants to enter the market. Buyers can negotiate better deals, says Shefali Anand, India personal finance writer.",20110215
120,New York Politics,Top N.J. Democrat to Propose Change in Health Spending,"New Jersey's Senate president will propose an overhaul to the way the state's public workers pay for health care, requiring higher-paid employees to spend more for coverage.",20110215
121,Photos,Marc Jacobs Fall 2011 Collection,"Designer Marc Jacobs presented his Fall 2011 collection at Lexington Armory Monday night, with styles ranging from minimalist to Victorian—and lots of polka dots.",20110215
122,Photos,Vera Wang Fall 2011 Collection,"Designer Vera Wang presented her fall collection in New York, featuring flowing dresses, fur details and sheer pleats.",20110215
123,Heard on the Street,"Rotation, Not Revolution Driving EM Selloff",The shift out of emerging markets wasn't a traditional pullback from risk to safety; instead it was a rotation of risk appetite.,20110215
124,The Count,Terriers No Longer Dominate Westminster,Terriers have won Best in Show at the Westminster Kennel Club Dog Show 45 times. But much of the group's dominance at Westminster owes to terriers' early success against a much shallower pool of competitors.,20110215
125,Opinion,The Advantages of an Emissions Tax,"I support the concept of phasing in a tax on greenhouse gas (GHG) emissions (not just carbon dioxide) as outlined by Alan Blinder (""The Carbon Tax Miracle Cure,"" op-ed, Jan. 31).",20110215
126,Cars,Biodiesel Boom Puts Drivers in Grease Trap,A small but growing band of drivers are fueling their cars and trucks with used frying oil. But they have a new problem: corporate competition.,20110215
127,New York Culture,Not-So-Secret Agent,Perhaps the biggest beneficiaries of the opening of Agent Provocateur's flagship store were taxi drivers dropping off party guests on Madison Avenue. Two cabbies almost bumped into each other while gawking.,20110215
128,Asia Business,Foster's Unveils Wine Spinoff,"Foster's unveiled a plan to divest its wine business after nearly nine months of effort, and said fiscal first-half net profit fell 12% from a year ago on troubles in the domestic beer market.",20110215
129,Rock & Pop Music,From Punk to Pacifism,"Having set aside the punklike ferocity of her early work, PJ Harvey in her latest album, ""Let England Shake,"" examines what she calls a continuum of war and her passion for home.",20110215
130,World at a Glance,World Watch,Here is a selection of news from around the world from today's Wall Street Journal Europe.,20110215
131,Management,Two St. Joe Board Members Resign,"Investors Bruce R. Berkowitz and Charles M. Fernandez resigned from the board of St. Joe Co. just six weeks after they joined, adding more confusion at the real-estate developer, which is caught in the middle of a battle for control.",20110215
132,New York Culture,Bloomberg to Donate $32 Million to Arts,"A year after ending a charitable program that pumped nearly $200 million into hundreds of arts and social-service organizations, Mayor Bloomberg is reopening the pipeline to his personal fortune through his multibillion-dollar family foundation.",20110215
133,Opinion,The Cambodian Case for Dollarization,Phnom Penh should use its stock exchange opening later this year as an opportunity to formally adopt the U.S. dollar.,20110215
134,Technology,Nokia Eyes '11 Phone Launch,"Nokia hopes to launch its first smartphone based on Microsoft's Windows Phone platform this year, Chief Executive Stephen Elop said in an interview.",20110215
135,Health Journal,Are Routine Pelvic Exams Necessary?,"A commentary in a prominent women's health journal argues that for healthy women with no symptoms of disease, a routine pelvic exam serves little purpose.",20110215
136,Photography in Los Angeles,Charmed and Dangerous,William Meyers on four must-see West Coast photo exhibitions.,20110215
137,Technology Report,Meet the Rainmakers,"It might be a nascent technology, but the competitive landscape for cloud computing is already brutal.",20110215
138,Fashion Week,"Coats, Cowls Warm Up the Runway","Having weathered a particularly harsh winter along with the masses, New York designers have made outerwear a dominant trend on the runway.",20110215
139,Technology Report,Top 10 Life-Changing Apps,"From a handy way to store a range of passwords to an application that will help keep track of ongoing alcohol consumption, The Wall Street Journal Europe presents 10 apps you can't live without.",20110215
140,Opinion,Pakistan's Undiplomatic Bungle,Everything that could go wrong has in the Davis murder case.,20110215
141,World News,Clinton Seeks Web Freedoms,"Secretary of State Hillary Clinton will intensify pressure on Middle East governments to ensure open access to the Internet, as social media sites continue to play a central role in organizing political movements across the Arab world and Iran.",20110215
142,U.S.,Cash Softens a Trade Blow,Some U.S. furniture makers and their lawyers have found a reliable way to cash in on trade policies that bar Chinese imports at unfairly low prices.,20110215
143,Heard on the Street,Obama's Taxing Deficit Targets,President Obama's budget calls for repeal of an accounting treatment for inventories and a financial-crisis fee for banks. Neither is likely to get far—again.,20110215
144,Law,Expired-Patent Costs Defy Forecasts,"The settlements paid by companies for listing expired patent numbers on consumer goods appear to be lower than many defense attorneys feared, government figures indicate.",20110215
145,Donor of the Day,Rockefeller Foundation Sees Social-Change Dividend,"The Rockefeller Foundation is banking on paying for social change that works. To that end, the foundation will this week announce a $400,000 grant to the Nonprofit Finance Fund, a nonprofit financing organization.",20110215
146,Politics,Defense Outlays Would Fall for First Time Since 9/11,"The administration is counting on a sharp drawdown in troops in Iraq to achieve a first since the Sept. 11, 2001, terror attacks: a decrease in total defense spending.",20110215
147,Heard on the Street,"For Bubble 2.0, Security Analysis 1.0","With another Internet boom taking off, giddy investors shouldn't lose sight completely of old-fashioned security analysis.",20110215
148,Latin America,Argentina Holds Confiscated U.S. Cargo,"Argentina said it confiscated U.S. government property from a U.S. Air Force cargo plane last week, straining already delicate relations between the countries.",20110215
149,Earnings,FedEx Cuts Outlook,"FedEx lowered its profit outlook for the current quarter, citing cost pressures from severe winter storms and rising fuel prices.",20110215
