,section,headline,summary,date
118,Potomac Watch,Strassel: The Senate's Lawsuit Factory,Trial lawyers use a controversial case to undermine the arbitration system.,20110722
119,New York Culture,"MAC, Pugh Toast Deal","Though it was sweltering at the New Museum, British designer Gareth Pugh donned his typical all-noir ensemble to announce a collaboration with MAC cosmetics that will launch this fall.",20110722
120,Opinion,I'll Pay You Tuesday For More Debt Today,"The Obama Administration's ill-defined pledge of future fiscal restraint in exchange for raising of the debt-ceiling is, Karl Rove says, like Lucy van Pelt, the football, and the ever-gullible Charlie Brown (""Obama Owns the Debt-Ceiling Fiasco,"" op-ed, July 14)",20110722
121,TV Review,Therapy as Shock Treatment,"Lisa Kudrow's self-obsessed psychotherapist treats her patients without remorse—or credentials—in ""Web Therapy.""",20110722
122,Opinion,Margaret Hoover: How the GOP Can Win Young Voters,"With 37% of millennials unemployed or underemployed, the party has a shot.",20110722
123,Collecting,The Value of Old Money,"Demand for rare, old money remains strong. Bonhams will hold a sale featuring ancient coins to early 20th-century paper money in London, while Baldwin's will hold an auction of Islamic coins and medals with more than 800 lots.",20110722
124,Photos,Urban Homes for Empty Nesters,"Tour homes in New York, San Francisco and Philadelphia with an appeal for empty nesters.",20110722
125,Art & Auctions,A Palace's Small Treasures,The shock of the small is the chief pleasure of a superbly installed exhibition at the Queen's Gallery in Buckingham Palace that displays royal toys made by Fabergé.,20110722
126,European Life,Hitting the Summer Highways in France,"Tour de France cyclists and families departing on holiday hit the French roads each summer. Both wind their way through the country's diverse scenery, but if it's speed you're looking for, it's best to stick to two wheels.",20110722
127,Europe,A Guide to the New Deal on Greece,Answers to your questions about the Greek bailout.,20110722
128,Review,Katie Mitchell's Feminine Mystique,"In her production of Thomas Heywood's ""A Woman Killed with Kindness"" at the National Theatre, director Katie Mitchell alters the balance of guilt in a modern, feminist version of the 1602 play.",20110722
129,New York Culture,"Finding Closet Space for 75,000 Garments","Since the 1970s, the Theatre Development Fund has amassed thousands of garments from Broadway, Off-Broadway, opera and occasional film and TV productions. But its Manhattan rent got too expensive, it had to look for a new closet.",20110722
130,Politics,"Obama, Boehner Advance Toward Deal",President Barack Obama and House Speaker John Boehner are moving toward a deficit-reduction deal that could cut as much as $3 trillion in spending and overhaul the tax code by the end of next year to raise up to $1 trillion.,20110722
131,Rikuzentakata: Ruin and Rebirth,Rescuing One Japanese City's History,"Preserving its museum's artifacts, and finding a new home for them, are a special challenge for Rikuzentakata, one of the cities hardest hit by the March 11 disaster. Masaru Kumagai has led a dig at the site of the devastated museum.",20110722
132,Mutual Funds,Money Funds Assets Decline,Assets in money-market funds dropped $24.74 billion in the week ended Wednesday as investors pulled more money from institutional funds than they put into retail assets.,20110722
133,Lunchbox,Lobsters by Boat or Bike,"Enjoy New Jersey lobster on the dock or inside Red's Lobster Pot, a small, 19-year-old family-owned restaurant in Point Pleasant Beach, N.J.",20110722
134,Remembrances,"Painter's 'Naked Portraits' Depicted Friends, Relatives","Lucian Freud became renowned for his large-scale nudes, which he insisted on referring to as ""naked portraits,"" drawing attention to his frank and almost brutal depiction of skin.",20110722
135,Will Lyons on Wine,How to Read a Wine Label,"Armed with just a few simple rules, one can decipher the most complicated of wine labels, helping you avoid the pitfalls of confusing a sweet with a dry wine or a full bodied red with a light, fruity Beaujolais.",20110722
136,Agenda,U.K. Can't Stay In Shadows Much Longer,"Britain has taken some of its austerity medicine, but not anything like enough.",20110722
137,N.Y. Jets,Jets Hire Mastermind of Colts' Offense,"Hoping to further groom their franchise quarterback, the Jets have hired former Colts offensive coordinator Tom Moore as a consultant.",20110722
138,Arts & Entertainment,Guerrilla Librarians Make Noise Around New York,"While public libraries continue to struggle financially and bookstore chains succumb to the e-revolution, privately funded micro-libraries are popping up around the city.",20110722
139,Travel,Vietnam: A Taste for the Spice of Life,"An eight-day culinary tour of Vietnam takes visitors through the gastronomic peaks and valleys of the country's diverse cuisine, from imperial Hue in the northern Vietnam to simple street food in Hanoi.",20110722
140,Health,Megadeal Unites Drug Rivals,"Express Scripts' $29.1 billion deal to buy Medco Health Solutions marks how the health-care landscape is changing, as companies across the industry seek greater scale to squeeze costs and boost their clout against other players.",20110722
141,Asia Business,Asia Seeks Integration Despite EU's Woes,"Southeast Asian nations will continue to work toward integrating their diverse economies despite the recent problems the EU has had with its struggling members, Asean's secretary general said.",20110722
142,Politics,Pawlenty Struggles for Iowa Foothold,"Rep. Michele Bachmann's swift ascent in the polls has overshadowed Tim Pawlenty's presidential bid and raised questions about his viability in Iowa, site of the first-in-the-nation caucuses, and beyond.",20110722
143,N.Y. Transit,MTA's Walder on New Track,"Jay Walder will step down as chairman and chief executive of the Metropolitan Transportation Authority in October, two years after taking the job, the agency said in a surprise announcement.",20110722
144,Heard on the Street,Emerging Stocks Run Jet-Lag Risk,"Some BRIC stocks just refuse to sink. For India's Sify Technologies, that may change once investors figure out that the company's share count is three times higher than many realize.",20110722
145,Business,Currency Clients Get High-Tech Tools,The world's largest currency-dealing banks have embarked on a new arms race: developing high-tech trading tools to gain and retain clients.,20110722
146,Latin America,Brazil Torn Over New Oil Riches,"Brazil is just starting to tap into some of the biggest oil fields discovered in the past 30 years, but a growing debate over how to distribute the newfound wealth threatens to delay development of reserves that could transform the country into one of the world's largest crude exporters.",20110722
147,Opinion,Project Labor Agreements Assure Quality and Efficiency,"The unfounded criticism of project labor agreements (PLAs) by the Journal (""Project Labor Revolt,"" Review & Outlook, July 19) demonstrates an embarrassing lack of knowledge and familiarity not only with PLAs, but with the U.S. construction industry as it exists today.",20110722
148,Opinion,No Wonder Demand For Loans Is Tepid,"You correctly note that ""even though interest rates have been pushed to historically low levels, demand for loans remains tepid"" (""Ahead of the Tape,"" July 13). Of course it does. Who would borrow money to buy assets that are being artificially inflated by the Fed? We just watched this movie and it ended badly.",20110722
149,Gambling,"In Las Vegas, Odds Favor Novelty Bets","Las Vegas gamblers may soon be able to bet on the Oscars, beauty pageants or make a host of other offbeat wagers, long the domain of London's famously inventive bookies.",20110722
