,section,headline,summary,date
123,Traveler's Tale,Still Crazy for Him After All These Years,Novelist Karen Engelmann on scouring Stockholm for a long-lost flame.,20121026
124,Markets,IRS Pays $38 Million in Whistleblower Case,The Internal Revenue Service has awarded an anonymous whistleblower $38 million for information leading to the recovery of between $127 million and $254 million in corporate taxes.,20121026
125,Wealth Management Journal,Court Upholds Reinstated Arbitrators' Ruling vs. Merrill,"A U.S. district court has upheld an arbitration panel's half-a-million dollar award against Merrill Lynch, capping a controversy in which the three arbitrators were fired after rendering their decision--and then re-hired.",20121026
126,Reconsider,Chicory's 15 Minutes,"This nutty, earthy root is the flavor of the moment, and not just in coffee.",20121026
127,Bookshelf,The Death and Life of Liberal Economics,"Two histories chart the resurgence of free-market thinking in the second half of the 20th century. Kenneth Minogue reviews Angus Burgin's ""The Great Persuasion"" and Daniel Stedman Jones's ""Masters of the Universe.""",20121026
128,Bookshelf,Photo-Op: Insta-Glam,"Polaroids taking to test lighting and composition offer a different angle on celebrity and fashion portraiture. A photographic review of Diego Uchitel's ""Polaroids.""",20121026
129,Management,Great Ideas Bosses Never Hear,"Employees have a lot to say, but their managers rarely hear it. How companies can benefit more from ideas that originate on the front lines.",20121026
130,Opinion,In Brief: E-Books,"A scurrilous satire imagines a world in which every single one of the conspiracy theories about President Obama is true. Barton Swaim reviews Jamie Weinstein and Will Rahn's ""The Lizard King.""",20121026
131,NBA,"Adam Silver: The NBA's Calmer, Cooler New Boss",David Stern's announcement Thursday that he plans to pass control of the NBA to longtime protégé Adam Silver wasn't exactly a half-court heave.,20121026
132,Bookshelf,That Old Appalachia Sound,"A plain-spoken memoir from the man who turned bluegrass into a global sensation. Eddie Dean reviews Josh Graves's ""Bluegrass Bluesman.""",20121026
133,Bookshelf,Fiction Books: Short History Collection,"Tales that take inspiration from historical anecdotes and news oddities. Sam Sacks reviews Emma Donoghue's ""Astray"" and Lynne Sharon Schwartz's ""Two-Part Inventions.""",20121026
