,section,headline,summary,date
124,Opinion,No Peace on Earth or Good Will Here,"I was appalled by the behavior of the two Thanksgiving Day shoppers described in your article ""Two Friends Hear Siren Call of Thanksgiving Shopping"" (U.S. News, Nov. 30).",20131204
125,Markets,OPEC Faces Prospect of Rising Output,"OPEC kept its production ceiling unchanged despite the threat of rising supply, including more output from its own members, which could weigh on prices.",20131204
126,Opinion,Only a Credible Power Is Successful,"Your Nov. 29 editorial ""Securing the East China Sea"" reminds me of the period when Mao Zedong threatened the islands of Quemoy and Matsu.",20131204
127,Fashion,Sensational and Cerebral,"""Future Beauty,"" at the Peabody Essex Museum, looks at some of the most deeply questioning and quietly influential work in the history of fashion.",20131204
128,Opinion,Killing Birds and the Politicization of Life,"Absent willful disregard, applying the 1918 Migratory Bird Treaty Act to the accidental killing of birds by the oil and gas industry is wrong.",20131204
129,Opinion,Tesla Beats Most Cars on Fire Safety,"One might wonder why the NHTSA is doing this when there have been 250,000-plus gas-vehicle fires since Tesla's inception.",20131204
130,Opinion,Saudis' Wise Silence And the Real World,"(""Saudis Silent as Neighbors Show Optimism,"" The Iran Agreement, Nov. 25) is instructive in the way that an old, battle-scarred lion watches impassively from his den as a group of naive youngsters plays with a viper.",20131204
131,Opinion,Putting 50% of Sequester Cuts on Defense's 17% Is Bad,Replacing defense sequester with cuts to other government spending is a viable solution and has been a staple of House-passed proposals this year.,20131204
132,Markets,Lehman Estate Shops Stake in D.E. Shaw,"Lehman Brothers' estate is shopping its 20% stake in New York hedge fund D.E. Shaw Group, sources say, with bids expected in December.",20131204
133,Opinion,The Accord With Iran Is Wishful Thinking by the West,"Iran has affirmed its right to the continued possession and enrichment of uranium (albeit at the 5% level), while the West is no closer to resolving the core issue expressly raised in the 2006 U.N. Security Council resolution 1696.",20131204
134,Markets,Three Wall Street Trade Associations Sue U.S. Regulator,Three Wall Street trade groups are suing the Commodity Futures Trading Commission alleging procedural violations at the agency.,20131204
135,Tech Europe,Startups Aim to Demystify Computing,"Using a computer, tablet or smartphone can be like handling an inscrutable magic box, but two London hardware startups are trying to change that.",20131204
136,Opinion,Adrian Karatnycky and Damon Wilson: How to Defuse Ukraine's Crisis,U.S. and European leaders can midwife the formation of an interim unity government to pass reforms and sign the EU agreements.,20131204
137,U.S.,Detroit Art Is Valued at Up to $866 Million,"Artwork purchased with city funds at the Detroit Institute of Arts is worth as much as $866 million, according to the Christie's auction house, a valuation expected to play a role in Detroit's historic bankruptcy case.",20131204
138,Foreign Exchange,Dollar Slides Versus Yen,The dollar gained after a stronger-than-expected report on private-sector jobs growth as traders weighed when the Federal Reserve will begin slowing the pace of monetary stimulus.,20131204
139,Markets,Fifth Third in SEC Settlement,The SEC said Fifth Third and its former finance chief have settled charges of improper accounting of commercial real-estate loans.,20131204
140,Markets,Iran Wants U.S. Firms to Develop Oil Fields,"Iran's oil minister said the country wants U.S. companies such as Chevron and ConocoPhillips to develop its oil and gas fields, signaling the Islamic Republic's readiness to court American business interests.",20131204
141,Commodities,Gold Gains; Silver Jumps,Gold and silver futures rallied as some bearish investors rushed to reduce their wagers after the precious metals showed strength in the face of brighter economic data.,20131204
142,Business,Discounts Take Shine Off U.S. Car Sales Gains,"Aggressive month-end incentives around the Thanksgiving holiday may be a sign that the auto industry might be losing its pricing discipline, said one auto analyst.",20131204
143,Whats News Business Finance Asia,What's News,Here are the top business stories from today's Wall Street Journal Asia.,20131204
144,Business,Dish to Bid in Spectrum Auction,"Dish will bid for spectrum in an auction scheduled for next month and won't face competition from the nation's top cellphone carriers, according to an FCC list.",20131204
145,Art Talk,Graphic Content From Artist Sarah Morris,Artist Sarah Morris focuses on Rio de Janeiro for her latest show at New York's Petzel Gallery.,20131204
146,Business,Verizon Gets FCC Approval for Verizon Wireless acquisition,"Verizon Communications Inc. said it has received approval from the Federal Communications Commission to acquire Vodafone Group PLC's U.S. group, which includes the U.K. company's 45% stake in Verizon Wireless.",20131204
147,Capital,"Why the Dollar Dominates, and Why That's Not All Good","Columnist David Wessel examines the dollar's curious resilience since the financial crisis and sees merit in economist Eswar Prasad's view of that continued strength as a ""suboptimal"" reality encouraged by the greenback's unrivaled position as the world's go-to currency.",20131204
148,Markets,Auditor ID Rule Proposed,"Audit regulators voted to propose requiring accounting firms to identify their partner in charge of each client's audit, a move aimed at giving investors more information and increasing auditors' accountability.",20131204
149,Markets,Turquoise Hill Founder to Participate in Rights Issue,"Robert Friedland will participate in the $2.4 billion rights issue of Turquoise Hill, the mining company that discovered the Mongolian Oyu Tolgoi copper and gold deposit.",20131204
