,section,headline,summary,date
125,Relative Values,"Going Once, Going Twice...","An 18th-century historic home in New Jersey, a Maryland shoreline estate and a former Montana horse farm are set to go on the auction block.",20131017
126,Business,Air France-KLM Seeks Control of Alitalia,Air France-KLM SA wants to control struggling Italian airline Alitalia as part of a restructuring plan and create a three-hub European airline group.,20131017
127,Business,Mercedes Sheds Its 'Old' Design,Mercedes design chief Gorden Wagener is working to rejuvenate the luxury car maker's image to help boost lagging global sales and woo younger drivers.,20131017
128,Business,Energy Industry's Odd Couple,"Lee Raymond, famously tightfisted as chief executive of Exxon Mobil, now has a seat at the table in a venture led by Aubrey McClendon, whose free-spending habits hastened his exit as chairman at Chesapeake Energy.",20131017
129,Jumbo Jungle,Foreclosure Haunts Next Home Purchase,Affluent home buyers attempting to get back into real estate after defaulting on their home loan are finding that few lenders are willing to work with them.,20131017
130,Heard & Scene,Here Comes the Bridal Bling,"In the hustle and bustle of the New York Film Festival and Columbus Day weekend, we nearly forgot that it was also Bridal Week, which culminates with an annual party sponsored by Martha Stewart Weddings.",20131017
131,Design & Decorating,Looking Back at 250 Years of Baccarat,At the historic French crystal house—known for reinventing itself—everything old is (eventually) new again.,20131017
132,Wealth Management Journal,"Voices: Stefan Astheimer, on Helping Clients Vet Investment Pitches","""A lot of high net-worth clients find themselves being pitched alternative investments by friends and family. These clients like to have an adviser who can give the investments a seal of approval and be an unbiased gatekeeper, and who can say no when it might be awkward for the client to do so.""",20131017
133,Today's Markets,Stocks Mixed But S&P 500 Hits High,Investors turned their focus away from the averted government-funding crisis and began wrestling with corporate-earnings reports.,20131017
134,Europe,Body of Nazi War Criminal Remains In Limbo Amid Furor,The lawyer for the family of a deceased Nazi official has asked Germany if it will accept his remains amid a furor over the burial of a man associated with one of the worst wartime atrocities in Italy.,20131017
135,Adventure & Travel,A Tour Inside Odessa's Catacombs,"In Ukraine, a 1,500-mile-long tangle of corridors and rooms beneath Odessa wraps under and over and in upon itself. A tour reveals hidden treasures long forgotten.",20131017
136,Commodities,Oil Futures End Down,Crude-oil futures prices fell 1.6% to a 3 1/2-month low near $100 a barrel amid signs of rising U.S. oil inventories and weaker demand.,20131017
137,Latin America,Brazil Sports Minister Steps Down,"Brazilian Sports Minister Aldo Rebelo will step down in December to run for political office, leaving his present job just a few months before the start of the 2014 soccer World Cup, a huge international event with many challenges yet to be resolved.",20131017
138,Markets,"Dollar Sinks, Treasurys Rise","The dollar sank, U.S. Treasury prices rallied and gold shot higher after lawmakers reached a last-minute deal to avoid a U.S. debt default, as investors anticipated that lingering uncertainty in Washington would push back the Federal Reserve's plans to wind down stimulus efforts.",20131017
139,Europe Business,Siemens Unveils New Structure,Siemens CEO Joe Kaeser unveiled a global reorganization that aims to put power back in the hands of country managers.,20131017
140,Latin America,New Corruption Trial for Former Peruvian Leader Begins,"A new corruption trial got under way for former Peruvian President Alberto Fujimori, who is already serving a 25-year prison sentence for crimes committed during his administration.",20131017
141,Markets,Regional Banks Grapple With Cautious Customers,"The sluggish economy is putting a damper on the business lending prospects for some regional banks, which already are grappling with a plunge in mortgage lending that has sapped revenue.",20131017
142,Markets,Defense: Employees 'Believed Madoff Like So Many Others',"Lawyers for former employees of Bernard Madoff are arguing that the convicted Ponzi schemer duped investors, auditors and the government for decades. So of course, they say, he was able to fool his employees as well.",20131017
143,Business Technology,ParkerVision Shares Soar on Patent Verdict,ParkerVision shares surge after the chip maker said a jury ruled in favor of the company's patent-infringement case against Qualcomm.,20131017
144,U.S.,Skull Find Simplifies Evolution Theory,"A newly discovered 1.8 million-year-old skull offers evidence humanity's early ancestors emerged from Africa as a single species, not several, as believed.",20131017
145,Opinion,Jamie Whyte: The Magic of Economic Conscription,State-owned companies are cheaper to run than private ones in the same way a drafted army is cheaper than a volunteer one: not at all.,20131017
146,Markets,Real-Estate Gains Boost Blackstone,Blackstone reported a 33% rise in third-quarter profit as higher earnings from the firm's real-estate business counteracted a steep decline in its private-equity results.,20131017
147,Life & Style,"When Moving Abroad, It Pays to Think Long-Term","Gavin Morgan is the chief operating officer for real-estate services firm Jones Lang LaSalle in Hong Kong. The Belfast native spoke about penciling in his workouts, Asia's blackest coffee and the biggest mistake new expats make.",20131017
148,Arts & Entertainment,"Not Without Honor, but in His Own Country…",Internationally acclaimed director Kim Ki-duk is one of South Korea's best-known filmmakers—but his work often finds a warmer reception abroad than at home.,20131017
149,Opinion,Stephen Blank: Russia's Ukrainian Hostage,Russia isn't letting Kiev move closer toward real European integration without a fight. U.S. and EU support would help.,20131017
