,section,headline,summary,date
120,Earnings,P&G Cuts Profit View on Venezuelan Devaluation,Procter & Gamble cut its current-quarter and full-year earnings view and said it expects to record one-time charges due to Venezuela's surprise devaluation of its currency last week.,20130214
121,Earnings,CBS's Uptick in Ad Sales Boosts Profit,CBS Corp.'s net income rose 6% in the fourth quarter as the media company generated higher advertising revenue despite a weak start to the fall television season.,20130214
122,Europe,G-20 to Consider Slowing Budget Cuts,"With a sustained economic recovery still elusive, G-20 finance ministers will take another look at the pace of government budget cuts when they meet in Moscow Friday and Saturday.",20130214
123,U.S.,Racial Gap in Men's Sentencing,"Prison sentences of black men were nearly 20% longer than those of white men for similar crimes in recent years, an analysis by the U.S. Sentencing Commission found.",20130214
124,Earnings,Apache Net Falls 44% on Write-downs,"Apache plans to trim its portfolio with $2 billion in asset sales this year, bringing an end to a three-year buying spree that expanded the company's footprint around the world and helped it ramp up oil production to record levels.",20130214
125,Parties,Life's a Beach at Miami's Art Basel,"Miami's Art Basel fair brings out the art world elites, including Demi Moore and Uma Thurman.",20130214
126,Markets,Fed Reviews Banking Proposal,The Federal Reserve is slowing down an effort to reduce the risks posed by interconnected banks. Banking regulators are seeking to understand the potential effects of an earlier proposal on limiting financial firms' exposure to one another.,20130214
127,Thursday's Markets,"Deals Aplenty, but Energy Is the Salve","An improving outlook for the energy sector helped pull the S&P 500 into positive territory, while the Russell 2000 index of small-capitalization stocks closed at a record level.",20130214
128,Europe Business,LOT Dreamliners Likely to Be Grounded Until October,"LOT Polish Airlines said it doesn't plan to fly its Boeing 787 Dreamliners again until at least October, indicating some industry executives don't expect a rapid solution to the jet's battery troubles.",20130214
129,Whats News Business Finance Asia,What's News,Here are the top business stories from today's Asian Wall Street Journal.,20130214
130,Business,American Deal Boosts Its Overseas Network,American Airlines aims to leverage an expanded U.S. East Coast presence and continue using partners in the Oneworld marketing alliance to close the gap with rivals possessing larger international networks.,20130214
131,Earnings,Atlantic City's Trump Plaza Sold for Only $20 Million,"Trump Plaza, the Boardwalk centerpiece of Donald Trump's one-time Atlantic City empire, was sold to a California company for $20 million in the cheapest of a series of bargain-basement deals for distressed gambling casinos in the struggling New Jersey seaside resort.",20130214
132,Earnings,Barrick Gold Posts Loss,"Barrick Gold Corp. took a $4.2 billion charge for the fourth quarter amid flagging commodities prices, and the miner's chief executive said he is looking at all of its assets in a broad divestiture review.",20130214
133,What's News,The Business of Being Netflix,How the DVD-by-mail service is using original programming to shake up the world of TV.,20130214
134,Opinion,A Theory of Liberty,"The Lincoln-Douglas debates are a significant piece of political philosophy, as momentous as Plato's dialogues. Allen C. Guelzo reviews ""Lincoln's Tragic Pragmatism,"" by John Burt.",20130214
135,Credit Markets,Treasury Prices Bounce Back,Treasurys snapped a three-session losing streak as global growth concerns took center stage and helped the U.S. government draw buyers to its bond auction.,20130214
136,Media & Marketing,DirecTV Boosted by Latin America,DirecTV's fourth-quarter income jumped 31% as the satellite-television operator's subscriber base and revenue in Latin America saw strong growth.,20130214
137,Politics,Bill to Avert Sequester Sets Stage,Senate Democrats would raise taxes on people earning more than $1 million a year as part of a plan to avoid $85 billion in automatic federal spending cuts set to go into effect on March 1.,20130214
138,DJ FX Trader,Canadian Dollar Up Slightly,"The Canadian dollar ends slightly higher, supported by some buying against the euro and the yen amid overall light trading flows.",20130214
139,Interior Alchemy,A Sumptuous Minimalist,Joseph Dirand is the go-to architect when fashion houses seek to create luxurious retail spaces with a modern twist.,20130214
140,Markets,Ex-Stanford Executives Get 20-Year Sentences,Two former Stanford Financial executives were each sentenced to 20 years in prison for aiding convicted financier Robert Allen Stanford in perpetuating a massive Ponzi scheme.,20130214
141,New York,New Jersey's Lautenberg Won't Seek Re-Election,The 89-year-old senator likely faced a primary challenge from Newark Mayor Cory Booker.,20130214
142,Business,Coach Taps Victor Luis for CEO,Coach unveiled its succession plan for Chairman and Chief Executive Lew Frankfort by naming Victor Luis president and chief commercial officer and said Mr. Luis will become CEO in January 2014.,20130214
143,Brussels Beat,Bartering Over a Trans-Atlantic Trade Deal,"With the Doha Round moribund, the decision by the U.S. and the European Union to launch negotiations for a broad new trade and investment agreement could shape the future of the world trading system.",20130214
144,Photos,Photos of the Day: Feb. 14,"In today's pictures, a priest arrives for an audience with Pope Benedict XVI at the Vatican, sea turtles return to the water in India, a plane crashes in Ukraine, and more.",20130214
145,Graphics,A History of Heinz,"See key events in the birth of a condiment empire, including the sale of Heinz to Berkshire Hathaway and a private-equity firm for more than $23 billion, which the companies say is the largest-ever deal in the food industry.",20130214
146,Photos,Private Properties,Four Palm Beach properties sell for $130 million; Montana ranch of music producer James Guercio lists for $25 million; MoneyShow's founders ask $14.9 million in Florida,20130214
147,Business,Crude Oil Settles Higher as Gasoline Jumps,"Crude-oil futures prices were driven by a surge in gasoline futures, which gained on worries of tightening supplies ahead of the peak demand season.",20130214
148,Markets,Bank-Accounting Rule Change Is Proposed,"Accounting rule makers proposed eliminating a big headache for banks, moving to roll back a provision that has repeatedly left banks' earnings either better than they look or not as good as they seem.",20130214
149,Earnings,Results Weaken at Molson Coors,"Molson Coors's fourth-quarter earnings fell 65% amid sharply higher tax expenses and weaker margins, though sales received a boost from its 2012 acquisition of Central and East European brewer StarBev.",20130214
