,section,headline,summary,date
114,Business,Air France Expects Pilots' Protests to Cancel Flights,Air France Chief Frederic Gagey said pilots' planned disruption of work schedules next month will lead to extensive flight cancellations and could undermine efforts to generate an operating profit.,20140429
115,NBA,Geffen Interested in Buying Clippers,Entertainment mogul David Geffen is interested in buying the Los Angeles Clippers from banned owner Donald Sterling—and there is no shortage of other potential bidders.,20140429
116,Business,Siemens in Talks to Buy Energy Unit From Rolls-Royce,Siemens is in talks to acquire commercial energy production assets from U.K. turbine maker Rolls-Royce Holdings.,20140429
117,Foreign Exchange,Euro Drops After German Inflation Data,The euro fell Tuesday after a softer-than-expected reading on German inflation added to expectations that the European Central Bank could be forced to ease monetary policy further to fight low inflation.,20140429
118,Middle East,Turkey to Ask U.S. for Cleric's Extradition,Turkish Prime Minister Recep Tayyip Erdogan on Tuesday said he would formally ask the U.S. to extradite an Islamic cleric he accuses of masterminding a plot to topple his government.,20140429
119,Earnings,Edison's Core Earnings Rise Following Sale of Bankrupt Business,"Edison International said its core earnings rose in the first quarter, reflecting the company's work-force cuts and income tax benefits.",20140429
120,Politics,House Committee Votes to Make Permanent a Business Research Tax Credit,"The House Ways and Means Committee voted to make a key business tax credit for research permanent, as part of an effort to pare a long list of temporary tax breaks.",20140429
121,Heard on the Street,Google: Weapon of Choice in the Cloud,"Lumpy spending at Google reflects a big shift in the technology industry, but the company can handle it.",20140429
122,Business,Paris Pillories CEO Kron in Alstom Fray,Alstom Chairman and Chief Executive Patrick Kron—once hailed as a hero of French industry—suddenly is being tarred as a turncoat amid rival efforts by Siemens and GE to acquire the French company's energy business.,20140429
123,New York Sports,Metta World Peace Finds New Rewards as a Kind of Coach,"Formerly known as Ron Artest, World Peace works with inmates and at-risk youth.",20140429
124,Business,Cummins Profit Up 20% on Higher Truck Engine Sales,"Cummins said its first-quarter profit rose 20% as sales of truck engines in China and North America helped offset falling demand for off-road vehicles and power generation equipment, particularly in India and Brazil.",20140429
125,Opinion,From Kharkiv to Brussels,EU sanctions on Russia are even weaker than Obama's.,20140429
126,Business,BP First-Quarter Profit Falls,BP reported an about 23% decline in first-quarter profit as the energy company continues to shed assets in the aftermath of the Deepwater Horizon explosion and oil spill.,20140429
127,Business,Judge Approves Deal Governing Coldwater Creek Liquidation Sales,"Women's clothing retailer Coldwater Creek moved closer to liquidating its merchandise and closing its stores, after a bankruptcy judge authorized the company to advance an agreement with two liquidators.",20140429
128,Technology,Seagate Profit Slips on Drop in Revenue,Seagate Technology said its fiscal third-quarter profit slipped 5% as the data-storage company reported a decrease in revenue though margins improved.,20140429
129,Markets,BlackRock Buys New Apple Bonds,"Large asset management firms including BlackRock Inc., Conning & Co., and Invesco Ltd. bought Apple Inc.'s new bonds Tuesday.",20140429
130,Earnings,Aflac Profit Falls 18% on Weaker Yen,"Aflac Inc.'s first-quarter profit dropped 18% as the insurance company's results were stung by a weaker yen, which more than offset a modest increase in U.S. sales.",20140429
131,Markets,Barclays U.S. Chief McGee to Leave,"Barclays's top U.S. executive is leaving following internal tensions over pay and other issues, the latest blow to the bank's ambitions to build a global investment bank.",20140429
132,Middle East,Kiev Blames Police as Militants Extend Grip,Pro-Russian militants stormed government buildings in another area of Ukraine as Kiev blamed local police for failing to stem unrest.,20140429
133,Markets,Santander to Buy Out Brazil Unit,"Banco Santander said it will offer to buy out the 25% of its Brazil unit that it doesn't currently own, in a deal that could be worth up to €4.7 billion.",20140429
134,Europe,Finland's Stubb to Run for PM,"Finland's Minister for European Affairs and Foreign Trade, Alexander Stubb, said he is joining the race to become his party's next chair, and as such, the country's next prime minister.",20140429
135,Credit Markets,Treasurys Pull Back for Second Straight Session,Treasury bonds pulled back for a second straight session on Tuesday as investor appetite for haven bonds diminished,20140429
136,New York Politics,Gov. Chris Christie Nominates New Port Authority Chairman,Gov. Chris Christie on Tuesday chose a Democrat with a long history in New Jersey politics to be chairman of the Port Authority of New York and New Jersey.,20140429
137,Commodities,Gold Slips Ahead of Fed Decision,Gold edged lower on Tuesday as worries about continued stimulus reduction by the Federal Reserve outpaced support from escalating tensions between Russia and Europe.,20140429
138,Middle East,Saudi Arabia Takes New Steps to Fight MERS Virus,"The Saudi government and the kingdom's new health minister were credited with stepping up public-awareness campaigns to curb the deadly MERS virus, as the number of new cases this month nearly doubled the total number of victims.",20140429
139,Markets,S&P Lowers Outlook on 15 European Banks to Negative,"Standard & Poor's Ratings Services issued broad actions on dozens of European banks, including a lowered outlook on 15 of those financial institutions, as the ratings firm sees likely diminished government support.",20140429
140,Whats News Business Finance Asia,What's News,Here are the top business stories from today's Wall Street Journal Asia.,20140429
141,Law,Two Federal Prosecutors in New York Step Down,Two prominent federal prosecutors in New York are departing their posts. Marshall L. Miller will become deputy chief of the Justice Department's Criminal Division. Mark P. Berger is joining Ropes & Gray.,20140429
142,Sports,Another England Rebuild Ahead,"The reappointment of Peter Moores, a former national coach, doesn't mean more of the same.",20140429
143,New York,Chris Christie Holds Personnel Announcement,"New Jersey governor Chris Christie is holding a press conference in Trenton, N.J. at 3 p.m. regarding a ""personnel announcement."" Follow Greater New York's live blog for comprehensive coverage and analysis of the event.",20140429
144,Markets,Ex-Anglo Irish Executives Spared Prison,"Patrick Whelan and William McAteer, former executives of the now defunct Irish lender that played a leading role in Ireland's banking crisis, will be assessed for their suitability for community service.",20140429
145,Europe Business,Eni Posts Fall in First Quarter Profit,"Italian energy company Eni said first-quarter net profit slid by 14% on the year due to a weaker U.S. dollar against the euro, lower oil prices, higher losses from refining and chemicals activities and increased taxes.",20140429
146,General News,"Senate Committee Delays Vote on Fannie, Freddie Bill",Lawmakers put off a vote on legislation to overhaul Fannie Mae and Freddie Mac in a bid to widen support for the measure.,20140429
147,Capital Journal,Kerry Sees Ukraine Crisis as Uniquely Putin's,"In an interview, Secretary of State John Kerry leaves no doubt that he sees Russia's actions in the Ukraine crisis as the product not of any collective Russian view of the world, but of the determination of an individual: Vladimir Putin.",20140429
148,Ahead of the Tape,Fed Watchers Ready to Connect the Dots,Ahead of the Tape: Central bankers likely will stay the course on reducing monetary stimulus when the Federal Reserve's latest conclave ends Wednesday.,20140429
149,Markets,SEC Examining High-Frequency Timing Advantages,"U.S. securities regulators are examining whether rapid-fire trading firms' use of superfast data feeds to price stock trades gives them an unfair advantage over other investors, Securities and Exchange Commission Chairman Mary Jo White said.",20140429
