,section,headline,summary,date
118,Opinion,Repression of Campus Free Speech Is Really Hate Speech,Maybe left-leaning college students’ talk of curtailing free speech from campuses should be labeled for what it is: hate speech.,20151105
119,Opinion,"Face It, Islamism Is Islam’s Own Reformation",Mr. Loconte doesn’t seem to realize that Islamism today is Islam’s Reformation.,20151105
120,Markets,Wells Fargo to Pay $81.6 Million in Bankruptcy Settlement,Wells Fargo has agreed to pay $81.6 million to settle claims it failed to notify thousands of bankrupt homeowners that it was increasing their mortgage payments in violation of federal bankruptcy law.,20151105
121,Markets,"At Fidelity China Fund, a Smaller Star Shines",Low-key career Asia stock picker Dale Nicholls has thrived at the helm of Fidelity’s London-listed China Special Situations fund since formally taking over 18 months ago.,20151105
122,Europe,Germany Cuts 2016 Tax Revenue Forecast,"The German government on Thursday cut its tax revenue forecast for next year, which could make it difficult for Berlin to maintain its budget surplus while it looks after hundreds of thousands of migrants.",20151105
123,Design & Decorating,The Affordable Wonder of Laser-Cut Décor,"Newly precise, efficient and accessible laser technology is bringing once stratospherically priced ornamentation down to earth.",20151105
124,Slideshow,Made Sans Blade,Five pieces pierced through with style.,20151105
125,Sports,Squash’s Battle of the Head Cases,Squash boring to watch? Not with the cast of characters currently atop the world rankings.,20151105
126,Earnings,"MillerCoors Profit Down, Molson Coors Swings to Profit",MillerCoors LLC on Thursday reported lower profit and revenue as beer drinkers spurned the U.S. brewer’s low-cost brands. Co-owner Molson Coors swung to a profit.,20151105
127,Schools,Case Tests Whether New York Underfunds Schools,A state Supreme Court justice will hear arguments Wednesday in a lawsuit against New York Gov. Andrew Cuomo that seeks nearly $5 billion more in state aid yearly for schools statewide.,20151105
128,Earnings,Celgene Swings to Loss Amid Acquisitions,"Celgene swung to a loss in its latest quarter, as charges stemming from acquisitions and collaborations offset sales growth.",20151105
129,Moving Targets,Here Comes a National Plague of Dumb Lawyers,"Law schools, desperate to fill seats, are lowering standards. The results, Joe Queenan foretells, will mean a plague of dumb attorneys",20151105
130,Tri-State Area,Investigators Examine Cause of Small Plane Crash,"Authorities are looking into what caused a small plane to crash off the coast of the Rockaways in Queens Wednesday night, leaving the 57-year-old pilot dead.",20151105
131,Europe,Turkey’s Kurdish Rebels Return to War Footing,"Kurdish rebels said on Thursday they would return to offensive military operations against Turkish forces, a day after Turkish President Recep Tayyip Erdogan pledged to eradicate the militants.",20151105
132,Weekend Confidential,"Alex Honnold, Rock Star","Rock climber Alex Honnold—who is known for climbing without the help of equipment, ropes or a partner—on his death-defying career.",20151105
133,Pharmalot,Gilead Sciences HIV Drug Wins FDA Approval,Gilead Sciences said Thursday the U.S. Food and Drug Administration approved the biotech company’s single tablet regimen treatment for HIV-1 infection.,20151105
134,Heard on the Street,Why Qualcomm Is Down But Not Out,"To win back investors, Qualcomm will need to prove the worst is over for its licensing business",20151105
135,Flower School,A Flower Arrangement as Boldly Sensual as Manet’s ‘Olympia’,Floral designer Lindsey Taylor attempts to capture the moody lustiness of Edouard Manet’s ‘Olympia.’,20151105
136,Heard on the Street,Fannie’s and Freddie’s Earnings Can’t Set Them Free,Third-quarter results dispel the myth that earnings could be used to recapitalize the mortgage giants.,20151105
137,WSJ. Magazine,The Latest in Fashion News,"A look at Graff’s new tome, Florsheim and Esquivel’s new collection of men’s and women’s shoes, and District Vision’s running sunglasses.",20151105
138,Markets,New Start Is Near for 130-Year-Old Stock Exchange,The National Stock Exchange has submitted a final rule filing with the Securities and Exchange Commission and could restart trading as early as December.,20151105
139,WSJ. Magazine,Q&A With Artist Rachel Whiteread,"With a show of new work opening at Luhring Augustine Gallery in New York, the British artist opens up about her vision and process.",20151105
140,Politics,Failure of Half of Health Insurance Co-ops Sparks New GOP Criticism,Republicans heap blame on the Obama administration for the failure of more than half of the cooperatives set up under the health law.,20151105
141,Film Review,"‘Spotlight’ Review: Blazingly Bright, Fearlessly Focused",The story of the Boston Globe investigative team that uncovered widespread child abuse by priests in the Catholic archdiocese of Boston.,20151105
142,Slideshow,Rachel Whiteread’s Artworks,"A look at the British artist’s works over the years, including sculptures showing at the Luhring Augustine Gallery in New York this month.",20151105
143,Health,Gene Editing Credited With Eliminating an Infant’s Aggressive Cancer in London,"A novel gene-editing technique has been used to eliminate an infant’s aggressive cancer, a small but significant step in the quest to treat deadly diseases by altering the human genome.",20151105
144,Film Review,‘Brooklyn’ Review: A Tale of Two Countries,A small-town Irish girl comes to America in the ’50s and falls for a young Italian plumber.,20151105
145,Heard on the Street,Fed Rate Hopes: Unproductive Data,"One way or the other, low levels of productivity are a problem for the Federal Reserve.",20151105
146,Economy,EU Sees Subdued Economic Expansion,"The scars of Europe’s financial crisis and external risks to the continent’s economy will keep the European Union’s recovery subdued, the bloc’s economists said.",20151105
147,Canada,Ottawa to Bring Back Mandatory Census,Canada’s new Liberal government said Thursday it would undo its predecessor’s controversial move to make the country’s census largely voluntary.,20151105
148,Autos Industry,Renault Directors Say Double-Voting Rights Upset Alliance With Nissan,The boardroom fight between Renault and the French government escalated after the car maker’s independent directors said the government’s increased influence could destabilize its alliance with Nissan.,20151105
149,Markets,Central Bank says More Brazilians Using Banking Services,"The number of Brazilians using banking services is growing, but they aren’t saving much and their debt load is growing, according to a central-bank study released Thursday.",20151105
