,section,headline,summary,date
114,Wealth Management,Giving a Couple Motivation and Tools to Trim Spending,An adviser nudges a husband and wife in their 60s to conserve more of their resources for retirement.,20151229
115,CMO,Oprah Winfrey Makes Debut as Weight Watchers Spokeswoman,"Oprah Winfrey stars in a new emotional ad for Weight Watchers, in which she shares why she joined the weight loss program. The media mogul took a 10% stake in Weight Watchers in October.",20151229
116,Africa,Guinea Declared Free of Ebola Transmission,"Guinea has been declared free from transmission of Ebola, marking a milestone for the West African country where the original chain of virus transmission began two years ago, leading to the largest epidemic in history.",20151229
117,Business,"Sysco Names Tom Bené as President, Operating Chief","Sysco Corp. said Tuesday that Tom Bené will be promoted to president and chief operating officer, effective Friday.",20151229
118,Latin America,Brazil’s November Budget Deficit 9.3% of GDP,"Brazil’s government accounts remained weak in November, with a budget deficit equal to 9.3% of gross domestic product, the central bank said Tuesday.",20151229
119,Credit Markets,Lehman Sues Japanese Investment Bank Over Derivatives,"Lehman Brothers Holdings is suing Daiwa Securities Capital Markets over hundreds of soured swaps and options, claiming the Japanese investment bank shortchanged it on hundreds of derivatives contracts.",20151229
120,Opinion,The New Iranian Hostage Crisis,Plus the future of technology and victory in Ramadi.,20151229
121,Heard on the Street,Materials IPO Makes Strides Despite Headwinds,"Covestro, the material business spun out of Germany’s Bayer, has outperformed its parent despite anxieties about Chinese demand.",20151229
122,Heard on the Street,New Banking Buffer Might Fail to Impress,The so-called countercyclical buffer is designed to stop a credit crunch. It may prove ineffectual.,20151229
123,The 10-Point,"The 10-Point: Gerard Baker on the Best Investors of 2015, America’s Widening Ideological Divide, 1MDB and More","A personal, guided tour to the best scoops and stories every day in The Wall Street Journal, from Editor in Chief Gerard Baker.",20151229
124,New York Giants,The Cases for Firing and Re-Hiring Tom Coughlin,"Tom Coughlin won two Super Bowl rings, but only has six winning seasons as the Giants’ head coach. So should he stay or should he go?",20151229
125,CMO,The Biggest PR Headaches of 2015,Even the biggest advertising budget and shrewdest marketing campaign can’t always rein in a full-fledged public relations disaster. Here is CMO Today’s list of the biggest PR mishaps of the year.,20151229
126,Markets,Japan’s Big Banks Step Up Foreign M&A Lending,"Faced with sluggish growth at home, Japanese banks—long ranked among the world’s top cross-border lenders—are financing more global mergers and acquisitions that don’t involve their compatriot companies.",20151229
127,Stocks,Australia Shares Rise to One-Month High,Shares in Australia rose to fresh one-month high and led most Asian markets higher Tuesday.,20151229
128,Markets,Global Metals Prices Hinge on China Production,"With a U.S. rate increase out of the way, metals investors are returning their focus to China, where plans to trim a supply glut have sparked hopes for a rebound in prices next year.",20151229
129,What's News,What’s News: Business & Finance,What’s News: Business & Finance,20151229
130,What's News,What’s News: Business & Finance,What’s News: Business & Finance,20151229
131,Whats News World Wide Asia,What’s News: World-Wide,What’s News: World-Wide,20151229
132,Whats News Business Finance,What’s News: Business & Finance,What’s News: Business & Finance,20151229
133,Pepper & Salt,Pepper...and Salt,Pepper...and Salt,20151229
134,Whats News World Wide,What’s News: World-Wide,What’s News: World-Wide,20151229
135,Object of Desire,Air Jordans Help Make the Sale,Los Angeles real-estate agent Lee Mintz uses her collection of sneakers to impress athlete clients.,20151229
136,Heard on the Street,There’s Value Hidden in This Chinese Insurer,"The way PICC Group shares have been trading, some of its assets are available at bargain prices.",20151229
137,Multimedia,"In Triumphant Statement, Iraq’s Leader Visits Retaken Ramadi","Iraqi Prime Minister Haider al-Abadi, left, toured Ramadi a day after Iraqi forces defeated Islamic State fighters.",20151229
138,Asia,Southeast Asia Launches Huge Trade Bloc,"Ten countries, from rich-and-developed Singapore to emerging Myanmar, are formalizing their integration efforts in a bid to rebalance regional power and riches.",20151229
139,Asia,Japanese Businesses Pushed to End South Korea Dispute,"Japanese business leaders pushed hard for their country to resolve a dispute with South Korea over “comfort women,” and this week’s landmark deal may boost trade and investment.",20151229
140,Tech,"Palantir, Investors Spar Over How to Cash In","Palantir Technologies is one of the world’s most valuable private companies but has no interest in going public. Some of its earliest investors, employees and even Palantir co-founders are trying to cash in anyway.",20151229
141,Business,Airlines Challenge Low-Cost Foes on Fares,The biggest U.S. airlines are taking their lowest-cost rivals head on—resulting in a bonanza of cheaper tickets that is benefiting fliers but weighing on revenue.,20151229
142,College Football,College Football’s Season of Chaos Theory,"How a season of weekly goofiness ultimately led to this year’s final four—Clemson vs. Oklahoma, Alabama vs. Michigan State.",20151229
143,Property Report,"New Fannie, Freddie Bonds Aim to Shift Taxpayer Risk",The government is trying to get taxpayers off the hook for billions of dollars of potential losses if another mortgage crisis arrives and plans to ramp up sales of new securities that transfers potential losses to private investors.,20151229
144,Markets,States’ Pension Woes Split Democrats and Union Allies,Left-leaning politicians are increasingly supporting revamps of retirement benefits despite opposition from labor officials.,20151229
145,U.S.,Officials Seek Clampdown on Elder Fraud,Growing financial exploitation of elderly Americans has prompted legislation mandating that financial advisers report suspected fraud.,20151229
146,Politics,GOP Race Shows Sharp Divisions on Foreign Affairs,"A number of 2016 GOP presidential contenders have ditched a foreign-policy playbook that has guided the party for years, advocating a narrower use of military force rather than democracy building.",20151229
147,Latin America,Accord Over Stranded Cubans Sparks Fear of Migration Wave,"The agreement by Central American nations and Mexico to allow about 8,000 stranded Cubans to travel from Costa Rica to the U.S. was seen as a positive short-term solution, but sparked fear of a wave of illegal migration.",20151229
148,Markets,Asian Morning Briefing: U.S. Stocks Snap Losing Streak,Asian Morning Briefing,20151229
