,section,headline,summary,date
121,Your Workout,Homer Simpson’s Exercise Mistakes,"Matt Selman, an executive producer of ‘The Simpsons’ and self-described fitness fanatic, shares his favorite Homer Simpson diet and exercises blunders.",20150427
122,Politics,"Black, Latino Leaders Cool on Christie","Gov. Chris Christie worked hard to win endorsements of blacks and Latinos in his re-election campaign, but many of the influential people he wooed back then have grown disillusioned with him.",20150427
123,Europe Markets,Pound Buoyant Despite Election Uncertainty,"Ahead of one of the least certain elections in recent U.K. history, investors in sterling seem mostly buoyant.",20150427
124,What’s Your Workout?,A Fitness Buff in a ‘Simpsons’ World: What Homer Wouldn’t Do,"Unlike Homer Simpson, Matt Selman, an executive producer of ‘The Simpsons,’ is always thinking about his next workout.",20150427
125,Asia,China’s Antigraft Authority Takes Aim at Sinopec,"China’s leaders are deepening their probes into China’s distressed oil sector as the nation’s top refiner faced new scrutiny, illustrating the staying power of an antigraft drive that has shaken China’s powerful state-owned enterprises.",20150427
126,Europe Markets,European Stocks Rebound,European stocks rebounded after Greece reshuffled its team for bailout negotiations with creditors.,20150427
127,Business,Moscow’s Airports Lose Travelers,Travel to and from Russia’s once-thriving Moscow airports is declining as fewer locals venture outside the country and foreign tourist and business visitors dry up.,20150427
128,MLB,"The Mets: Second in New York, First in the NL East","Despite losing two of three games to the Yankees, these are not the Mets of old.",20150427
129,Earnings,LabCorp Profit Falls on Charges,"LabCorp profit dropped on restructuring and acquisition-related charges, but the medical-services provider raised its profit outlook despite the stronger dollar’s effect on revenue.",20150427
130,Tech,Fanuc to Double Its Dividend,"The Japanese robot maker will double its dividend, marking a milestone in Japan’s move toward lifting shareholder returns.",20150427
131,Gas Markets,Diplomatic Thaw Piques Interest in Iranian Gas,"Iran’s prodigious natural-gas reserves may reshape global energy markets, should Tehran reach a deal with the U.S. and other Western powers resulting in the easing of sanctions.",20150427
132,Burning Question,Which Pillow Helps Me Sleep Better?,Feather pillow or synthetic? A single pillow or more? One sleep expert explains how to pick the right pillow for you.,20150427
133,Wealth Management,"Voices: Michael Martin, on a Personal Investment Index for Clients","“When clients buy into this concept of the personal investment index, they can stop obsessing over numbers and start seeing their portfolio as the tool” for saving for college or retirement.",20150427
134,Business,Pace Shares Soar on Arris Deal,"Shares in Pace soared by a third after U.S. telecommunications-networking firm Arris Group agreed to buythe British set-top-box maker for $2.1 billion in stock and cash, in a deal underscoring global broadcasting demand for technology hardware to win viewers.",20150427
135,Business,TORC to Buy Regional Oil Assets,"TORC Oil & Gas has agreed to buy light oil-producing assets in southeast Saskatchewan and Manitoba from Surge Energy, funding the deal in part through an equity sale to its key investor.",20150427
136,Slideshow,Ian Schrager’s Life in Photos,With the release of a book celebrating his career—and the opening of the New York Edition hotel—Ian Schrager is focused on the big picture.,20150427
137,Small Business,"Small Business Must-Reads – Monday, April 27","What you should read today about small business, from Defense Secretary Ashton Carter’s attempts to woo Silicon Valley to the ways entrepreneurs can prepare for the blowback of a product recall.",20150427
138,IPOs,Huatai Securities Seeks Hong Kong Listing,China’s No. 5 brokerage firm aims to raise up to $3.5 billion.,20150427
139,Earnings,Maruti Suzuki Net Profit Soars,India’s largest car maker beat market expectations with a more than 60% jump in quarterly net profit.,20150427
140,Heard on the Street,Vodafone’s Fixed Fixes Look a Hard Sell,"Vodafone has been building and acquiring fixed assets in Europe, but its efforts may be too little, too late.",20150427
141,Business,PetroChina Net Profit Down 82%,"Chinese oil giant PetroChina Co. Ltd.’s first-quarter net profit dived 82%, largely due to the sharp in oil prices since the same period last year.",20150427
142,Politics,"Still Undeclared, Jeb Bush Touts Record Fundraising Haul",All-but-declared Republican presidential candidate Jeb Bush told about 350 donors Sunday that he had set a record in Republican politics for fundraising in the first 100 days of a White House bid.,20150427
143,Business,Bristol-Myers Hepatitis C Therapy With Sovaldi Meets Study Goals,"Bristol-Myers said its experimental hepatitis C treatment combined with an older drug, ribavirin, and Gilead’s Sovaldi cured more than 90% of patients with liver transplants and cirrhosis in a late-stage study.",20150427
144,Heard on the Street,Deutsche Bank’s Realism Makes Bleak Reading,Deutsche Bank has unveiled a big cut in targeted returns. That may be more realistic but only serves to underline the continuing problems at the German lender.,20150427
145,U.S.,Murder Trial Begins for Colorado Theater Shooter,"After numerous legal delays, James Holmes is finally set to stand trial on Monday, charged with killing 12 people and injuring 70 others during a mass shooting at a Batman movie screening.",20150427
146,Earnings,"Burger King, Tim Hortons Parent Posts Higher Systemwide Sales","Restaurant Brands, parent of Burger King and Tim Hortons, reported a sharp increase in system-wide sales, fueled partly by new products and continued expansion.",20150427
147,Business,Swedish Corporate Jet Scandal Topples Another CEO,Investment company Industrivarden dismissed CEO Anders Nyren for his part in a scandal over the alleged overuse of a corporate jet at Swedish papermaker SCA.,20150427
148,Next in Tech,Gadgets for Home Diagnostics,A home-diagnostics movement is accelerating as software cuts costs.,20150427
149,Tech,Zynga Enters Into Retention Agreements,"Zynga Inc. has entered into retention agreements with two of its executives, after the gaming company’s chief executive and operating chief resigned in recent weeks.",20150427
