,section,headline,summary,date
122,Opinion,Do Not Fear the Yuan Devaluation,The critics are wrong. Beijing is taking the right steps toward achieving a currency valuation based not on manipulation but on market forces.,20150818
123,What's News,What’s News,Here are the top business stories from today’s Wall Street Journal Asia.,20150818
124,CFO Journal,Appellate Court Reaffirms ‘Conflict Minerals’ Ruling,A federal appeals court ruled for the second time against part of a regulation requiring publicly traded U.S. companies to disclose whether their products contain certain minerals from war-torn central Africa.,20150818
125,Earnings,Dick’s Seeking to Expand Casual Offerings,"Executives at Dick’s Sporting Goods laid out plans to expand the chain’s casual sportswear offerings, as the company adjusts to a retail environment.",20150818
126,Europe Markets,Global Investors Cautious Amid China Share Plunge,None,20150818
127,Europe,Ukrainian President to Meet EU Officials,"Ukrainian President Petro Poroshenko will travel to Brussels to meet senior EU officials before the end of the month, a European Commission spokeswoman said amid heightened violence in eastern Ukraine.",20150818
128,Autos Industry,Regulators Probe Volkswagen SUV’s Takata Air-Bag Rupture,"Federal regulators ordered Volkswagen to provide additional details on a Takata air bag that ruptured in a sport-utility vehicle in June, widening an ongoing government probe of a safety problem that has led to the largest automotive recall in U.S. history.",20150818
129,Tech,Toshiba Names Outsiders to New Board,"Toshiba named a new board, with outsiders taking a majority, as the electronics company tries to overcome an accounting scandal that led its president to resign last month.",20150818
130,Asia,Bangladesh Police Arrest Three Men Tied to Blogger Deaths,Bangladeshi police arrested three alleged Islamist militants in connection with fatal assaults on atheist bloggers that have stirred fears of mounting extremism in the Muslim-majority country.,20150818
131,U.K.,U.K. Offers New Onshore Blocks for Shale Development,"The government of the U.K., one of the few countries in Europe to allow fracking, will offer new onshore blocks to explore for shale gas to a range of companies that include oil giant Total and utility GDF Suez.",20150818
132,Central Banks,PBOC Injection Shows China Worries About Outflows,"China’s central bank injected the largest amount of cash into the financial system on a single day in almost 19 months, signaling Beijing’s growing concerns about capital outflows following the recent weakening of its currency.",20150818
133,Playlist,Comedian Richard Lewis on Jimi Hendrix,A counterculture anthem by Jimi Hendrix returns comic Richard Lewis to a time free of career pressures in 1967.,20150818
134,Heard on the Street,Turkish Lira May Need More Central Bank Help,The lira looks set to keep on sliding. Turkey still faces a political and monetary credibility gap.,20150818
135,Earnings,Home Depot Lifts Guidance Amid Housing Recovery,"Home Depot lifted its outlook for the year again, as a recovery in the U.S. housing market helped drive better-than-expected sales growth in its latest quarter.",20150818
136,House Call,Former Yankee Jorge Posada Recalls a Baseball Childhood in Puerto Rico,"The onetime catcher, whose No. 20 is being retired, grew up with a “tough love” father who kept him focused on the sport.",20150818
137,Europe,‘Nazi Horse’ at German School Draws Fire,"The sculpture by one of Hitler’s favored artists has sparked a battle between the Bavarian school and local politicians, historians and Jewish leaders, who say the horse is an affront to Holocaust victims.",20150818
138,Private Properties,Composer Sells New York Townhouse for $18.1 Million,Jonathan Sheffer sold a gutted Greenwich Village townhouse that comes with plans for a penthouse expansion and new basement,20150818
139,World,Eight Suspected People Traffickers Arrested After Migrant Tragedy,Italian police arrested eight suspected people traffickers after 49 migrants suffocated from engine fumes in the hold of a boat that capsized in the Mediterranean Sea.,20150818
140,Earnings,Deere Looking for End to Farm Equipment Sales Slump--Earnings Preview,Deere predicted earlier this year that the farm equipment market is likely to bottom out this year with gradual improvement starting in 2016.,20150818
141,Markets,Citi to Sell Unit to SS&C Technologies,"SS&C Technologies said it agreed to acquire Citigroup’s alternative investor services business for $425 million, one of dozens of businesses the New York bank has moved to shed to make itself less sprawling.",20150818
142,Economic Data,U.S. Housing Starts Edge Up 0.2%,"U.S. home building ticked up in July thanks to a surge in construction of single-family homes, the latest sign of momentum in the housing market.",20150818
143,Europe,Greece Picks German Operator to Run 14 Airports,Greece’s government has given the final approval for the sale of a long-term operating license for 14 regional airports to German airport operator Fraport.,20150818
144,Business,"Omeros Reports Positive Study Data, Shares Surge","Omeros reported positive mid-stage study results of its drug to treat disorders characterized by excessive blood clots, sending shares soaring in early trading.",20150818
145,House of the Day,A Labor of Love in the Hamptons,"This East Hampton, N.Y., home was renovated extensively and with exquisite detail by its owner, a craftsman.",20150818
146,My Ride,The Speed Lover’s Station Wagon,How a Michigan car nut’s family-size Cadillac only seemed like a compromise on the surface.,20150818
147,Earnings,TJX Profit Rises 6.1% on Strong Sales,"TJX said its earnings rose 6.1%, as the off-price retailer reported better-than-expected sales growth at established stores for the quarter ended in August and raised its guidance for the year.",20150818
148,Markets,Dollar Rises on Solid U.S. Housing Starts,"The dollar rose as July’s pace of U.S. housing starts topped expectations, showing the sector’s strength continues to rebound.",20150818
149,Credit Markets,Treasurys Hit Session Low on Housing Starts,Treasury prices pulled back after a report pointed to improvement in the housing market.,20150818
