,section,headline,summary,date
109,Opinion,Finding Consensus on Cross-Strait Relations,None,20160517
110,U.K.,Cameron Says No Second Brexit Vote,Prime Minister David Cameron dismissed the possibility of a second referendum on Britain’s membership in the European Union if the results in June are close.,20160517
111,CMO,Netflix Original Series ‘Narcos’ to Air on Univision,Netflix and Univision Communications Inc. announced a unique deal allowing the nation’s largest Spanish-language broadcaster to air the first season of the Netflix original series “Narcos” ahead of its second-season premiere on the streaming service.,20160517
112,Opinion,The New Political Risk in the South China Sea,Filipinos elect a self-styled strongman who slams the U.S. and praises China.,20160517
113,Slideshow,The Silent World of ‘Sunken Cities’,"The British Museum’s first significant exhibition on underwater archaeology features colossal sculptures and other artifacts discovered during excavations at submerged sites. Here, a look at some of the objects from these “lost” cities.",20160517
114,Opinion,Censorship in China Also Blocks Business Growth,Almost 80% of American and European companies say Internet restrictions hinder their operations.,20160517
115,Business,Qatar Airways Raises Stake in IAG,Qatar Airways said it had raised its stake in British Airways parent International Consolidated Airlines Group and would consider becoming an even larger investor in the European airline.,20160517
116,Wealth Management,Voices: Why One Adviser Switched to Charging Retainer Fees,The move away from asset-based fees made it possible to do business with some different clients.,20160517
117,Earnings,Red Robin Misses Expectations as  Sales Decline,"Red Robin Gourmet Burgers said Tuesday that sales slid amid fewer visitors to its namesake casual-dining restaurants, as the company cut its revenue outlook for the year.",20160517
118,Slideshow,What’s Inside a Birchbox Packaging Facility?,"With monthly subscription boxes, packing is done largely by hand, because presentation is important to subscribers; to preserve the element of surprise, boxes to a particular region go out all at once",20160517
119,Heard on the Street,"The Rate Debate: Inflation Says Go, Markets Say Stop",Inflation has firmed to the point that the Federal Reserve can be more comfortable about raising rates again. But investors aren’t there yet.,20160517
120,Economic Data,U.S. Housing Starts Rose in April,"Home building in the U.S. rebounded in April, a sign the housing recovery could be finding traction after a slow first quarter.",20160517
121,Markets,Traditional Liquidity Metrics Haven’t Kept Up With Market Change: NY Fed Official,"Traditional measurements of liquidity haven’t kept pace with recent shifts in the bond market, New York Fed Senior Vice President Nathaniel Wuerffel said Tuesday.",20160517
122,Health Policy,Number of Uninsured in U.S. Dropped Below 10% for First Time in 2015,"About 9.1% of people in the U.S., or around 28.6 million, were uninsured in 2015 according to federal statistics released Tuesday.",20160517
123,Sports,Dozens of Olympic Athletes Face Doping Bans,"Dozens of athletes who competed in the Beijing Olympics are facing doping bans to prevent their participation in this summer’s Games in Rio de Janeiro, after samples from 2008 were recently retested, according to the International Olympic Committee.",20160517
124,Europe,Austria’s New Chancellor Sworn In,Austria’s railway chief was sworn in as chancellor of the Alpine Republic Tuesday as the country’s political establishment continued to grapple with the political fallout of Europe’s refugee crisis.,20160517
125,U.S.,Justice Department to Review North Charleston’s Police Department After Shooting,The Justice Department has announced a two-year study of the North Charleston police department after last year’s shooting of unarmed black motorist Walter Scott by a white city police officer.,20160517
126,House Call,"How Sonia Manzano, a.k.a. Maria, Got to ‘Sesame Street’",The actress and writer on growing up in a tenement and living today on the Upper West Side,20160517
127,Central Banks,Fed’s Williams: Raising Rates 2 or 3 Times This Year ‘Makes Sense’,San Francisco Fed President John Williams said it still “makes sense” for the central bank to raise rates two or three times this year given continued moderate U.S. economic growth and low unemployment.,20160517
128,Economic Data,U.S. Industrial Production Jumped in April,"A surge in industrial production in April showed the U.S. economy started the second quarter on solid footing, but the bounce mostly reflected weather-related factors rather than higher spending by consumers and businesses.",20160517
129,Latin America,Brazil Ministry Nominates New Central Bank Leader,"Brazil’s finance ministry nominated economist Ilan Goldfajn as the next president of the country’s central bank, a move to shore up investor confidence in the economy.",20160517
130,Economic Data,U.S. CPI Rose at Fastest Pace in More Than 3 Years,"U.S. consumer prices jumped in April at the fastest pace in more than three years, propelled by rising gasoline prices, as underlying inflationary pressures continued to firm.",20160517
131,Heard on the Street,Why Vodafone Needs Liberty Global More Than Ever,Europe’s largest cell network operator has become Europe’s fastest-growing broadband provider. It is time to sort out the home market.,20160517
132,Playlist,Frank Deford on Gershwin’s ‘Someone to Watch Over Me’,"After crashing with a Cole Porter song on a date, sportswriter Frank Deford gets a piano-bar request right and ends up with “Someone to Watch Over Me.”",20160517
133,My Ride,The Ford Pinto Rides Again,Norm Bagi loves his Ford Pintos. So much so he’s organized a rally for other fans—the Pinto Stampede.,20160517
134,Still Life,Robert Caro’s Favorite Things,The Pulitzer Prize-winning biographer shares a few of his favorite things.,20160517
135,Private Properties,Pet-Friendly Compound Built by David Duffield Asks $39 Million,"On over 20 acres, the Bay Area estate includes a soundproof aviary, dog park and two paw-washing stations.",20160517
136,Slideshow,A Bay Area Estate with (Almost) Everything,"Tech executive David Duffield built an elaborate estate in Alamo, Calif. that includes a dog park, artist-designed tree house with suspension bridge, teen lounge and a sound-proof aviary with its own prep kitchen.",20160517
137,Canada,Canadian Factory Shipments Decline in March,"Canadian factory sales fell in March on lower transportation and primary metals sales, and together with a downward revision to February’s sales, marked the steepest two-month drop in more than a year.",20160517
138,Slideshow,The Ford Pinto Rides Again,Norm Bagi loves his Ford Pintos. So much so he’s organized a rally for other fans—the Pinto Stampede.,20160517
139,Business,"Francesca’s Shares Plunge on Weak Outlook, CEO to Depart","Francesca’s Holdings Corp. said Chief Executive and Chairman Michael Barnes resigned for personal reasons Tuesday, and the boutique retailer also said it expected first-quarter earnings to land at the bottom of its forecast.",20160517
140,Business,Target Hires Nordstrom Veteran as Merchandising Chief,"Target hired Nordstrom veteran Mark Tritton as chief merchandising officer, ending a nearly yearlong search as the discount chain reshapes its business.",20160517
141,Commodities,El Niño-Driven Food Inflation Could Cramp Spending in Asia,"Extreme dry weather and hot temperatures are pushing up food prices and shriveling the contents of shopping baskets across Asia, raising fears that growth could suffer in the region.",20160517
142,Review & Outlook,Obama’s Transgender ‘Guidance’,The White House starts another culture war to drive liberal turnout.,20160517
143,Tech,Blockchain Startup Hires Ex-Citadel Executive,A startup developing uses of the technology underlying bitcoin for trading derivatives has hired a former senior banker and Citadel executive as its chief operating officer.,20160517
144,Markets,Brazil’s Petrobras Plans New Bond Sale to Cover Expiring Debt,Brazilian state-run oil company Petróleo Brasileiro plans to issue new debt to cover a buyback of up to $3.58 billion of outstanding bonds maturing in coming years.,20160517
145,Tech,HP Looks to Make Its Mark in 3-D Printing,"HP is set to unveil new details on its development effort applying conventional printer technology to fabricate physical objects, as the company bets on 3-D printing to build its reputation for innovation.",20160517
146,Canada,Canada Wildfire Raises Safety Issues Close to Home,"As fire season begins, U.S. residents in high-risk fire areas weigh the cost of clearing trees and vegetation that add aesthetic value.",20160517
147,Commodities,Noble Downgraded by Third Credit-Rating Firm,"The commodities trader was downgraded to “junk” status by Fitch Ratings, despite efforts to assure investors about the strength of its credit standing.",20160517
148,Earnings,Children’s Place Boosts Profit Forecast,"Children’s Place raised its profit outlook for the year, as the children’s clothing retailer reported better-than-expected profit in the latest quarter.",20160517
149,Business,AstraZeneca Asthma Drug Shows Positive Results,AstraZeneca reported positive results from two late-stage studies on a severe asthma treatment that it hopes will grab market share in an increasingly competitive area.,20160517
