,section,headline,summary,date
108,WSJ Logistics Report,"Sports Authority Scraps Reorganization Bid, Will Liquidate",The apparel and sporting goods retailer will put its remaining stores up for bid at a May 16 auction that could draw competitors and liquidators.,20160426
109,Earnings,Fiat Chrysler’s Profit Jumps,"Fiat Chrysler Automobiles said its first-quarter net profit rose to $539 million as North American consumers snapped up higher-priced SUVs and pickups, and it swung to a profit in Latin America.",20160426
110,Business,Caesars Makes Settlement Offer to Bondholder Group,Caesars Entertainment Corp. and its bankrupt operating unit have offered an olive branch to a group of bondholders in a bid to move the unit’s chapter 11 restructuring forward.,20160426
111,Latin America,Weaker Peso Fails to Boost Mexican Exports,"The steep slide of the Mexican peso has failed to boost the country’s manufacturing exports, primarily because of a sluggish U.S. industrial sector coupled with close integration of supply chains across the U.S.-Mexico border.",20160426
112,Opinion,How Much for That Helicopter Money?,A dramatic new move to expand the eurozone’s money supply wouldn’t be cost-free.,20160426
113,Markets,Wells Fargo CEO Says Pressure on  Profit Margins May Continue,"Wells Fargo Chief Executive John Stumpf said that the bank’s profit margins may stay pressured, though he doesn’t see negative interest rates coming to the U.S.",20160426
114,Business,Looming German Airport-Staff Strike Threatens UPS Operations,"Public-sector strikes in Germany targeting airports are set to disrupt operations at United Parcel Service Inc. Wednesday, potentially stranding packages alongside passengers as hundreds of airport employees are expected to walk off the job in a wage dispute.",20160426
115,Business,Linn Completes First Exchange in Bid to Protect Investors,"Linn Energy LLC has completed its first exchange offer for the holders of soon-to-be worthless shares, who are trying to avoid a tax hit as the company moves toward a bankruptcy filing.",20160426
116,Business,Sports Authority Abandons Hope of Reorganizing,Sports Authority has abandoned hope of reorganizing and exiting bankruptcy and instead will count on buyers to save parts of its sprawling retail chain.,20160426
117,Earnings,"Hershey Says Profit and Sales Decline, Buys BarkTHINS Maker",Hershey Co. said its sales and profit for the year will likely be lower than expected as its chocolate bars struggle to compete with newer snacks like fruit-and-nut bars considered by many consumers to be healthier.,20160426
118,Financial Regulation,Rule Proposed for Big U.S. Banks’ Liquidity,"Large U.S. banks will have to prove they have enough cash for up to a year under a new rule meant to avert a crippling liquidity crunch—and another financial crisis. Though the  rule is somewhat stricter than a previous nonbinding global version, banks already largely comply.",20160426
119,Opinion,A Real U.S. Military Buildup Is Most Unlikely,"An ambitious military buildup strategy to Mark Helprin’s liking seems unfeasible, arguably unaffordable and to some extent unnecessary.",20160426
120,Opinion,"Jackson, Tubman and Changing the Currency","Harriet Tubman was an evangelical Christian, armed herself with firearms and was a Republican—a good choice for the $20 bill.",20160426
121,Opinion,California Water Project Is the Right Answer,California needs more than Sen. Feinstein’s sympathy. We need action now.,20160426
122,Central Banks,BOE’s Cunliffe Cautions Investors on U.K. Bank Returns,"A senior Bank of England official said shareholders in U.K. banks may need to get used to lower returns. Jon Cunliffe, deputy governor for financial stability, cautioned about a mismatch between investors’ view of the returns they can expect from banks and banks’ actual earnings.",20160426
123,Opinion,Bernie Is Softish on Income Inequality With His Money,"the free-market economy’s best achievements, which you rightly applaud, came after it had taken on the insights of FDR, Frances Perkins, Lord Keynes and William Beveridge.",20160426
124,Wealth Management,Voices: How to Guide Clients Who Have Lost Their Jobs,"These individuals may need help filling gaps in their insurance coverage and weighing the financial consequences of different life decisions, this adviser says.",20160426
125,Earnings Preview,Statoil Earnings: What to Watch,"Statoil, Western Europe’s largest oil and gas producer, is set to post first-quarter earnings on Wednesday.",20160426
126,Earnings,"Freeport-McMoRan Loss Widens, Unveils Job Cuts","Freeport-McMoRan posted a $4.2 billion quarterly loss, mostly because of the declining book value of its oil and gas assets, but said it would continue to ramp up copper production despite stagnating prices.",20160426
127,Life & Style,The New Place to Open a Gym: Inside a Gym,"Health clubs are incorporating boutique fitness studios, hoping to attract and retain members who seek specialty classes and expert instruction.",20160426
128,Business,Veritas to Buy Verisk’s Health Analytics Unit,Veritas Capital Fund Management agreed to acquire Verisk Analytics Inc.’s health-care services business for $820 million.,20160426
129,Earnings,Lockheed Martin Lifts Full-Year Guidance,Lockheed Martin lifted its earnings forecast for the year as the company benefited from sales of its F-35 fighter jet and its recently acquired Sikorsky helicopter unit.,20160426
130,Consumer Technology,Apple Brings iPhone Payment Plans to Online Customers,"Apple’s iPhone Upgrade Program has finally gone online, about seven months after launch.",20160426
131,Financial Regulation,LendingClub Looks at New Deal to Crack Tough Market,"LendingClub is planning its first sales of bonds backed by its unsecured loans, as the largest U.S. online lender looks for new funding sources in a challenging market.",20160426
132,What’s in Your Bag,Swimwear Designer Travels With Beaches in Mind,"George Sotelo is founder of the Thorsun label, known for a tailored silhouette and vivid, Modernist-referencing prints.",20160426
133,Real Estate,Saudis Pick Up Manhattan Icon,"Olayan America, a subsidiary of Saudi investment conglomerate Olayan Group, and London-based Chelsfield Group agreed to buy 550 Madison Ave, for $1.4 billion to $1.5 billion, a person familiar with the transaction said.",20160426
134,Books,Don DeLillo Tackles Cryopreservation in ‘Zero K’,"Don DeLillo is about to publish his 16th novel, “Zero K.” He talks about the mysterious image that sparked the work and the strangeness of being almost 80.",20160426
135,Earnings,"P&G Posts Higher Profit, but Sales Volume Declines",Procter & Gamble is slashing costs and commanding higher prices for staples from shaving cream to paper towels. But one important goal continues to elude the consumer-products company: getting shoppers to buy more of its products.,20160426
136,Private Properties,Financier John Gutfreund’s Fifth Avenue Co-Op Asks $120 Million,"The roughly 12,000-square-foot duplex of the former Salomon Brothers CEO is believed to be one of the largest apartments on New York’s Fifth Avenue.",20160426
137,Slideshow,John Gutfreund’s Grand Fifth Avenue Duplex Asks $120 Million,"Owned since the 1980s by the former Salomon Brothers chief and his wife Susan, the apartment at 834 Fifth Avenue includes a 50-foot-long living room.",20160426
138,Markets,Bob Diamond’s Atlas Mara May Combine With Barclays Africa,Bob Diamond’s Atlas Mara said it could combine with Barclays Africa if a consortium considering buying the African arm of Barclays PLC succeeds.,20160426
139,Europe,Junior Doctors in England Withdraw Emergency Care in Latest Strike,"Junior doctors in England withdrew emergency care for the first time in the nearly 70-year history of the country’s National Health Service, in a move that marks a significant escalation in an acrimonious standoff with the U.K. government.",20160426
140,U.S.,‘Whitey’ Bulger’s Girlfriend Faces More Time for Her Silence,"The girlfriend of convicted gangster James “Whitey” Bulger, Catherine Greig, could get more prison time for refusing to say who else might have helped the former kingpin during his 16 years on the lam.",20160426
141,Exhibition Review,How Napoleon Crafted His Legacy While in Exile,"During his final years, the defeated general worked hard to ensure his legend lived on.",20160426
142,Markets,Brazil’s Banks Grapple With Recession,Analysts expect Brazil’s banks to post weaker earnings this year due to faltering demand for credit and a rise in bad loans amid the country’s deepening recession.,20160426
143,Private Properties,"Wine Country Ranch With 8,000 Acres Seeks $39 Million","In Sonoma County, the property includes a historic home, helicopter hangar and three horse barns.",20160426
144,Central Banks,"ECB Can’t Respond to Needs of Individual Countries, Says Weidmann","The European Central Bank can’t react to the needs of individual countries, said Jens Weidmann, a member of the central bank’s Governing Council.",20160426
145,Latin America,Brazil’s Top Court Revokes House Arrest of Former BTG Pactual CEO,"Brazil’s Supreme Court revoked a house arrest order against André Esteves, founder and former CEO of investment bank BTG Pactual, paving the way for his return to the bank.",20160426
146,Markets,Ally Financial Misses Earnings Expectations,Ally Financial said profit fell in its latest quarter as the lender came up against a tough year-ago comparison and saw its auto originations decelerate.,20160426
147,Tech Review,Microsoft’s One-Handed Keyboard App Is Only for iPhones,"Microsoft has built a fantastic one-handed smartphone keyboard, but you’ll need an iPhone--and not a Windows phone--to use it.",20160426
148,Markets,Citigroup Shareholders Rebuke Bank on Pay,"About one-third of voting Citigroup shareholders cast ballots against the bank’s pay plan for top executives, a rebuke for a bank that has been focusing on improving relationships with investors.",20160426
149,Business,Eli Lilly Revenue Boosted by New Drug Sales,"Eli Lilly said revenue rose nearly 5% in its latest quarter as sales of new drugs helped offset declines in some established products, while profit dropped 17% due to higher expenses for research and development and a currency devaluation in Venezuela.",20160426
