,section,headline,summary,date
108,Education,Colleges Rethink Remedial Education,"More states are moving away from remedial education, finding that the noncredit classes designed to get first-year students up to speed on subjects often become more of a detour than an on-ramp to a college degree.",20170927
109,Middle East,ISIS Attacks Iraqi Forces in Ramadi,"Militants attacked the western Iraqi city of Ramadi on three fronts, clashing with security forces even as Iraq’s army routs the terror group from its few remaining strongholds in the country.",20170927
110,U.S.,Lawmakers Seek Quick Relief for Puerto Rico After Maria,"U.S. lawmakers, worried about the devastation to Puerto Rico after a powerful hurricane struck the island, are pushing for quick approval of relief funding while bracing for a battle about financing a new power system in the American territory.",20170927
111,Pro VC Newsletter,Visions of Billion-Dollar Deals,Investments at sky-high valuations are slowing down even as a titanic new player is doing more of them. Investors may find the two happenings are related.,20170927
112,Tech,Apple iPhone X Production Woe Sparked by Juliet and Her Romeo,"Apple hit a production snag with components crucial to its new iPhone X’s facial-recognition system, adding to concerns about extended shortages when sales begin early in November.",20170927
113,CMO,Playbuzz Raises $35 Million To Grow Content Creation Platform,"Online content creation platform Playbuzz has raised an additional $35 million, the company announced Wednesday, bringing its total funding to $66 million.",20170927
114,Transit,Gateway Tunnel Price Tag Could Cost Port Authority $800 Million,Rising estimates for the new Gateway rail tunnel under the Hudson River could cost the Port Authority of New York and New Jersey an additional $800 million.,20170927
115,The 10-Point,"The 10-Point: Gerard Baker on the Alabama election, a Saudi turnaround on women drivers, the college-basketball scandal and more","A personal, guided tour to the best scoops and stories every day in The Wall Street Journal, from Editor in Chief Gerard Baker.",20170927
116,Asia,China’s Food Exports to North Korea Surge,"China’s agricultural exports to North Korea rose sharply in July and August, amid rising geopolitical tensions and at a time of year when the food supply in the isolated nation is usually at its lowest.",20170927
117,Real Estate,Price Cuts Dwindle in Manhattan Home Listings,"A blizzard of price cuts by apartment sellers in the Manhattan market earlier in the year is beginning to slow, suggesting the market might have found a new balance at lower prices, brokers said.",20170927
118,Canada,Canada Says It’s No Safe Haven for Immigrants Losing U.S. Protection,"Canada has an urgent message for immigrants in the U.S. fearing deportation: Don’t count on us for refuge. Those losing protected status in the U.S., officials warn, shouldn’t expect to be able to stay in Canada.",20170927
119,Heard on the Street,Big Tech’s Biggest Risk,"Governments are putting tech’s giants under increasing scrutiny, which could slow growth and squeeze margins.",20170927
120,New York,Manhattan Real-Estate Sales Rise,"Manhattan’s “ultraluxury” residential market—apartments priced at $10 million or more—stumbled in the third quarter while sales strengthened among lower-priced, albeit still expensive, properties.",20170927
121,NewsPlus,Bund Shouldn’t Close Gap to Fair Value Before ECB Meeting,"The gap between actual 10-year German government bond yields and their fair value is unlikely to close before the European Central Bank’s next meeting, according to Natixis Asset Management.",20170927
122,World,Australia Backs Down on Limiting Gas Exports,Australia’s government held back from imposing curbs on exports of liquefied natural gas after producers agreed to put more gas into the domestic market to ease energy shortages.,20170927
123,Tech,Ford and Lyft Sign Driverless-Car Agreement,"Ford Motor and Lyft said they would develop self-driving vehicles for the ride-hailing service, adding to a growing number of alliances between auto makers and tech companies.",20170927
124,Markets,TPG Consortium Seeks Buyers for Indonesian Finance Company,"An investor group that includes TPG Capital is looking to sell its controlling stake in one of Indonesia’s oldest finance companies, in a deal that could value the company at about $1 billion.",20170927
125,Whats News World Wide,What’s News: World-Wide,What’s News: World-Wide,20170927
126,Whats News World Wide Asia,What’s News: World-Wide,What’s News: World-Wide,20170927
127,Whats News World Wide Europe,What’s News: World-Wide,What’s News: World-Wide,20170927
128,Pro Bankruptcy Bankruptcy,Citibank Buys $2.17 Billion Toshiba Settlement From Owners of S.C. Nuclear Plant,"The owners of an unfinished nuclear power plant in South Carolina have agreed to sell at a discount their shares of a $2.17 billion settlement with Toshiba Corp., which agreed to cover costs for the project which was canceled over the summer.",20170927
129,What's News,What’s News: Business & Finance,What’s News: Business & Finance,20170927
130,Opinion,Pepper...and Salt,Pepper...and Salt,20170927
131,What's News,What’s News: Business & Finance,What’s News: Business & Finance,20170927
132,Markets,Appreciating Acronyms: Why the FANG Phenomenon Has Teeth,"Buzzy investments come and go, but interest in the Facebook, Amazon, Netflix and Google bundling has managed to sustain interest. Here’s why.",20170927
133,Politics,"GOP Tax Overhaul Aims for Corporate Cuts, Simpler Code",A sweeping Republican plan to overhaul the U.S. tax code proposes to sharply reduce tax rates on businesses and many individuals— kicking off an effort by President Donald Trump and congressional leaders to build momentum for a challenging legislative push in the months ahead.,20170927
134,Health Policy,Health Insurers Stay in ACA Despite Fears of Last-Minute Exits,"Health insurers appeared likely to offer Affordable Care Act plans in all U.S. counties next year, despite months of drama and worries among some state officials about last-minute exits, ahead of a late-Wednesday deadline.",20170927
135,World,"Progress Made at Latest Nafta Talks, but Uncertainty Remains",The third round of talks to renegotiate the North American Free Trade Agreement came to an end Wednesday amid growing pessimism that the U.S. and its counterparts remained far apart on important issues.,20170927
136,Politics,Senate Confirms Makan Delrahim as Antitrust Chief at Justice Department,"The U.S. Senate on Wednesday confirmed President Donald Trump’s nomination of Makan Delrahim to be the antitrust chief at the Justice Department, setting the stage for a new period of Republican enforcement after eight months of limbo.",20170927
137,U.S.,Alabama Vote Is Boost for GOP Primary Challengers,Roy Moore’s win in the GOP Senate primary in Alabama was a warning to incumbents up for reelection in 2018 and a shot of adrenaline to antiestablishment conservatives who may mount their own challenges.,20170927
138,Health Policy,GOP Promises Continued Push on Health-Care Rollback After Collapse,The collapse of the GOP effort to roll back the Affordable Care Act has left Republicans pitching a different message to voters than they did in the previous seven years: It’s not over.,20170927
139,U.S.,Trump Weighs Allowing Foreign Ships to Deliver Puerto Rico Aid,"The 1920 Jones Act bans foreign ships from carrying cargo between U.S. ports, which some members of Congress say has burdened the relief effort.",20170927
140,U.S. Markets,Stocks Climb as Investors Bet on Higher Interest Rates,"U.S. stocks rose, buoyed by shares of financial companies, as investors extended bets on an improving economy and corporate profits. The S&P 500 gained 0.4%.",20170927
141,Markets,Shares of U.S. Media Companies Set for Worst Month Since 2015,"Shares of cable providers and entertainment companies in the U.S. are suffering their worst stretch in nearly two years, as traditional players struggle to adapt to a shift toward streaming services.",20170927
142,U.S.,Puerto Rico Rushes to Patch Up Ravaged Health-Care System,"The U.S. territory’s health-care system is grappling with widespread power losses, crippled hospitals and dwindling medical supplies nearly a week after Hurricane Maria devastated the island.",20170927
143,Art Review,‘Generation Wealth by Lauren Greenfield’ Review: Money Can’t Buy Class,"The photographer captures people of enormous wealth on several continents indulging themselves, people of modest wealth aping those with more, and people in poverty hustling to get out.",20170927
144,Europe,Germany's Schäuble Set to Yield Post as Finance Minister,"Wolfgang Schäuble, one of Europe’s elder statesmen, is set to bow out as Germany’s finance minister in the wake of the country’s election, ending an era in which he shaped Europe’s response to its debt crisis.",20170927
145,Europe Markets,One Bond to Rule Them All: Debt to End Eurozone ‘Doom Loop’,"Officials are looking at European Safe Bonds as a way to dilute the risk of a sovereign default, without leaving stronger economies on the hook.",20170927
146,Magazine - Culture,‘The Theater of Disappearance’: A Show You Won’t Want to Miss,"The artist Adrián Villar Rojas brings his unpredictable, unclassifiable work to L.A.",20170927
147,The Outlook,The Tenuous Logic Behind Republicans’ About-Face on Debt,"President Donald Trump and congressional Republicans are making a politically convenient case to financing tax cuts with deficits, but it’s a risky reversal, Greg Ip writes.",20170927
148,College Basketball,The Big Money Behind Rick Pitino’s Fall at Louisville,Rick Pitino was effectively fired after federal corruption allegations implicated his team and opened a window into the lucrative underbelly of college sports.,20170927
