,section,headline,summary,date
109,Management & Careers,One Trick for Getting Bosses to Buy In to Your Idea,How do far-flung employees win support for their projects from bosses at company headquarters? Well-timed travel may be the key.,20170523
110,Latin America,Five Ways Brazil’s President Could Be Forced Out,The mandate of Brazilian President Michel Temer is hanging by a thread after he was linked to a giant corruption scandal last week.,20170523
111,Heard on the Street,Europe’s Economy Keeps Running With the Bulls,A rush of eurozone survey data points to continued growth momentum. Europe is still beating expectations,20170523
112,Tech,Nokia and Apple Move From Courtroom Foes to Business Partners,"Apple and Nokia settled dueling lawsuits over what Apple should pay for intellectual property used in its iPhone, a surprisingly quick end to what analysts had said could have been years of litigation.",20170523
113,Property Report,"After a Brief Respite, REITs Resume Decline",Shares of real-estate investment trusts have slumped this year as a postelection sugar rush wears off.,20170523
114,Management & Careers,Why the Teen Summer Job Is Disappearing,"A retail-industry shakeout has made hourly jobs at chain stores hard to come by this spring, leading teens to get creative or opt out amid increased emphasis on extracurriculars.",20170523
115,Markets,Nontraded REITs: The Basics,"Here is a summary of how nontraded REITs work, why they have been controversial and the changes taking place in response to criticism.",20170523
116,CMO Today Newsletter,CMO Today: Havas’s Transparent Trading Platform; Agencies Shift To Commissions; Cable News Ratings,"Here's your morning roundup of the biggest marketing, advertising and media industry news and happenings.",20170523
117,Business,China and Russia Take on Airbus and Boeing With New Plane,"China and Russia have joined forces to build a large passenger airliner designed to challenge Airbus and Boeing, in the latest sign of strengthening Sino-Russian ties.",20170523
118,Pro VC Commentary Analysis,Chernova’s Take: Time Tests ClassPass-for-X Startups,"Some subscription service businesses, like Vive, a subscription for hair blowouts, have called it quits. Others, like KidPass are raising new money.",20170523
119,World,Desperate Tweets for Help Finding Loved Ones,"In the hours after the explosion in Manchester, England, desperate people took to Twitter and Facebook, seeking information on the missing. Others used social media to offer help to those stranded in the city center.",20170523
120,Heard on the Street,Noble Has One Option Left,The battered commodities trader may soon have no choice but to restructure its debts.,20170523
121,Asia,Japan Pushes Ahead With Antiterrorism Bill,Japan took a decisive step toward a new law bolstering police powers to prevent terror attacks despite concerns about a possible erosion of civil liberties.,20170523
122,The 10-Point,The 10-Point: Gerard Baker on the U.K. terror attack and today’s other news,"A personal, guided tour to the best scoops and stories every day in The Wall Street Journal, from Editor in Chief Gerard Baker.",20170523
123,World,Australia Opens New Trade Horizon in Latin America,"Australia plans to begin free trade talks on Wednesday with Peru, hoping to use a resulting pact to broaden commerce with three more Latin American countries and help counter a U.S. tide of protectionism.",20170523
124,Europe Economy,Eurozone Manufacturing Adds Jobs at Fastest Pace in 20 Years,"Eurozone economic recovery maintained momentum in May as the currency area’s manufacturing sector added jobs at the fastest pace in 20 years, while German businesses were more optimistic than at any time since 1991.",20170523
125,Heard on the Street,Why European Companies Could Really Miss London,Most industries need access to raw materials: In finance and markets that raw material is savings.,20170523
126,China's World,China’s Big Brother Is Watching You Do Business,"A new threat to foreign businesses in China is looming in the form of a “social-credit” system that harnesses big data to monitor and rate companies, what one think tank calls ‘IT-backed authoritarianism.’",20170523
127,Markets,The Rise of the Amateur Oil Sleuths,"Dramatic gyrations in the price of oil in the past three years have boosted demand for intelligence, intensifying competition in a market long dominated by governments, oil companies and a handful of big data providers.",20170523
128,World,"Pope Francis, Donald Trump to Seek Common Ground at Vatican","When President Donald Trump visits Pope Francis on a trip the White House has cast as a pilgrimage of peace, the two leaders could struggle to find significant areas of agreement after a public show of acrimony.",20170523
129,Asia,Men Punished With Lashings for Same-Sex Relations in Indonesia,"Two men were lashed with a cane in Aceh province as punishment for having same-sex relations, part of a growing intolerance of sexual minorities that has marked the rise of more conservative Islam in the world’s largest Muslim-majority country.",20170523
130,CMO,Havas Launches Platform to Track ‘Every Penny’ of Digital Ad Buys,Ad agency group Havas is launching a platform that will let clients see how much money they’re spending with different vendors online and how those ads are performing.,20170523
131,Tech,"WannaCry Malware Has Strong Links to Group Tied to North Korea, Symantec Says","A group linked to North Korea is highly likely behind this month’s global ransomware assault, and the attack more closely resembles the behavior of a crime ring rather than a government-orchestrated campaign, a cybersecurity researcher said.",20170523
132,What's News,What’s News: Business & Finance,What’s News: Business & Finance,20170523
133,Whats News World Wide,What’s News: World-Wide,What’s News: World-Wide,20170523
134,Property Report,China Life Buys Sprawling Portfolio of Small Market U.S. Real Estate,China Life Insurance Group is buying a 95% stake in 48 commercial properties scattered throughout the U.S. in deal that values the portfolio at $950 million and highlights the growing appetite among foreign investors for real estate in markets they mostly have ignored until now.,20170523
135,Whats News World Wide Asia,What’s News: World-Wide,What’s News: World-Wide,20170523
136,Whats News World Wide Europe,What’s News: World-Wide,What’s News: World-Wide,20170523
137,What's News,What’s News: Business & Finance,What’s News: Business & Finance,20170523
138,Opinion,Pepper...and Salt,Pepper...and Salt,20170523
139,Whats News Business Finance,What’s News: Business & Finance,What’s News: Business & Finance,20170523
140,Deals,Glencore Makes Takeover Approach to Bunge,"Glencore has made a takeover approach to grain trader Bunge, a move that would make the Swiss mining giant a major player in the U.S. agriculture market.",20170523
141,Politics,Ex-CIA Director Sheds Light on Origin of Russia Probe,Former CIA Director John Brennan said officials learned about contacts between President Donald Trump’s campaign associates and Russian officials last year. His comments came as a Senate panel said it would subpoena business entities controlled by Mike Flynn.,20170523
142,Politics,Overview of Trump’s Budget Plan And Its Impact on Key Departments,"The president’s budget proposal is hardly a done deal, but it serves as a blueprint for his goals and priorities. Here is a sampling of how some departments would fare.",20170523
143,U.K.,Britain Raises Terror Alert Level After ISIS Claims Deadly Suicide Bombing,"The British government raised its international-terrorism threat level to critical, suggesting fears of another attack as police identified the suicide bomber who killed 22 people and injured dozens of others in Monday’s attack on concertgoers in Manchester.",20170523
144,U.S.,Bipartisan Pushback Greets Trump’s Proposed Budget,President Donald Trump’s proposed $4.1 trillion spending blueprint amounts to a sweeping overhaul of the social safety net while projecting a big boost to economic growth that could be difficult to achieve.,20170523
145,Politics,Donald Trump’s Balanced Budget Goal Rests on Questionable Assumptions,President Donald Trump’s budget—which projects a balanced budget within 10 years—relies on accounting that is hard to add up.,20170523
146,U.S.,Labor Movement Makes Pricey Bet in Minimum-Wage Fight,The union movement is placing a pricey bet as it racks up victories in a national push to raise minimum wages for fast-food workers: It’s spending tens of millions of dollars in support of workers who can’t collectively bargain and don’t pay a penny in dues.,20170523
147,Oil Markets,Oil’s OPEC Rally Reaches New Highs,"Oil prices settled at fresh one-month highs Tuesday, extending a winning streak to five sessions on optimism that the coming OPEC meeting will result in more production cuts.",20170523
148,Markets,Fiduciary Rule Survives Critics for Now,"The Labor Department cleared a landmark retirement-savings rule to take effect next month, ending a stretch of uncertainty for brokers and investors after President Donald Trump called for a review of the Obama-era regulation with an eye toward repeal or revision.",20170523
149,U.S. Markets,"U.S. Stocks Up, Led by Bank Shares",Financial stocks lifted the S&P 500 as the index notched a fourth consecutive session of gains.,20170523
