,section,headline,summary,date
112,Business,Akzo Nobel Chief Quits Over Health,"Dutch paint giant Akzo Nobel said its chief executive has resigned for health reasons, though the unexpected move won’t slow its plan to spin off its chemicals business to appease shareholders.",20170719
113,Tech,Apple Picks New Chief for One of Its Toughest Markets: China,The tech titan has named Isabel Ge Mahe to a newly created executive role to oversee operations in a market where the iPhone maker faces increasingly fierce competition and regulatory challenges.,20170719
114,World,An Early Sign India’s Huge Tax Revamp Is Working: Happy Truck Drivers,A new national levy is curbing graft and economic inefficiency—and eliminating roadway tax checkpoints for truckers across the vast Indian territory.,20170719
115,Asia,Indonesia Bans Islamist Group in First Use of Presidential Decree,"Hizbut Tahrir was banned to help preserve national unity, according to the country’s justice ministry, but civil-rights groups worry the new executive power could be used arbitrarily against other groups.",20170719
116,Heard on the Street,The Last Market Still Betting on Trump,"Bonds, the dollar and some stock sectors have given up, but the overall stock market is still hoping for tax cuts and stimulus spending.",20170719
117,Wealth Management,Brokers’ Call on Wall Street: Bye,"A growing number of brokers, disillusioned with pay hurdles and strict corporate cultures, are taking their billions of dollars under management and going independent.",20170719
118,Consumer Technology,"Samsung’s Siri Rival, Bixby, Hopes to Have You at ‘Hello’","After a string of delays, the English-language version of Samsung’s virtual assistant Bixby has launched in the U.S., presenting a new rival to Apple’s Siri.",20170719
119,Tech,Google Tries Again With Eyeglass-Mounted Device,A new version of the product targets large corporate customers—not general consumers.,20170719
120,Central Banks,ECB Chief Expected to Reinforce Tightening Signals,"When European Central Bank chief Mario Draghi faces the media on Thursday after the bank’s latest policy meeting, he is expected to let stand his earlier hint at a possible reduction of the ECB’s giant bond-buying program.",20170719
121,Economic Data,Eurozone House Price Growth Eases,"The eurozone’s housing market cooled in the first three months of the year, as declines in German prices eased worries that a long period of very low interest rates risked fueling a bubble.",20170719
122,Heard on the Street,Jaguar-Maker Tata Motors Fights Fires at Home,Tata Motors’ seeming success outside India with Jaguar Land Rover masks the pain at home.,20170719
123,Europe,Russia-Backed Separatist Rebels Proclaim New State in Ukraine,Separatists in eastern Ukraine proclaimed a new state that aspires to include not only the areas they control but also the rest of Ukraine.,20170719
124,Art & Auctions,Newcomers Help Propel Art Market’s Recovery,Auction sales for the first half of 2017 reflect an increasingly healthy market where newcomers are vying with veteran collectors for blue-chip art.,20170719
125,Schools,Cybersecurity Camps Help Teen Girls Break Barrier,Teen girls studying at NYU’s cybersecurity camp are taking steps toward a cutting-edge profession--and the field less of a boys club.,20170719
126,Whats News World Wide,What’s News: World-Wide,What’s News: World-Wide,20170719
127,Whats News World Wide Asia,What’s News: World-Wide,What’s News: World-Wide,20170719
128,Whats News World Wide Europe,What’s News: World-Wide,What’s News: World-Wide,20170719
129,What's News,What’s News: Business & Finance,What’s News: Business & Finance,20170719
130,What's News,What’s News: Business & Finance,What’s News: Business & Finance,20170719
131,Opinion,Pepper...and Salt,Pepper...and Salt,20170719
132,U.S.,Arbitration Provision Emerges as Flashpoint in Nafta Overhaul,"A day after the Trump administration unveiled its objectives for renegotiating the North American Free Trade Agreement, representatives of U.S. businesses and labor sparred over the merits of the arbitration system contained in the pact.",20170719
133,Europe,Germany Says Turkey’s Detention of Rights Activist Could Threaten EU Aid,Germany​ lashed out at Turkey for jailing a German national and suggested the latest escalation in a growing feud between the two countries could cost Turkey billions of euros in European ​funding.,20170719
134,Politics,Trump Implores GOP Senators to Come Together Over Troubled Health Bill,"President Donald Trump issued a rallying cry for Republican senators to come together behind the party’s struggling health bill, telling them at a White House luncheon they were close to a deal and shouldn’t leave town for their summer break without one.",20170719
135,Politics,Supreme Court Delivers Compromise in Latest Ruling on Trump Travel Ban,"The court said the administration couldn’t ban travel by people from six Muslim-majority countries who are extended family of U.S. residents, but that it could move ahead with a ban on a broad group of refugees.",20170719
136,Politics,CBO Says Obamacare Repeal Would Increase Uninsured by 32 Million by 2026,"A Senate Republican push to repeal the Affordable Care Act would cause 32 million more people to be without insurance coverage by 2026 and decrease federal deficits by $473 billion, according to a new federal report released Wednesday.",20170719
137,U.S. Markets,"Dow, S&P 500, Nasdaq Close at Records","Broad gains in U.S. stocks sent major indexes to a trio of records. The Dow industrials, the S&P 500 and the Nasdaq Composite hit new highs, with all 11 sectors of the S&P 500 posting gains.",20170719
138,Adventure & Travel,A Road Trip Through Montana’s Still-Wild Frontier,Yellowstone and Glacier National Parks lie some 400 miles apart in Western Montana. But what you’ll see between them is just as compelling.,20170719
139,Economy,Fed Faces Inflation Riddle,"The Fed is likely to stand pat on policy when it concludes a policy meeting next week, but it faces a debate about the future path of interest-rate increases because of a deepening puzzle over inflation.",20170719
140,Business,Univision Fields Takeover Interest Amid IPO Delays,"Univision has been fielding interest from potential bidders, including cable mogul John Malone, after the media company’s initial public offering was delayed.",20170719
141,Markets,Appeals Court Overturns Convictions of Two Traders in Libor Scandal,"An appeals-court panel overturned the convictions of two former Rabobank traders in the scandal over attempted manipulation of the London interbank offered rate, saying the men’s Fifth Amendment rights were violated.",20170719
142,Film Review,‘Dunkirk’ Review: Finding Humanity in Calamity,Christopher Nolan’s giant-screen production revisits the evacuation of hundreds of thousands of Allied troops from a French beach during the early days of World War II.,20170719
143,The A-hed,The Tour de France’s Most-Abused Substance: Hand Sanitizer,"Teams go to enormous lengths to keep weary riders from getting sick, from quarantines and ginger shots to personal washing machines. Don’t sneeze on the buffet!",20170719
144,Personal Technology,"Testing Bixby, Samsung’s Ambitious Plan to Make You Talk Like Iron Man","Samsung’s plan to conquer Siri, Alexa and Google Assistant moves talking AIs in an ambitious new direction. Too bad Bixby under-delivers in its debut in the Galaxy S8, writes Geoffrey A. Fowler.",20170719
145,Film,How Will ‘Dunkirk’ Stack Up Against the Great WWII Movies?,Christopher Nolan is the latest director to take on the Second World War; what films say about the times.,20170719
146,The Middle Seat,A New Perk for Frugal Business Travelers,"Upside Travel, a new company from Priceline’s founder, bets you’ll book their flight and hotel packages if there’s a form of cash in it for you.",20170719
147,World,How a Saudi Prince Unseated His Cousin to Become the Kingdom’s Heir Apparent,An inside look at how the royal-court drama unfolded shows the extent to which the recent leadership change was a power grab by a self-declared reformer.,20170719
148,Politics,"U.S. Military’s Space in Trump Tower Costs $130,000 a Month","The U.S. government is paying more than $130,000 a month to lease space in Trump Tower for the military office that supports the White House, even though Donald Trump hasn’t spent a night at the New York skyscraper since becoming president. The space is owned privately by someone unaffiliated with the Trump Organization, a government agency said.",20170719
149,Heard on the Street,Big Food’s Next Big Problem: Supermarket Brands,"Americans have been late to the game in adopting private-label supermarket products. That’s changing, leaving huge room for traditional brands to suffer.",20170719
