,section,headline,summary,date
105,Markets,"Amazon Is Taking Over the Stock Market, Too","Three technology titans have powered nearly half of the S&P 500’s advance this year, a worrying sign for investors expecting a strengthening economy to lift shares of manufacturers, oil companies and other firms whose fortunes typically improve with growth.",20180221
106,Tech,Twitter Faces Conservatives’ Ire After Moves to Curb Automated Accounts,"Twitter banned some kinds of automated accounts and placed restrictions on posting simultaneously from multiple accounts, curbs that drew complaints from conservative members who claim they are being unfairly targeted.",20180221
107,U.S. Markets,U.S. Stocks End Lower After Fed Minutes,The Dow Jones Industrial Average gave up its gains and swung 475 points as concerns about higher interest rates resurfaced following the release of minutes from the Federal Reserve’s January meeting.,20180221
108,U.S.,"Parkland Students Protest, Raising Political Pressure for Tougher Gun Laws","High-school students who survived Florida’s deadly school shooting last week descended on the state capital Wednesday to plead for stricter gun-control measures, raising pressure on lawmakers in the normally firearm-friendly state to pass legislation.",20180221
109,Tech,SpaceX Indicates Internet System Will Take Longer Than Anticipated,"SpaceX’s proposed internet-via-space project is slated to launch two experimental satellites on Thursday, even as the company tamps down expectations such prototypes will quickly evolve into a functioning global system.",20180221
110,The Middle Seat,Why an American Airlines Monopoly Works for Charlotte,"In contrast to many cities luring low-cost competitors to their airports, Charlotte, N.C., has stuck with a dominant carrier, accepting high prices in exchange for plentiful flights.",20180221
111,Business,R-Rated Behavior of Star Producer Is a Drama for Disney,"Tom Schumacher, the executive behind Disney’s new “Frozen” musical, has been accused of explicit sexual language and behavior in the workplace, even as he turned the entertainment company into a powerful force on Broadway.",20180221
112,Olympics,Big Air: Either the Best or Worst Thing for Snowboarding,"Big air is easy to understand and visually stunning, but some snowboarders worry about where it could push the sport stylistically, with judges incentivizing an increasingly acrobatic look.",20180221
113,Olympics,Team USA Falls in Hockey Shootout,"Lacking NHL players, the U.S. squad failed to advance after being unable to make any of its five shots in the shootout.",20180221
114,Business,Small Business Thinks Big About Recruiting,"To find qualified employees in a tight job market, small and midsize companies are getting creative, reaching out to local high schools, beefing up internships and even offering to pay vacation costs.",20180221
115,The A-hed,"Sorry, Collectors, Nobody Wants Your Beanie Babies Anymore","Two decades after the great stuffed-bear craze, speculators are back, hoping someone will finally buy the collectibles.",20180221
116,Business,How Jeffrey Immelt’s ‘Success Theater’ Masked the Rot at GE,A culture that disdained bad news contributed to overoptimistic forecasts and botched strategies. GE stock has almost halved since Mr. Immelt resigned as CEO and the company is considering whether to break itself up.,20180221
117,Olympics,U.S. Wins Its First-Ever Cross-Country Gold,The U.S. won its first-ever Olympic gold medal in cross-country skiing as Jessie Diggins and Kikkan Randall took the women’s team sprint free event—a sorely needed adrenaline boost for the U.S. Olympic team.,20180221
118,Management & Careers,Some Companies Move to Gender-Blind Leave for New Parents,"In a few corners of corporate America, companies are discarding parental-leave policies that encode distinctions between mothers and fathers, arguably holding women back at work and relegating men to secondary roles at home. Instead, they are offering gender-blind time off for all new parents.",20180221
119,Markets,The Rise of Bitcoin Factories: Mining for the Masses,"The surge in bitcoin’s price is luring individuals and corporations to try their hand at mining cryptocurrencies, giving rise to firms offering services that make mining easier for the masses.",20180221
120,Middle East,Saudi Efforts to Aid War-Torn Yemen Stall,"Saudi Arabia and its allies are giving $1.5 billion to their war-ravaged neighbor, but their ability to fix the country’s humanitarian crisis is limited by their status as combatants—and because many aid groups are reluctant to take their money.",20180221
121,Tech,Airbnb’s Push Into ‘Experiences’ Has Been a Slog,"Airbnb’s Experiences service, where travelers book outings with local experts, has been off to a sluggish start as the company hunts for new revenue sources beyond home rentals.",20180221
122,Capital Account,America’s Emerging Petro Economy Flips the Impact of Oil,"The effect of oil prices on the U.S. economy used to be straightforward: Higher was bad. Yet between 2014 and early 2016, as oil collapsed, growth slowed sharply. Since then oil has doubled, yet the economy has accelerated.",20180221
123,Pyeongchang 2018,The Winter Olympics Are Too Long. Here’s How to Fix Them,Eighteen days of curling. Twelve nights of speedskating. No Winter Games have ever been longer than Pyeongchang. Why a shorter Olympics would be a better Olympics.,20180221
124,WSJ Logistics Report,Today’s Top Supply Chain and Logistics News From WSJ,"Walmart launches an online makeover, retailers in a rush to consolidate and a distribution overhaul fries KFC’s supply chain.",20180221
125,Central Banks,Fed Gives Bullish Signals on Economy,"Federal Reserve officials agreed last month that a strengthening economic growth outlook bolstered their plans to keep raising short-term interest rates this year, minutes from their January meeting show.",20180221
