,section,headline,summary,date
111,Real Estate,Marriott to Take On Airbnb in Booming Home-Rental Market,"Marriott International is starting a new home-rental business, aiming to take on Airbnb and other home-sharing companies in one of the lodging industry’s hottest segments.",20190429
112,Politics,Deputy Attorney General Rod Rosenstein Submits Resignation,"Rod Rosenstein submitted his resignation letter to President Trump, ending a tumultuous two years in which he tried to steady a rocky Justice Department and its relationship with the White House.",20190429
113,Middle East,"ISIS Video Purports to Show Baghdadi, Extremist Group’s Leader","Islamic State released a rare recorded video that purports to show its leader, Abu Bakr al-Baghdadi, following the collapse of the extremist group’s self-declared caliphate last month when its last outpost in Syria was captured.",20190429
114,Oil Markets,Oil Volatility Puts 2019 Rally Under Scrutiny,Crude-oil volatility is under scrutiny after President Trump ended waivers on Iran sanctions and then urged OPEC to bolster supply and keep prices low.,20190429
115,Politics,"With Joe Biden’s 2020 Announcement, Obama Legacy Becomes a Focus","Joe Biden’s entrance into the Democratic race for president adds to an intraparty debate over the legacy of President Obama, whom he served in the White House for eight years as vice president.",20190429
116,Economy,Transcript: WSJ Interview With Fed Candidate Stephen Moore,Conservative commentator Stephen Moore last week discussed the chances President Trump will nominate him and the Senate will confirm him for a seat on the Federal Reserve Board of Governors.,20190429
117,U.S.,Foxconn Tore Up a Small Town to Build a Big Factory—Then Retreated,"The iPhone maker got fat incentives to build a $10 billion LCD plant that largely hasn’t materialized on land where Mount Pleasant, Wis., razed homes and crops. “We’re talking about things that are just imaginary.”",20190429
118,MLB,A Growing Problem for Baseball’s Biggest Prospect,"Vladimir Guerrero Jr. can hit, but the Blue Jays worry that his conditioning will hurt his defense, durability and long-term health.",20190429
119,Culture,Got Any Bright Ideas? Dia Needs a Lighting Fix for Its Famed Exhibit,The Dia Art Foundation is facing a dwindling supply of specialty lightbulbs to illuminate conceptual artist Walter De Maria’s 40-year-old exhibit “The Broken Kilometer.”,20190429
120,MoneyBeat,Negative Yields Deepen Along With Europe’s Problems,More investors are paying governments in Europe for the privilege of holding their bonds. The amount of negative-yielding government bonds outstanding through 2049 has risen by 20% this year to about $10 trillion.,20190429
121,Europe,"To Make a Comeback, Europe’s Center-Left Is Leaning More…Left","Europe’s center-left parties, faced with falling support, are shifting left to win back working-class voters lost to hard-left and populist movements—a move that paid off in Spain’s national elections, where the Socialists trounced their conservative rivals.",20190429
122,U.S.,Women Wanted: Blue-Collar Fields Find New Workforce,"A growing number of women are taking jobs in blue-collar roles that have long been—and still are—mostly men. The share of truck drivers, electricians, plumbers and mechanics who are women recently touched the highest level in at least 25 years.",20190429
123,Fitness,The Most Aggravating Smartphone Sins at the Gym,"Fitness centers want happy customers posting photos on social media, but as sharing becomes more common, so do breaches of etiquette.",20190429
