,section,headline,summary,date
110,U.S.,"California Governor Signs Rent Law Amid Rising Housing Costs, Homelessness","California will cap rent increases under a new law signed Tuesday by Gov. Gavin Newsom, the most significant piece of housing-related legislation in a year that also saw the shelving of a measure to relax zoning and spur more construction.",20191008
111,Opinion,Pepper...and Salt,Pepper...and Salt,20191008
112,Asia,Expanded U.S. Trade Blacklist Hits Beijing’s AI Ambitions,"The U.S. decision to add eight Chinese companies to its trade blacklist strikes directly at China’s ambitions in artificial intelligence, threatening its companies’ access to crucial components and relationships with U.S. firms.",20191008
113,Politics,White House Refuses to Cooperate With Impeachment Probe,The White House said it won’t cooperate with the House impeachment probe and the administration blocked the deposition of a U.S. ambassador seen as central to the Ukraine controversy.,20191008
114,Middle East,Trump Invites Turkish Leader to Washington as Turkey Prepares Syria Offensive,"President Trump said the U.S. wasn’t abandoning Kurdish fighters in northern Syria amid blowback from lawmakers over his decision to withdraw American troops from the area ahead of a planned military incursion by Turkey, which declared it was determined to proceed.",20191008
115,Opinion,Turkey Has Legitimate Grievances Against the U.S.,Trump is right to pull back from supporting PKK-affiliated Kurds in northern Syria.,20191008
116,Politics,Senate Faults Tech Giants for Role in Russian Election Meddling,"A Senate investigation of Russia’s social-media influence criticized U.S. tech giants, with new attention on Google and YouTube, for helping spread misinformation during the 2016 presidential election and pushed them to better coordinate to prevent a repeat next year.",20191008
117,Business,For Sale at YouTube: Political Ad Space in 2020,"YouTube is stepping up efforts to snag political ads from local TV and Facebook and letting buyers book slots through the end of February, when voting for the presidential nominations will begin in Iowa, New Hampshire and elsewhere.",20191008
118,Politics,Trump and Ukraine: A Guide to the Key Players,President Trump’s phone call this summer with Ukrainian leader Volodymyr Zelensky has touched off an impeachment inquiry that is roping in politicians and diplomats in Washington and Kyiv. Here are the key players.,20191008
119,WSJ News Exclusive,Boeing 737 MAX’s Return to Service Faces Further Delays,Boeing’s effort to return 737 MAX jets to service has hit a new snag due to heightened European safety concerns about portions of proposed fixes to flight-control systems.,20191008
120,NBA,NBA vs. China: The Power Struggle Behind the Standoff,The NBA may be more strongly positioned to push back than other U.S. businesses that have run afoul of the Chinese government.,20191008
121,Business,Tesla Needs Its Battery Maker. A Culture Clash Threatens Their Relationship.,"CEO Elon Musk’s behavior has rattled some top executives at Panasonic, and both sides are pointing fingers about production. “If the Gigafactory project doesn’t succeed, we would both fail.”",20191008
122,Television,Déjà View: The Psychology Behind the ‘Rewatch’,"With more TV options than ever, why viewers just want to watch ‘Friends.’",20191008
123,Business,"China, NBA Standoff Deepens Over Executive’s Tweet","Beijing and the NBA hardened their standoff, as China canceled broadcasts of preseason games and the league’s commissioner said he wouldn’t apologize for a weekend tweet by a team executive that triggered a firestorm of criticism.",20191008
124,WSJ. Magazine,Naomi Campbell Knows It All,"Naomi Campbell remains fierce, fearless and busier than ever, as a fashion model, global activist and YouTube star. Her secret? Knowing when to appear and disappear",20191008
125,Central Banks,Transcript: WSJ Interview With Boston Fed President Eric Rosengren,"Boston Fed President Eric Rosengren discusses recent economic data, the outlook for the economy and monetary policy, and the central bank’s inflation target.",20191008
126,Markets,Hong Kong Stock Exchange Pulls $37 Billion Bid for London Rival,"Hong Kong Exchanges & Clearing abandoned its attempt to take over the London Stock Exchange Group, saying it couldn’t pursue a deal without input from the target’s management.",20191008
127,Latin America,Brazil’s War on Crime Takes a Toll on Rio’s Poor,Children’s deaths by gunfire in the slums of Rio de Janeiro are putting new scrutiny on Brazil’s military police and the war-on-crime tactics used since President Jair Bolsonaro took office this year.,20191008
128,World,U.S. Adds Chinese Firms to Blacklist,"The U.S. added 28 Chinese entities to an export blacklist, citing their role in Beijing’s repression of Muslim minorities in northwest China, just days before high-level trade talks are set to resume in Washington.",20191008
