,section,headline,summary,date
108,MoneyBeat,"Stocks to Watch: Magellan Health, Herman Miller, KB Home, and Rite Aid","Magellan Health, furniture maker Herman Miller, KB Home, and Rite Aid are among Thursday’s stocks to watch.",20190627
109,Health,HealthEquity to Buy WageWorks for About $2 Billion,"HealthEquity is buying WageWorks in a deal the companies are valuing at about $2 billion, about two months after HealthEquity confirmed it had offered to buy the work benefits provider.",20190627
110,Business,Airlines Seek Coordinated Regulatory Action on Boeing MAX,Airlines reinforced their call for air-safety regulators to cooperate on returning the Boeing 737 MAX plane to service and agreeing on common pilot training requirements after two fatal crashes.,20190627
111,Economic Data,U.S. Economy Grew at Unrevised 3.1% Rate in First Quarter,"The pace of U.S. economic growth remained at a strong 3.1% annual rate in the first three months of the year, but a downward revision to consumer spending suggests the momentum could be difficult to maintain.",20190627
112,Economic Data,U.S. Jobless Claims Rose Last Week,"The number of Americans filing applications for new unemployment benefits rose last week, amid deepening concerns that trade disputes and slowing global growth are starting to affect the domestic economy.",20190627
113,Heard on the Street,Why Helicopters Are Sinking Offshore,The energy business has turned up its fair share of casualties in industries associated with the supply chain. This cycle it is the helicopter.,20190627
114,Tech,Harry Potter Augmented-Reality Game Is Off to a Slow Start,"The new mobile game “Harry Potter: Wizards Unite” is off to a lackluster start, signaling another missed opportunity to drive mainstream adoption of augmented reality, the much-hyped technology the app showcases.",20190627
115,Stocks,Russell Rebalancing Promises Trading Frenzy,"A surge in trading is expected Friday as stocks are added to and dropped from FTSE Russell’s U.S. benchmarks. During last year’s rebalancing, about $100 billion of individual stocks were traded in the final seconds of the day.",20190627
116,Heard on the Street,Trump and Xi Have Reason to Step Back From the Brink,Both the U.S. and China are heading into the G-20 loudly proclaiming they don’t need a deal. The reality is that both economies have already suffered substantial damage—and the next round of tariffs would make things far worse. A further escalation isn’t inevitable though.,20190627
117,World,Germany Detains Suspect Linked to Paris Terrorist Attacks,German authorities said they had arrested a suspect wanted in connection with the 2015 Islamic State terrorist attack in Paris.,20190627
118,Heard on the Street,Trump’s Most Powerful Weapon in the U.S.-China Trade Fight,"For all the discussion of a global role for the yuan, China’s banks still need access to the dollar system, while U.S. banks don’t need the yuan.",20190627
119,World Cup,U.S. Women’s Soccer Players Sought Lawsuit Talks,"As the World Cup approached, U.S. women’s soccer players tried to meet with U.S. Soccer president Cordeiro to end their long pay fight with the federation.",20190627
120,Tech,Huawei Hits Back at Claims It Steals Secrets,"Chinese technology giant Huawei defended itself against allegations that it violates other companies’ intellectual-property rights, saying it has never been forced by a court to pay fines for stealing secrets.",20190627
121,U.S.,DOJ Examines FBI Officials’ Attendance at a Dodgers Game,"The DOJ’s inspector general is examining whether senior officials in the FBI’s Los Angeles field office acted inappropriately by attending a 2018 Dodgers playoff game, while a corruption investigation into Major League Baseball was unfolding.",20190627
122,World,Australian Student Reportedly Detained in North Korea,Australian officials are urgently seeking information about an Australian man in North Korea following reports he had been detained by authorities in Pyongyang.,20190627
123,Election 2020,"Unscathed by First Group, Biden Likely to Draw Fire at Tonight’s Debate","Joe Biden emerged from the first Democratic presidential debate untouched, with none of his rivals hitting him by name. That’s not likely to happen during round two in Miami.",20190627
124,Obituaries,Philip Geier Expanded Interpublic Group Into a Global Advertising Giant,"Executive Philip Geier made over 200 acquisitions and cultivated enduring ties with leaders of Coca-Cola, Unilever and Nestlé",20190627
125,Tech,Internet Providers Look to Cash In on Your Web Habits,Internet-service providers are deciding whether to use data about their customers’ web habits to sell ads. AT&T mines surfing habits as part of a broader advertising operation.,20190627
126,Heard on the Street,Cannabis Investors Are Zoning Out About Supply,"Cannabis can’t cross state lines today, but should federal laws change, high-cost growers and areas with less favorable climates for cannabis growing will be undercut.",20190627
127,Business,Amazon Adds Rite Aid Locations to Package Delivery Network,Amazon.com Inc. is adding another option for customers to get packages from the online retailer: picking them up at Rite Aid drugstores.,20190627
128,Markets,Oxford University Signs $5 Billion Deal With Investor,"The University of Oxford signed a deal with U.K. insurer and asset manager Legal & General to provide $5 billion in funding over 10 years to build graduate student housing, subsidized accommodation for university staff and income-generating science parks.",20190627
129,Real Estate,Fewer Renters Believe They Are Likely to Ever Own a Home,"More American renters believe homeownership is financially out of reach, according to a new survey that shines fresh light on the growing housing affordability crisis.",20190627
130,Whats News Business Finance,What’s News: Business & Finance,What’s News: Business & Finance,20190627
131,Corrections,Corrections & Amplifications,"Corrections & Amplifications for edition of June 27, 2019",20190627
132,Whats News World Wide,What’s News: World-Wide,What’s News: World-Wide,20190627
133,Opinion,Pepper...and Salt,Pepper...and Salt,20190627
134,Media & Marketing,‘One Day at a Time’ Finds New Life on CBS’s Pop TV,"CBS-owned Pop TV is picking up “One Day at a Time,” putting an end to months of fan complaints after Netflix Inc. declined to renew the series earlier this year.",20190627
135,Markets,"Burner Phones, Leaks to Journalists: Regulators Probe Suspected Insider-Trading Scheme","A former Citigroup employee was the alleged middleman in what authorities believe may be an insider trading scheme, according to people familiar with the matter and disclosures in a U.K. court case.",20190627
136,Politics,Supreme Court Declines to Set Limits on Political Gerrymandering,"Federal judges have no authority to correct partisan gerrymandering, the Supreme Court’s conservative majority said in a 5-to-4 decision that allows politicians to keep drawing electoral districts that entrench their power.",20190627
137,World,China to Insist U.S. Lift Huawei Ban as Part of Trade Deal,"Chinese President Xi Jinping plans to present President Trump with a set of terms the U.S. should meet before Beijing is ready to settle a market-rattling trade confrontation, raising questions of whether the two leaders will agree to relaunch talks.",20190627
138,U.S.,Supreme Court Blocks Citizenship Question From 2020 Census for Now,"The Supreme Court halted the Trump administration’s plans to ask U.S. residents on the census whether they are citizens, voicing blunt concerns about the White House’s motivations. President Trump called the ruling “totally ridiculous” and asked lawyers about delaying the census.",20190627
139,Markets,Bond Fight Pits Main Street Against Wall Street,"A rebellion is brewing in the $9 trillion corporate-bond market, as an unlikely alliance of municipal treasurers, algorithmic-trading specialists and individual investors fight a regulatory proposal.",20190627
140,Personal Technology: Review,"Soon Your Phone Will Be Your Driver’s License, MetroCard and More","After testing phone-based MTA transit cards in New York City and mobile driver’s licenses in Delaware, our columnist says it won’t be long until physical wallets go the way of the change purse.",20190627
141,Rumble Seat,"The Fantasy Utility Vehicle: A $300,000 Nostalgia Trip",Would you drop $300k on that 4x4 you craved in high school? Automotive artisans are retrofitting classic off-roaders—from Ford Broncos to Toyota Land Cruisers—with cutting-edge engineering and prices that cut deep,20190627
142,Election 2020,"Offstage in Miami, Democratic Candidates Search for Spotlight","Most of the Democratic presidential candidates who weren’t on Wednesday’s stage huddled with their advisers in hotel rooms across downtown Miami, watching closely as they prepared for Thursday night’s debate.",20190627
143,Homes,"In Miami, There Are Too Many Condos and Not Enough Foreign Buyers","An exodus of Latin Americans is exacerbating oversupply at the high-end, but local real estate players are banking on U.S. buyers fleeing high-tax states to give the market a much needed boost.",20190627
144,Election 2020,"Castro, Seeking to Break Out, Says ‘People Are Looking at Me in a New Way’","Presidential candidate Julián Castro, the former secretary of Housing and Urban Development, may have had a breakout moment in the Democratic debate when he went on the attack against former Texas Rep. Beto O’Rourke.",20190627
145,Logistics Report,Maersk CEO Wants Half Its Earnings to Come From Inland Logistics,"Danish shipping giant A.P. Moller-Maersk wants to buy warehouses, container terminals and customs brokerage firms to boost its logistics services capabilities, part of a strategic shift toward a landside business the company hopes will produce half its revenue in two years.",20190627
146,Tech,How a Big U.S. Chip Maker Gave China the ‘Keys to the Kingdom’,Advanced Micro Devices revived its fortunes when it decided to help Chinese partners develop computer-chip technology. The deal sparked a prolonged battle with Washington over national security.,20190627
147,Homes,Jackie O’s Compound on Martha’s Vineyard Hits Market for $65 Million,"Caroline Kennedy is listing the 340-acre property, which her mother bought for over $1 million in the late 1970s.",20190627
148,U.S.,"When It Comes to Tariffs, Many U.S. Companies Are on China’s Side","As President Trump and Chinese President Xi Jinping gear up for the G-20 summit, U.S. businesses are warning that new 25% duties on $300 billion a year of Chinese goods will wreak widespread direct and collateral damage.",20190627
149,Election 2020,"Democrats Unite Against Trump, Divide on Health Care in First Debate","Ten Democratic presidential candidates squared off in their first joint appearance, laying bare an intraparty dispute over the future of the nation’s health-care system while offering a united front in denouncing President Trump’s policies.",20190627
