,section,headline,summary,date
0,Business,James River Group to Cancel Auto Insurance for Uber Affiliate Rasier,"James River Group Holdings said it delivered a notice of early cancellation of all insurance policies issued to Rasier, its largest customer.",20191008
1,New York,New York to Crack Down on Illegal Selling of Statue of Liberty Boat Tours,The city is stepping up its enforcement of the illegal sale of Statue of Liberty boat tours a day after actor Alec Baldwin said he was duped into buying fake tickets for his family.,20191008
2,Politics,Justices Spar Over Gay Employee Cases,The Supreme Court spent a tense two hours weighing whether a bedrock civil-rights law forbids employers from discriminating against gay or transgender employees.,20191008
3,Latin America,Ecuador’s President Relocates Government Amid Protests,"Demonstrators protesting the end of a fuel subsidy stormed Ecuador’s Congress on Tuesday before police expelled them with tear gas, a day after President Lenin Moreno moved the administrative center of his government out of Quito.",20191008
4,National Security,Memo Shows White House Official’s Alarm at Trump-Zelensky Call,"President Trump’s July 25 phone call with his Ukrainian counterpart had so alarmed a White House official that he called a colleague at the CIA the next day to share his concerns, according to a memorandum.",20191008
5,Media & Marketing,Lions Gate Considers Spinning Off Starz Through Investment Vehicle,"Lions Gate is considering splitting off its Starz premium-cable channel into a separate company, as the studio looks to reduce its hefty debt load and allow shareholders to invest directly in either of the businesses.",20191008
6,Business,GM-UAW Contract Talks Zero In on Wages,"Reaching a resolution on wage increases is one of the few remaining obstacles to getting a new tentative labor pact for the auto company’s 46,000 full-time factory workers and ending a 23-day strike.",20191008
7,New York,New York City’s First Vaping-Related Death Is a Bronx Teen,"A Bronx 17-year-old is New York state’s first vaping-related death, according to New York Gov. Andrew Cuomo.",20191008
8,Corrections,Corrections & Amplifications,"Corrections & Amplifications for the edition of Oct. 9, 2019",20191008
9,Pro PE Deals,Popchips Finds a New Owner in VMG-Backed Velocity Snack Brands,Popchips has been acquired by a private-equity firm that plans to use it as the foundation for building a larger snack company.,20191008
10,Business,J&J Hit With $8 Billion Jury Award Over Antipsychotic Drug,A Philadelphia jury ordered Johnson & Johnson to pay $8 billion in damages to a man who said his use of J&J’s antipsychotic Risperdal caused enlarged breasts.,20191008
11,U.S.,"FBI Use of Surveillance Database Violated Privacy Rights, Court Ruled","Some of the FBI’s electronic surveillance activities violated the constitutional privacy rights of Americans swept up in a controversial foreign intelligence program, a surveillance court has ruled.",20191008
12,Future View,The State of Journalism,College students discuss what’s working and what’s not.,20191008
13,Review & Outlook,Impeachment in Secret,Closed hearings and selective leaks won’t persuade the public.,20191008
14,Review & Outlook,Reality High Court TV,Liberal Justices get a lesson on precedent during oral arguments.,20191008
15,Review & Outlook,The Courage of Their Brexit,Fading hopes for a deal will call bluffs in London and the EU.,20191008
16,Politics,Trump to Curb Use of Federal Guidance in Issuing Regulations,"President Trump is planning to sign a pair of executive orders meant to limit the use of a tool that the administration argues circumvents the federal rule-making process, according to administration officials.",20191008
17,Opinion,Trump Hasn’t Solved the Pipeline Crisis,Climate-change politics threaten American energy independence and could produce fuel shortages.,20191008
18,Upward Mobility,Harvard’s Asian Quotas Repeat an Ugly History,"Jews, long disfavored by elite universities, might find Judge Burroughs’s reasoning familiar.",20191008
19,Politics & Ideas,Watch Out for Elizabeth Warren,Her plans are more radical than anything Obama proposed. Are Americans ready?,20191008
20,Business World,The NBA Can Beat China,"If the offending tweet came from LeBron or Steph, the fight would already be over.",20191008
21,Opinion,When Sports Illustrated Was Great,Its covers adorned my boyhood walls in an era before ESPN.,20191008
22,Opinion,‘More From Less’ Review: Save the Planet With Capitalism,"Thanks to economic incentives and tech innovation, societies can ‘dematerialize’—make better stuff while consuming less material.",20191008
23,Heard on the Street,Investors Should Fear More Competition Among Ratings Companies,The arrival of challenger ratings company Kroll into Europe’s structured credit seems to confirm that new rivalries loosen credit standards.,20191008
24,Sports,U.S. Women’s Gymnastics Team Wins Fifth Consecutive World Title,"The U.S. women’s gymnastics team took its fifth consecutive world title Tuesday, anchored by superstar Simone Biles, in a dress rehearsal for the 2020 Olympic Games in Tokyo.",20191008
25,Opinion,New Problems with Elizabeth Warren’s Inequality Math,Just because the New York Times believes a tax claim doesn’t mean readers should.,20191008
26,Business,"U.S. Steel to Cut Costs, Swap CFO",United States Steel said it would impose a round of cost cuts and organizational changes days after committing $700 million to buy a stake in a lower-cost rival.,20191008
27,IPOs,Aramco IPO Prospectus Due to Be Published Before Month-End,The Saudi state oil company could float 1% to 2% of its shares on its domestic exchange by late November or early December.,20191008
28,U.S. Economy,Fed to Buy More Treasurys in Effort to Avoid Funding-Market Strains,Federal Reserve Chairman Jerome Powell said the central bank will soon increase its purchases of short-term Treasury securities.,20191008
29,Election 2020,What Could Shake Up the Democratic Presidential Primary? A Win.,"Joe Biden led the national polls most of the year. But with four months to go before voters weigh in, there is still plenty of time for a shake-up.",20191008
30,Politics,"Majority of Americans Back Trump Impeachment Probe, WSJ/NBC Poll Says","A majority of Americans say President Trump’s actions regarding Ukraine are a serious matter and merit an impeachment inquiry by Congress, but a plurality says that, based on what they know now, the president shouldn’t be removed from office, a new Wall Street Journal/NBC News poll finds.",20191008
31,Art Review,‘Thomas Joshua Cooper: The World’s Edge’ Review: Photography at the Extremes,"A collection of images captured by the artist, who travels—sometimes at great physical hazard—to the ends of the land masses around the Atlantic to take pictures with his cumbersome vintage camera.",20191008
32,Credit Markets,"China, Blue-Chip Companies Drive Bond Boom",Countries and companies across the globe boosted their issuance of new bonds while increased geopolitical turmoil whipsawed stock and debt markets in recent months.,20191008
33,Crime,New York City Sees Surge in Hate Crimes,"Hate crimes in New York City continue to rise, driven primarily by increases in anti-Semitic incidents but also by crimes targeting white people, black people and incidents related to sexual orientation, the NYPD said.",20191008
34,Tech,Activision Suspends Esports Player Who Backed Hong Kong Protesters,Activision Blizzard suspended an esports competitor from one of its tournaments for backing antigovernment protesters in Hong Kong as tensions intensify between Beijing and the NBA over a similar expression of support.,20191008
35,Commodities,Recent Pullback in Gold Could Provide Buying Opportunity,"Some analysts are viewing a recent pullback in gold prices as a buying opportunity, which could represent the latest example of bullion’s resilience this year. Gold for December delivery inched down Tuesday.",20191008
36,The A-hed,Don’t Be Alarmed By Armies of Tarantulas. They’re Just Looking for Love.,"Warm weather in the San Francisco Bay Area has extended the spider’s mating season, leading to efforts to rehab its image; ‘gentle giants’",20191008
37,Rich Zips,Where Tech Tycoons Live Outside Seattle,"The suburb of Medina, a quiet enclave on Lake Washington, is a paradise for billionaires.",20191008
38,Heard on the Street,Minding the GAAP Matters to Investors,Investors have reason to worry as creative accounting metrics have become more prevalent.,20191008
39,China,U.S. to Restrict Visas for Chinese Officials Linked to Abuse of Muslim Minorities,"The U.S. is imposing visa restrictions on Chinese officials linked to the abuse of Muslim minority groups in China’s Xinjiang region, where as many as a million people are detained in camps.",20191008
40,U.S. Markets,U.S. Stocks Fall on Trade Worries,U.S. stocks fell after a fresh flare-up in tensions between Washington and Beijing threatened to undermine this week’s trade talks.,20191008
41,Politics,Behind Trump’s Syria Pullout Lies a Campaign Pledge,"Faced with bipartisan condemnation for his latest effort to pull U.S. troops out of Syria, President Trump wants to make one thing clear: He is just keeping his word.",20191008
42,Crime,Man Accused of Killing Homeless Men Is Investigated for Separate Attack,"The man accused of killing four homeless men as they slept in New York is being investigated for an assault on another sleeping homeless man a week earlier, police officials said.",20191008
43,Markets,Fed Adds $76.4 Billion to Financial System in Latest Repo Transaction,"The Federal Reserve Bank of New York added $76.35 billion to the financial system Tuesday, using the market for repurchase agreements to relieve funding pressure in money markets.",20191008
44,Risk & Compliance Journal,Justice Department Issues Guidance on Inability-to-Pay Claims,The U.S. Justice Department on Tuesday issued guidance for federal prosecutors to use in cases where companies claim they can’t pay a criminal fine.,20191008
45,ETFs,ETF Firms Hit by E-Broker Price War,"Exchange-traded fund providers, such as BlackRock, have also been hit by fallout from the e-broker price war, which escalated in the days after Schwab’s decision to cut commissions to zero.",20191008
46,Commodities,Natural-Gas Producers Hard Hit by Tanking Prices,"Dragged down by a supply glut, U.S. natural-gas futures for November delivery recently suffered their longest losing streak since at least 1990, making pain for natural-gas investors and producers.",20191008
47,Logistics Report,"Tanker Owner Set Fire to Ship for $77 Million in Insurance, Court Says","A Greek shipowner was behind an elaborate fraud plan in 2011 to set fire to his own tanker off the coast of Yemen to collect $77 million in insurance, according to a High Court judge in London.",20191008
48,Stocks,Domino’s Shares Rebound Despite Sales-Growth Warning,Food-delivery companies continue to battle for market share.,20191008
49,Business,Boeing Logs First MAX Order Since April,"Boeing booked its first 737 MAX order since April but also reported cancellations for 22 of its 787 Dreamliners, which will leave the embattled aerospace giant seeking more customers for its twin-aisle jets",20191008
50,Pro Bankruptcy Bankruptcy,Arizona Wavers on Purdue Pharma Opioid Settlement Terms,"Arizona, an initial backer of Purdue Pharma’s proposed settlement of opioid-related claims from state and local governments, took aim at aspects of the deal, which has divided state attorneys general nationwide.",20191008
51,Heard on the Street,Domino’s Growth Story Is Getting Stale,"Even after lowered guidance, Domino’s shares trade at a very rich 22 times forward earnings, according to FactSet.",20191008
52,Earnings,Domino’s Tempers Outlook as Delivery Battle Heats Up,"Domino’s Pizza, the chain that helped popularize delivery, is losing sales to newer rivals for that business.",20191008
53,Business,"Oracle to Make 2,000 Hires in Cloud Push","Oracle Corp. plans to hire roughly 2,000 employees to bolster its cloud computing activities, underscoring how tech companies are ramping up their efforts to secure a larger share of the fast-growing and lucrative data-storage service business.",20191008
54,Opinion,Many Reasons to Wield a Trustbuster Sword,"There is another important similarity between the trustbusting of the early 20th and 21st centuries, beyond the fact that the large companies in both eras were more productive and lowered prices for consumers: politicians were also self-interested and initiated antitrust legislation out of spite.",20191008
55,Opinion,Most People Need Someone to Explain 403(b),I’m convinced that the vast majority of the 140 employees I enrolled in the 403(b) system wouldn’t have enrolled until much later (or ever) had I not been there to explain how their retirement benefits worked.,20191008
56,Opinion,Is Harvard’s Win on Race a Win for Society?,"The Constitution doesn’t guarantee diversity; it does guarantee equal protection, as do the federal civil-rights laws.",20191008
57,Opinion,Warren and the Destruction Of Creative Destruction,"Joseph Schumpeter believed that capitalism would be destroyed by its successes, that it would give rise to a large intellectual class that made its living broadsiding private property and freedom, as Sen. Elizabeth Warren epitomizes.",20191008
58,Opinion,"Ending Library Book Shame May Help, bur Fear Motivated","In a February 1961 post-midnight raid, East Orange, N.J., police arrested several borrowers in their homes for possessing books more than four months overdue.",20191008
59,Europe,"Britain, EU Trade Blows Ahead of Brexit Deadline",A leading EU official accused U.K. Prime Minister Boris Johnson of playing a “blame game” as the two parties went back and forth in advance of the Oct. 31 Brexit deadline.,20191008
60,Europe,Italy’s Parliament Approves Plan to Downsize Itself,The move to cut the number of lawmakers by more than a third is a victory for Italy’s antiestablishment 5 Star Movement and one that eliminates a potential source of friction in Prime Minister Giuseppe Conte’s new government.,20191008
61,Middle East,"In Syria, Kurdish Fighters Prepare to Battle Turkey as Residents Fret",Kurdish militants and residents of towns near Syria’s border with Turkey prepared for a Turkish incursion with a mix of defiance and unease after the sudden departure of U.S. troops from the area.,20191008
62,NBA,Nets Owner Joe Tsai Is Scrambling to Help Resolve NBA Dispute With China,Nets owner Joe Tsai has been tasked with helping resolve the NBA’s ongoing dispute with China.,20191008
63,U.S.,South Dakota Billionaire Gives $350 Million to National University,"T. Denny Sanford, the billionaire owner of First Premier Bank, has pledged $350 million to National University. The La Jolla, Calif.-based school that specializes in adult education will be renamed Sanford National University.",20191008
64,Overheard,The Last Microsoft Bear Logs Off,"With a ratings change at Jefferies, 94% of analysts covering the company now rate its stock as a ‘buy.’",20191008
65,Property Report,"Group Living Gets More Affordable, in 30 Square Feet","If successful, a few startups would be one of the first landlords in decades to bring low-priced housing to expensive U.S. cities without public subsidies.",20191008
66,New York,Charging Bull Covered With Fake Blood,"Policy arrested 30 protesters during a climate-change demonstration near lower Manhattan’s Charging Bull statue, which was covered with fake blood.",20191008
67,Real Estate,"Secret Manhattan Condo Purchases Are Dead, Thanks to a Suburban Squabble",A new state law threatens to upend Manhattan’s luxury condominium market by requiring that the names of all buyers will be publicly available under the state’s Freedom of Information Law.,20191008
68,Politics,U.S. Took Nearly a Million Migrants Into Custody in Last Fiscal Year,"U.S. Customs and Border Protection took into custody nearly a million migrants coming across the U.S.-Mexico border in the fiscal year ended in September, the highest number in a dozen years, according to the agency’s acting head, Mark Morgan.",20191008
69,Finance,Robinhood Joins the Online Cash War,"Robinhood Markets plans to offer a new higher-yielding cash account, in a bid to grow from its commission-free trading roots as bigger rivals scrap trading fees.",20191008
70,U.S. Economy,"Minnesota, Long a Bright Economic Star, Wonders What’s Next","A recent rise in Minnesota’s unemployment rate is raising the possibility that the state’s robust labor market may be faltering, and local business leaders are struggling to decipher the health of the economy and how it will affect companies.",20191008
71,Traveler's Tale,A Halloween Misadventure at Disneyland Paris,"After encountering French zombies and a parade of Disney villains, author Dan Kois and his family learn what happens when the magic runs out at the Magic Kingdom.",20191008
72,Food & Drink,Why You Should Be Eating More Cheddar,Forget the traffic-cone-orange stuff. American cheese makers are offering some pretty sharp product right now.,20191008
73,Sports,U.S. Olympic Leaders Relax Marketing Rules for Athletes,Olympians will be able to mention personal sponsors during Tokyo 2020 Games but deals will be subject to U.S. Olympic & Paralympic Committee approval.,20191008
74,Logistics Report,India Looks to Privatize Its Biggest Shipping Company,"The Indian government is again looking to sell its majority stake in the country’s biggest shipping company, but may face the same headwinds that have blocked past privatization efforts.",20191008
75,Europe,France Pays Tribute to Police Slain in Terror Attack,"French President Emmanuel Macron presided over a solemn memorial for the people killed in an attack on police headquarters last week, calling on the country to unite against terrorism.",20191008
76,Sports,Suspension Lifted for USA Skateboarding Official,"An investigation into Neal Hendrix, a founding member of the U.S. governing body for skateboarding who was accused of alleged misconduct, has been closed by the U.S. Center for SafeSport.",20191008
77,Sites & Sightings,Three Ways to Travel With (Happy) Kids,"These items make undertaking vacations with children more stylish, less stressful.",20191008
78,Asia,"Nissan Sets New Leadership to Confront Sales, Alliance Challenges",Nissan Motor named a new chief executive and said the company would be led by a three-person team that will try to reverse a profit slide and repair relations with alliance partner Renault.,20191008
79,Economy,IMF and World Bank’s New Leaders Warn of Deteriorating Global Outlook,"The new leaders of the International Monetary Fund and World Bank warned in twin speeches of a deteriorating global economic outlook, just a week before they will head the annual meetings of their institutions in Washington for the first time.",20191008
80,Business,Sony: Next PlayStation Coming Next Year,"Sony said it would release its next-generation videogame console, the PlayStation 5, in time for the 2020 year-end shopping season.",20191008
81,House Call,"For Fran Drescher, the Accent Is on Queens",‘The Nanny’ actress-comedian had a distinct voice growing up that became a valuable asset,20191008
82,Travel,Readers on the Road: Solo Travel Dispatches,WSJ readers shared their experiences traveling by themselves and offer some tips to those thinking of taking the plunge.,20191008
83,World,Nobel Prize in Physics Awarded for Advances in Cosmology,The prize was awarded to three scientists for work advancing the understanding of Earth’s place in the cosmos—from the history of the universe since the big bang to the first discovery of a planet outside our solar system.,20191008
84,MLB,Nats’ Strasburg Is on the Verge of Securing His Legacy,"Greatness was expected when Stephen Strasburg began his professional career. A decade later, he is fulfilling those expectations.",20191008
85,Real Estate,"Blackstone Sells Last of Record Office Purchase, Books a $7 Billion Profit",Blackstone Group LP turned the page on the largest real estate deal ever—its $39 billion purchase of Equity Office Properties Trust in 2007—booking a $7 billion profit last month after selling the last property in the deal.,20191008
86,House Of The Day,A Secluded Fishing Retreat Outside of Aspen,"Built in 2008, this sustainably designed mountain ranch features 1,050 feet of frontage along Colorado’s Roaring Fork River. It is listed for $11.95 million.",20191008
87,Metro Money,Brooklyn Office Space Available But Only for Cutting-Edge Startups,Co-working spaces at the New Lab in the Brooklyn Navy Yard are for startups in “frontier technology.” Among them is a designer of a 3D-printed fuel-efficient rocket engine and a biofab operation growing faux leather from collagen protein.,20191008
88,Tech,Facebook’s Libra Hits Extra Regulatory Roadblocks in Europe,"The European Union will introduce legislation aimed at preventing libra, Facebook’s proposed digital currency, from undermining Europe’s single currency and being used as a money-laundering tool—representing one of the toughest regulatory responses so far.",20191008
89,My Ride,Want to Sit in This Ultra-Rare Ferrari? Just Ask.,"When people ask about this 2003 Enzo sports car, one of 400 ever made, the owner offers to take their picture in the driver’s seat.",20191008
90,Slideshow,Photos: A Truly Uncommon Modern Ferrari,"Barry Lundgren shows off his 2003 Enzo Ferrari, a car with a top speed of nearly 220 miles per hour.",20191008
91,U.S. Economy,U.S. Producer Prices Unexpectedly Declined in September,"Prices that businesses receive for their goods and services unexpectedly fell in September, potentially dealing a setback to the Federal Reserve’s hopes of hitting its inflation target in coming quarters.",20191008
92,MoneyBeat,"Stocks to Watch: Domino’s Pizza, Constellation, Dollar Tree and More","Domino’s Pizza, Eros International, Constellation Brands, E*Trade and Dollar Tree are some of the companies with shares expected to trade actively in Tuesday’s session.",20191008
93,New York,Proposed Bill Aims to Combat Overdoses at New York Homeless Shelters,Homeless shelters would have to increase the level of on-site medical care they provide opioid-addicted clients under a bill being considered by the New York City Council.,20191008
94,Heard on the Street,Online Retailers Can Head to the Mall,Traditional stores are probably the best solution to falling profit margins at e-commerce companies like ASOS and Zalando.,20191008
95,WSJ Food Forum,"McDonald’s and Mondelez Say Taste, Not Health, Will Drive Sales","McDonald’s, the Big Mac purveyor, and Mondelez, maker of Oreos, say satisfying foods as opposed to healthy fare will continue to drive sales.",20191008
96,Streetwise,The Real Problem Central Bankers Face: The Rest of Us,Economic theory has taken central banks to the upside-down world of negative rates. Psychology is leading them to an even odder conclusion: perhaps the Federal Reserve needs to teach people to behave as the economic models require.,20191008
97,Credit Markets,Bond Funds Move Jumbo Trades Online,Innovations in the corporate debt market are helping bond traders make billion-dollar trades with the click of a mouse.,20191008
98,Europe,Syrian Suspect Detained in Germany After Hijacked Truck Rams Into Traffic,"Authorities in western Germany said they were holding a Syrian man suspected of hijacking a truck and ramming it into traffic, wounding eight people.",20191008
99,Heard on the Street,Apple Investors Take It to 11,"Wall Street initially set low targets for the iPhone 11, but Apple’s stock has jumped more than 4% since the new models went on sale.",20191008
100,Heard on the Street,Squeeze on U.S. Companies May Be Worse Than It Seems,"Looking at broad profit measures, American firms are in worse shape than the reported earnings of those on the stock market indicate.",20191008
101,Commercial Real Estate,Boston Fed President Warns of Co-Working Risks to Property Market,A Federal Reserve bank president who has been warning about prices rising too high in the commercial real-estate market has a new source of concern: co-working.,20191008
102,Business,Corporate Board Elections Get Less Cozy,"For decades, elections for corporate boards carried little suspense, and most candidates won by a landslide. But board votes are no longer such a sure thing.",20191008
103,Heard on the Street,Pickup in Lending Won’t Save Banks From Tough Quarter,"Loans are still growing decently for big U.S. banks, but that is small comfort against the backdrop of sharply falling rates.",20191008
104,World,Germany’s Apprentice Challenge: Finding Young Applicants,The vaunted German workforce training system has a problem: a shortage of young people seeking apprenticeships.,20191008
105,Family & Tech,Sleepovers Have Parents Worried About Gadget Use,"Some parents worry about what their children could be exposed to online late at night when over at a friend’s house, where the rules on internet access could be different from their own home.",20191008
106,Heard on the Street,The Rules of Kowtowing to Outrage in China Are Changing,American businesses now risk alienating their home base of fans over how they respond to a crisis in China.,20191008
107,U.S.,ACT to Allow Students to Retake Parts of College Entrance Exam,"The ACT plans to let students retake the portions of the test that they are unhappy with, as admissions face greater scrutiny.",20191008
108,Whats News World Wide,What’s News: World-Wide,What’s News: World-Wide,20191008
109,Whats News Business Finance,What’s News: Business & Finance,What’s News: Business & Finance,20191008
