,section,headline,summary,date
111,Whats News Business Finance,What’s News: Business & Finance,What’s News: Business & Finance,20190108
112,Business,Sears Gets Another Lifeline: Lampert’s $4.4 Billion Bid Still Alive,"A bid to rescue the retailer from bankruptcy proceedings by Sears Holdings former CEO Edward Lampert is still alive, as an auction is set for Jan. 14.",20190108
113,U.S.,Senate Democrats Block Legislation to Press GOP on Shutdown,"Senate Democrats blocked the chamber from considering foreign-policy legislation in a bid to pressure Republicans to reopen the government, hours before President Trump was to make a national appeal to end the stalemate on the grounds of national security.",20190108
114,World,Erdogan Rebuffs U.S. Call to Protect Kurds,"President Trump’s plans for a rapid withdrawal of American troops from Syria were thrown into disarray when Turkey’s president rejected a request to protect U.S. allies fighting in the region, and instead threatened military strikes against them.",20190108
115,Politics,Democrats Introduce Bill Expanding Background Checks on Gun Sales,Democrats’ long-pledged push to tighten the country’s gun laws will take center stage as lawmakers introduce legislation aimed at expanding background checks on gun sales.,20190108
116,U.S. Markets,Stocks Advance for a Third Session,"Shares jumped on signs the U.S. and China made progress during their trade negotiations, with major U.S. indexes climbing about 1%.",20190108
117,Politics,U.S. Sanctions Aim to Pressure Venezuela’s Maduro,The Treasury Department sanctioned a Venezuelan network that allowed the owner of media giant Globovision and several state-connected businesspeople to illicitly make billions in profits.,20190108
118,Tech,"Facebook, Twitter Turn to Right-Leaning Groups to Help Referee Political Speech","Advisers on touchy issues include Tony Perkins’ Family Research Council, Grover Norquist’s Americans for Tax Reform and, on the left, the Southern Poverty Law Center. Their involvement behind the scenes, designed to tamp down a furor over social media’s policing of content, has instead kicked up a new range of disputes.",20190108
119,The A-hed,Are Those Gold Teeth or Did You Just Eat in the Gaudiest Place on Earth?,"An edible-gold arms race is on in the United Arab Emirates, and the upscale treats can be a mess to eat. ‘I had gold all over my teeth and my mouth.’",20190108
120,House Call,Itzhak Perlman Became a Star on TV at Age 13,The violinist and conductor beat postwar poverty in Israel to become a 16-time Grammy winner and Presidential Medal of Freedom recipient.,20190108
121,College Football,How Clemson Emulated Silicon Valley to Win a National Title,Just as the technology business became known for the relative youth of its executives—valuing skill over experience—Clemson typifies the sport’s growing embrace of quarterbacks straight out of high school.,20190108
122,Life & Style,What’s the Rush? The Power of a Slow Morning,"As an antidote to our tech-obsessed society, slow-morning practitioners wake up early to meditate, read, exercise or do nothing at all.",20190108
123,Asia,North Korean Leader’s Beijing Visit Underscores China’s Pivotal Role,The timing of Kim Jong Un’s visit to Beijing at Chinese President Xi’s invitation suggests Beijing could see North Korea as leverage in its trade dispute with the U.S.,20190108
124,Property Report,"WarnerMedia Puts Its Stake in New HQ Building Up for Sale, Before It Moves In","WarnerMedia isn’t expected to move into its future Manhattan headquarters until later this year, but it is already looking to unload its stake in the brand-new building.",20190108
125,Personal Technology: Review,Tech That Will Change Your Life in 2019,"An annual roundup of the technology that will affect your life in the year ahead: Mobile 5G will finally make its U.S. debut, providing more reasons than ever to cut the cord, and of course Harry Potter will unite wizards and teach us the true meaning of augmented reality.",20190108
