,section,headline,summary,date
110,Business,U.S. Steel Boosts Revenue Outlook,"United States Steel Corp. said on Thursday that it expects to post better financial results than expected for its latest quarter, at a time when the company is planning to implement cost cuts and other organizational changes.",20191010
111,Economy,ECB Minutes Show Lagarde Will Inherit a Fractured Institution,"Top European Central Bank officials squabbled over key elements of the bank’s latest monetary stimulus package, according to minutes of the meeting, underscoring the challenge facing incoming President Christine Lagarde.",20191010
112,Gear & Gadgets,Why Smart Bike Helmets Are (Probably) Safer,These new connected devices help cyclists feel safer on city streets. Is that worth $249?,20191010
113,Credit Markets,Fed Adds $88.1 Billion to Financial System in Repo Transaction,"The Federal Reserve Bank of New York added $88.1 billion to the financial system Thursday, using the market for repurchase agreements, or repo, to relieve funding pressure in money markets.",20191010
114,Heard on the Street,Now Is the Best Season to Buy Airline Stocks,The winter low season is the worst time of the year for airlines—and the best time of the year for holders of airline stocks.,20191010
115,World,Ukrainian President Denies Trump Pressured Him During Call,Ukrainian President Volodymyr Zelensky denied that President Trump tried to pressure him during a July phone call that is now at the heart of an impeachment inquiry in Washington and a messy U.S. political scandal.,20191010
116,What's News,The Rise of Fancy Face Cream—for the Rest of Your Body,"An afterthought for too long, the skin below the neckline is getting new attention: High-end cosmetics companies are now making powerful creams that focus on the body",20191010
117,MoneyBeat,"Stocks to Watch: PG&E, Apple, AT&T, Target, American Airlines, Boeing","PG&E, Apple, AT&T, Target, American Airlines and Boeing are some of the companies with shares expected to trade actively in Thursday’s session.",20191010
118,Election 2020,Trump Campaign Sees Impeachment Motivating Base,"President Trump and his advisers have calculated that mounting a partisan battle over impeachment will energize the base, but some Republicans worry about alienating independents.",20191010
119,Economy,Fed's Kaplan: Reserving Judgment on Need for Another Rate Cut,"Dallas Fed President Robert Kaplan said Thursday the central bank’s two rate cuts thus far this year were the right thing to do, but he’s reserving judgment about what should happen next.",20191010
120,Management & Careers,Meet the Starbucks CEO Who Has to Follow Howard Schultz,"Kevin Johnson discusses his management style, his handling of a national controversy and his coffee routine; a triple espresso, followed by a French press, then a flat white",20191010
121,Heard on the Street,"At Louis Vuitton, Hong Kong’s Loss Is Other Cities’ Gain",The first luxury company to report quarterly sales since Hong Kong’s pro-democracy protests kicked off has emerged completely unscathed.,20191010
122,MLB,Another Season Ends in Devastating Fashion for the Dodgers,"After winning 106 games during the regular season, the Los Angeles Dodgers didn’t just fail to win the World Series. They failed even to make it out of the division round.",20191010
123,China,Hong Kong Unrest an Ominous Lesson on Chinese Rule: Taiwan Leader,"In a fiery speech likely to upset Beijing, Taiwan President Tsai Ing-wen called on the island’s people to draw lessons from the violent protests in Hong Kong and pledged to defend Taiwan’s sovereignty.",20191010
124,Logistics Report,"E-Commerce Driving Bigger Demand for Smaller Warehouses, CBRE Says",Demand for smaller warehouses is soaring as e-commerce and the push for faster delivery accelerates competition for industrial space close to major population centers.,20191010
125,Heard on the Street,Japan’s Foreign-Investor Screening Risks Undoing Years of Reform,National-security proposals to screen foreign shareholders far more tightly would frustrate a surprising proportion of overseas investors.,20191010
126,Business,"Exploding Kittens Draws Funding to Create More Games, Explore Entertainment","The company behind Exploding Kittens, the popular card game that combines whimsical drawings of felines with cutthroat strategy, has sold a $30 million minority stake to a prominent media investor to help fund future growth.",20191010
127,Europe,How a Member of French Intelligence Turned to Terror,"As police intelligence agents in Paris tracked Islamist radicals over the summer, one of their longtime colleagues was quietly embracing a more extreme version of his Muslim faith.",20191010
128,U.S.,Trump Signs Off on Licenses for Doing Business With Huawei,The White House has signed off on special licenses for some U.S. companies to do some business with Chinese telecom giant Huawei.,20191010
129,Pepper & Salt,Pepper...and Salt,Pepper...and Salt,20191010
130,Whats News Business Finance,What’s News: Business & Finance,What’s News: Business & Finance,20191010
131,Whats News World Wide,What’s News: World-Wide,What’s News: World-Wide,20191010
132,Politics,"Indicted Florida Pair Known for Flashy Style, Claim of Trump Ties","Lev Parnas and Igor Fruman, indicted on campaign finance violation charges that include channeling foreign money into U.S. politics, described their close ties to politicians including President Trump.",20191010
133,Politics,Two Men Who Helped Giuliani on Ukraine Arrested,Prosecutors say Lev Parnas and Igor Fruman were part of a conspiracy to funnel foreign money into U.S. elections. The men also helped Rudy Giuliani’s efforts to investigate Joe Biden.,20191010
134,Economy,"Fed’s Kashkari: If Data Continues As It Has, Another Rate Cut Is Warranted","Minneapolis Fed leader Neel Kashkari said Thursday that the time has probably passed for the central bank to use a supersize rate cut to boost the economy, but he remains on board with the idea that cheaper borrowing costs are still warranted.",20191010
135,Business,NBCU Cable Networks Refuse to Air Trump Campaign Ad Aimed at Joe Biden,"Comcast’s NBCUniversal won’t air a Trump re-election campaign ad on any of its cable networks unless changes are made to the spot, according to a person familiar with NBCU.",20191010
136,Tech,Live Stream of Germany Shooting Turns Spotlight to Amazon’s Twitch,"Amazon.com Inc.’s Twitch has become a go-to place to watch people play videogames, but this week that same platform broadcast a horrific crime that highlights the challenge of preventing extremists from showing their violent acts in real time.",20191010
137,Politics,Trump to Meet With China’s Top Trade Negotiator on Friday,U.S.-China trade talks kicked off amid expectations that Beijing’s emissaries are ready to offer compromises aimed at getting President Trump to hold off on tariff increases set to take effect next week and in December.,20191010
138,Middle East,Turkey’s Erdogan Threatens EU With Wave of Refugees,"President Recep Tayyip Erdogan urged the U.S. and other NATO allies to back Turkey’s military offensive in Syria, threatening to allow waves of Syrian refugees to head for European shores if his country doesn’t receive adequate support.",20191010
139,Tech,"Apple, Google Pull Hong Kong Protest Apps After China Uproar","Apple and Google both removed apps associated with Hong Kong’s antigovernment protests from their digital stores in recent days, thrusting the two Silicon Valley giants into controversy related to the unrest.",20191010
140,U.S. Markets,Stocks Climb on Trump’s Plan to Meet With China Trade Negotiator,"U.S. stocks rallied after President Trump said he would meet with a key Chinese official for talks Friday, the latest example of trade hopes boosting global markets.",20191010
141,Politics,White House Shifted Authority Over Ukraine Aid Amid Legal Concerns,"The White House gave a politically appointed official the authority to keep aid to Ukraine on hold after career budget staff questioned the legality of delaying the funds, a shift that House Democrats are probing in their impeachment inquiry.",20191010
142,Homes,WeWork Founder Adam Neumann’s Trove of Pricey Properties,"In good times, the entrepreneur borrowed hundreds of millions, snapped up at least six homes, and was eyeing more. Then last month happened.",20191010
143,NBA,The 7-foot-6 Man Caught Between the NBA and China,Yao Ming played for the Houston Rockets. Now he’s the chairman of the Chinese Basketball Association. He could play the role of the world’s tallest intermediary in this dispute.,20191010
144,NBA,NBA China Game Goes On as Tensions Persist,"After nearly a week of uncertainty as the NBA and China engaged in a tense standoff, an exhibition game between the Los Angeles Lakers and Brooklyn Nets went ahead as planned—but with unusual restrictions that kept NBA players and executives from speaking to the media.",20191010
145,Art,An Expanded MoMA Adds More Women Artists,"The Museum of Modern Art re-opens after a $450 million expansion, with more works by women and overlooked artists in galleries that mix painting, sculpture and other media.",20191010
146,Tech,Political Campaigns Know Where You’ve Been. They’re Tracking Your Phone.,"Voter targeting has grown more invasive with location data that apps can transmit from cellphones. The data allows political groups to track down voters based on places they’ve been, including rallies, churches and gun clubs.",20191010
147,Europe,Germany’s Jews Feel ‘Under Siege’ Following Rise in Anti-Semitism,"A day after an attack on a synagogue left two dead in Halle, eastern Germany, Jews across the country said they felt increasingly under siege from growing anti-Semitism across German society.",20191010
148,The Future of Everything,Doctors Look to Eye-Tracking to Improve Care,Startups are using technology that follows the movement of the eye to diagnose nearsightedness and help people with disabilities.,20191010
149,The A-Hed,Going Apple Picking? Don’t Count on Picking an Apple.,"Orchards lure families with petting zoos, zip lines, go-karts and face-painting. ‘We are in the entertainment business now,’ says one farmer.",20191010
